,title,track,categories,url,desc
21,Counterfactual Explanations for Optimization-Based Decisions in the Context of the GDPR,Main,['Scheduling'],https://www.ijcai.org/proceedings/2021/564,"The General Data Protection Regulations (GDPR) entitle individuals to explanations for automated decisions. The form, comprehensibility, and even existence of such explanations remain open problems, investigated as part of explainable AI. We adopt the approach of counterfactual explanations and apply it to decisions made by declarative optimization models. We argue that inverse combinatorial optimization is particularly suited for counterfactual explanations but that the computational difficulties and relatively nascent literature make its application a challenge. To make progress, we address the case of counterfactual explanations that isolate the minimal differences for an individual. We show that under two common optimization functions, full inverse optimization is unnecessary. In particular, we show that for functions of the form of the sum of weighted binary variables, which includes frameworks such as weighted MaxSAT, a solution can be found by solving a slightly modified version of the original optimization model. In contrast, the sum of weighted integer variables can be solved with a binary search over a series of modifications to the original model."
22,LTL-Constrained Steady-State Policy Synthesis,Main,['Markov Decisions Processes'],https://www.ijcai.org/proceedings/2021/565,"Decision-making policies for agents are often synthesized with the constraint that a  formal specification of behaviour is satisfied. Here we focus on infinite-horizon properties. On the one hand,  Linear Temporal Logic (LTL) is a popular example of a formalism for qualitative specifications. On the other hand, Steady-State Policy Synthesis (SSPS) has recently received considerable attention as it provides a more quantitative and more behavioural perspective on specifications, in terms of the frequency with which states are visited. Finally, rewards provide a classic framework for quantitative properties. In this paper, we study Markov decision processes (MDP) with the specification combining all these three types. The derived policy maximizes the reward among all policies ensuring the LTL specification with the given probability and adhering to the steady-state constraints. To this end, we provide a unified solution reducing the multi-type specification to a multi-dimensional long-run average reward. This is enabled by Limit-Deterministic Büchi Automata (LDBA), recently studied in the context of LTL model checking on MDP, and allows for an elegant solution through a simple linear programme. The algorithm also extends to the general omega-regular properties and runs in time polynomial in the sizes of the MDP as well as the LDBA."
23,Online Learning of Action Models for PDDL Planning,Main,"['Model-Based Reasoning', 'Planning Algorithms', 'Planning and Scheduling']",https://www.ijcai.org/proceedings/2021/566,"The automated learning of action models is widely recognised as a key and compelling challenge to address the difficulties of the manual specification of planning domains. Most state-of-the-art methods perform this learning offline from an input set of plan traces generated by the execution of (successful) plans.  However, how to generate informative plan traces for learning action models is still an open issue. Moreover, plan traces might not be available for a new environment. In this paper, we propose an algorithm for learning action models online, incrementally during the execution of plans. Such plans are generated to achieve goals that the algorithm decides online in order to obtain informative plan traces and reach states from which useful information can be learned. We show some fundamental theoretical properties of the algorithm, and we experimentally evaluate the online learning of the action models over a large set of IPC domains."
24,Polynomial-Time in PDDL Input Size: Making the Delete Relaxation Feasible for Lifted Planning,Main,"['Planning Algorithms', 'Search in Planning and Scheduling']",https://www.ijcai.org/proceedings/2021/567,"Polynomial-time heuristic functions for planning are commonplace since 20 years. But polynomial-time in which input? Almost all existing approaches are based on a grounded task representation, not on the actual PDDL input which is exponentially smaller. This limits practical applicability to cases where the grounded representation is ""small enough"". Previous attempts to tackle this problem for the delete relaxation leveraged symmetries to reduce the blow-up. Here we take a more radical approach, applying an additional relaxation to obtain a heuristic function that runs in time polynomial in the size of the PDDL input. Our relaxation splits the predicates into smaller predicates of fixed arity K. We show that computing a relaxed plan is still NP-hard (in PDDL input size) for K>=2, but is polynomial-time for K=1. We implement a heuristic function for K=1 and show that it can improve the state of the art on benchmarks whose grounded representation is large."
25,Anytime Multi-Agent Path Finding via Large Neighborhood Search,Main,['Search in Planning and Scheduling'],https://www.ijcai.org/proceedings/2021/568,"Multi-Agent Path Finding (MAPF) is the challenging problem of computing collision-free paths for multiple agents. Algorithms for solving MAPF can be categorized on a spectrum. At one end are (bounded-sub)optimal algorithms that can find high-quality solutions for small problems. At the other end are unbounded-suboptimal algorithms that can solve large problems but usually find low-quality solutions. In this paper, we consider a third approach that combines the best of both worlds: anytime algorithms that quickly find an initial solution using efficient MAPF algorithms from the literature, even for large problems, and that subsequently improve the solution quality to near-optimal as time progresses by replanning subgroups of agents using Large Neighborhood Search. We compare our algorithm MAPF-LNS against a range of existing work and report significant gains in scalability, runtime to the initial solution, and speed of improving the solution."
26,Dynamic Rebalancing Dockless Bike-Sharing System based on Station Community Discovery,Main,"['Applications of Planning', 'Planning and Scheduling']",https://www.ijcai.org/proceedings/2021/569,"Influenced by the era of the sharing economy and mobile payment, Dockless Bike-Sharing System (Dockless BSS) is expanding in many major cities. The mobility of users constantly leads to supply and demand imbalance, which seriously affects the total profit and customer satisfaction. In this paper, we propose the Spatio-Temporal Mixed Integer Program (STMIP) with Flow-graphed Community Discovery (FCD) approach to rebalancing the system. Different from existing studies that ignore the route of trucks and adopt a centralized rebalancing, our approach considers the spatio-temporal information of trucks and discovers station communities for truck-based rebalancing. First, we propose the FCD algorithm to detect station communities. Significantly, rebalancing communities decomposes the centralized system into a distributed multi-communities system. Then, by considering the routing and velocity of trucks, we design the STMIP model with the objective of maximizing total profit, to find a repositioning policy for each station community. We design a simulator built on real-world data from DiDi Chuxing to test the algorithm performance. The extensive experimental results demonstrate that our approach outperforms in terms of service level, profit, and complexity compared with the state-of-the-art approach."
27,Synthesizing Good-Enough Strategies for LTLf Specifications,Main,"['Applications of Planning', 'Planning and Scheduling', 'Temporal and Hybrid Planning']",https://www.ijcai.org/proceedings/2021/570,"We consider the problem of synthesizing good-enough (GE)-strategies for linear temporal logic (LTL) over finite traces or LTLf for short. The problem of synthesizing GE-strategies for an LTL formula φ over infinite traces reduces to the problem of synthesizing winning strategies for the formula (∃Oφ)⇒φ where O is the set of propositions controlled by the system. We first prove that this reduction does not work for LTLf formulas. Then we show how to synthesize GE-strategies for LTLf formulas via the Good-Enough (GE)-synthesis of LTL formulas. Unfortunately, this requires to construct deterministic parity automata on infinite words, which is computationally expensive. We then show how to synthesize GE-strategies for LTLf formulas by a reduction to solving games played on deterministic Büchi automata, based on an easier construction of deterministic automata on finite words. We show empirically that our specialized synthesis algorithm for GE-strategies outperforms the algorithms going through GE-synthesis of LTL formulas by orders of magnitude."
28,Change the World - How Hard Can that Be? On the Computational Complexity of Fixing Planning Models,Main,"['Hierarchical Planning', 'Model-Based Reasoning', 'Theoretical Foundations of Planning']",https://www.ijcai.org/proceedings/2021/571,"Incorporating humans into AI planning is an important feature of flexible planning technology. Such human integration allows to incorporate previously unknown constraints, and is also an integral part of automated modeling assistance. As a foundation for integrating user requests, we study the computational complexity of determining the existence of changes to an existing model, such that the resulting model allows for specific user-provided solutions. We are provided with a planning problem modeled either in the classical (non-hierarchical) or hierarchical task network (HTN) planning formalism, as well as with a supposed-to-be solution plan, which is actually not a solution for the current model. Considering changing decomposition methods as well as preconditions and effects of actions, we show that most change requests are NP-complete though some turn out to be tractable."
29,Learning Temporal Plan Preferences from Examples: An Empirical Study,Main,['Planning and Scheduling'],https://www.ijcai.org/proceedings/2021/572,"Temporal plan preferences are natural and important in a variety of applications. Yet users often find it difficult to formalize their preferences. Here we explore the possibility to learn preferences from example plans. Focusing on one preference at a time, the user is asked to annotate examples as good/bad. We leverage prior work on LTL formula learning to extract a preference from these examples. We conduct an empirical study of this approach in an oversubscription planning context, using hidden target formulas to emulate the user preferences. We explore four different methods for generating example plans, and evaluate performance as a function of domain and formula size. Overall, we find that reasonable-size target formulas can often be learned effectively."
30,On Weak Stubborn Sets in Classical Planning,Main,"['Planning Algorithms', 'Search in Planning and Scheduling', 'Theoretical Foundations of Planning']",https://www.ijcai.org/proceedings/2021/573,"Stubborn sets are a pruning technique for state-space search which is well established in optimal classical planning. In this paper, we show that weak stubborn sets introduced in recent work in planning are actually not weak stubborn sets in Valmari's original sense. Based on this finding, we introduce weak stubborn sets in the original sense for planning by providing a generalized definition analogously to generalized strong stubborn sets in previous work. We discuss the relationship of strong, weak and the previously called weak stubborn sets, thus providing a further step in getting an overall picture of the stubborn set approach in planning."
31,Learning Generalized Unsolvability Heuristics for Classical Planning,Main,['Planning and Scheduling'],https://www.ijcai.org/proceedings/2021/574,"Recent work in classical planning has introduced dedicated techniques for detecting unsolvable states, i.e., states from which no goal state can be reached. We approach the problem from a generalized planning perspective and learn first-order-like formulas that characterize unsolvability for entire planning domains. We show how to cast the problem as a self-supervised classification task. Our training data is automatically generated and labeled by exhaustive exploration of small instances of each domain, and candidate features are automatically computed from the predicates used to define the domain. We investigate three learning algorithms with different properties and compare them to heuristics from the literature. Our empirical results show that our approach often captures important classes of unsolvable states with high classification accuracy. Additionally, the logical form of our heuristics makes them easy to interpret and reason about, and can be used to show that the characterizations learned in some domains capture exactly all unsolvable states of the domain."
32,Solving Partially Observable Stochastic Shortest-Path Games,Main,['Planning with Incomplete Information'],https://www.ijcai.org/proceedings/2021/575,"We study the two-player zero-sum extension of the partially observable stochastic shortest-path problem where one agent has only partial information about the environment. We formulate this problem as a partially observable stochastic game (POSG): given a set of target states and negative rewards for each transition, the player with imperfect information maximizes the expected undiscounted total reward until a target state is reached. The second player with the perfect information aims for the opposite.  We base our formalism on POSGs with one-sided observability (OS-POSGs) and give the following contributions: (1) we introduce a novel heuristic search value iteration algorithm that iteratively solves depth-limited variants of the game, (2) we derive the bound on the depth guaranteeing an arbitrary precision, (3) we propose a novel upper-bound estimation that allows early terminations, and (4) we experimentally evaluate the algorithm on a pursuit-evasion game."
33,The Fewer the Merrier: Pruning Preferred Operators with Novelty,Main,"['Planning and Scheduling', 'Search in Planning and Scheduling']",https://www.ijcai.org/proceedings/2021/576,"Heuristic search is among the best performing approaches to classical satisficing planning, with its performance heavily relying on informative and fast heuristics, as well as search-boosting and pruning techniques. While both heuristics and pruning techniques have gained much attention recently, search-boosting techniques in general, and preferred operators in particular have received less attention in the last decade.   Our work aims at bringing the light back to preferred operators research, with the introduction of preferred operators pruning technique, based on the concept of novelty. Continuing the research on novelty with respect to an underlying heuristic, we present the definition of preferred operators for such novelty heuristics. For that, we extend the previously defined concepts to operators, allowing us to reason about the novelty of the preferred operators. Our experimental evaluation shows the practical benefit of our suggested approach, compared to the currently used methods."
34,TANGO: Commonsense Generalization in Predicting Tool Interactions for Mobile Manipulators,Main,['Robot Planning'],https://www.ijcai.org/proceedings/2021/577,"Robots assisting us in factories or homes must learn to make use of objects as tools to perform tasks, e.g., a tray for carrying objects. We consider the problem of learning commonsense knowledge of when a tool may be useful and how its use may be composed with other tools to accomplish a high-level task instructed by a human. We introduce TANGO, a novel neural model for predicting task-specific tool interactions. TANGO is trained using demonstrations obtained from human teachers instructing a virtual robot in a physics simulator. TANGO encodes the world state consisting of objects and symbolic relationships between them using a graph neural network. The model learns to attend over the scene using knowledge of the goal and the action history, finally decoding the symbolic action to execute. Crucially, we address generalization to unseen environments where some known tools are missing, but alternative unseen tools are present. We show that by augmenting the representation of the environment with pre-trained embeddings derived from a knowledge-base, the model can generalize effectively to novel environments. Experimental results show a 60.5-78.9% improvement over the baseline in predicting successful symbolic plans in unseen settings for a simulated mobile manipulator."
35,The Traveling Tournament Problem with Maximum Tour Length Two: A Practical Algorithm with An Improved  Approximation Bound,Main,"['Planning Algorithms', 'Scheduling', 'Theoretical Foundations of Planning']",https://www.ijcai.org/proceedings/2021/578,"The Traveling Tournament Problem is a well-known benchmark problem in tournament timetabling, which asks us to design a schedule of home/away games of n teams (n is even) under some feasibility requirements such that the total traveling distance of all the n teams is minimized. In this paper, we study TTP-2, the traveling tournament problem where at most two consecutive home games or away games are allowed, and give an effective algorithm for n/2 being odd. Experiments on the well-known benchmark sets show that we can beat previously known solutions for all instances with n/2 being odd by an average improvement of 2.66%. Furthermore, we improve the theoretical approximation ratio from 3/2+O(1/n) to 1+O(1/n) for n/2 being odd, answering a challenging open problem in this area."
36,Non-Parametric Stochastic Sequential Assignment With Random Arrival Times,Main,['Planning and Scheduling'],https://www.ijcai.org/proceedings/2021/579,"We consider a problem wherein jobs arrive at random times and assume random values. Upon each job arrival, the decision-maker must decide immediately whether or not to accept the job and gain the value on offer as a reward, with the constraint that they may only accept at most n jobs over some reference time period. The decision-maker only has access to M independent realisations of the job arrival process. We propose an algorithm, Non-Parametric Sequential Allocation (NPSA), for solving this problem. Moreover, we prove that the expected reward returned by the NPSA algorithm converges in probability to optimality as M grows large. We demonstrate the effectiveness of the algorithm empirically on synthetic data and on public fraud-detection datasets, from where the motivation for this work is derived."
37,Multi-agent Approach to Resource Allocation in Autonomous Vehicle Fleets,Doctoral Consortium,['Planning and Scheduling'],https://www.ijcai.org/proceedings/2021/671,"The development of autonomous vehicles, capable of peer-to-peer communication, as well as the interest in on-demand solutions, are the primary motivations for this study. In the absence of central control, we are interested in forming a fleet of autonomous vehicles capable of responding to city-scale travel demands.  Typically, this problem is solved centrally; this implies that the vehicles have continuous access to a dispatching portal. However, such access to such a global switching infrastructure (for data collection and order delivery) is costly and represents a critical bottleneck. The idea is to use low-cost vehicle-to-vehicle (V2V) communication technologies to coordinate vehicles without a global communication infrastructure. We propose to model the different aspects of decision and optimization problems related to this more general problem. After modeling these problems, the question arises as to the choice of centralized and decentralized solution methods. Methodologically, we explore the directions and compare the performance of distributed constraint optimization techniques (DCOP), self-organized multi-agent techniques, market-based approaches, and centralized operations research solutions."
38,Planning and Reinforcement Learning for General-Purpose Service Robots,Doctoral Consortium,['Robot Planning'],https://www.ijcai.org/proceedings/2021/679,"Despite recent progress in AI and robotics research, especially learned robot skills, there remain significant challenges in building robust, scalable, and general-purpose systems for service robots. This Ph.D. research aims to combine symbolic planning and reinforcement learning to reason about high-level robot tasks and adapt to the real world. We will introduce task planning algorithms that adapt to the environment and other agents, as well as reinforcement learning methods that are practical for service robot systems. Taken together, this work will make a significant step towards creating general-purpose service robots."
39,AI for Planning Public Health Interventions,Doctoral Consortium,"['Planning and Scheduling', 'Markov Decisions Processes']",https://www.ijcai.org/proceedings/2021/682,"Several scenarios involving public health interventions have a unifying underlying theme, that deals with the challenge of optimizing the limited intervention resources available.  My dissertation casts this as a  Restless  Multi-Armed  Bandit  (RMAB) planning problem, identifying and addressing several new, fundamental questions in RMABs."
40,Data Efficient Algorithms and Interpretability Requirements for Personalized Assessment of Taskable AI Systems,Doctoral Consortium,['Model-Based Reasoning'],https://www.ijcai.org/proceedings/2021/693,"The vast diversity of internal designs of black-box AI systems and their nuanced zones of safe functionality make it difficult for a layperson to use them without unintended side effects. The focus of my dissertation is to develop algorithms and requirements of interpretability that would enable a user to assess and understand the limits of an AI system's safe operability. We develop an assessment module that lets an AI system execute high-level instruction sequences in simulators and answer the user queries about its execution of sequences of actions. Our results show that such a primitive query-response capability is sufficient to efficiently derive a user-interpretable model of the system in stationary, fully observable, and deterministic settings."
41,An Automated Framework for Supporting Data-Governance Rule Compliance in Decentralized MIMO Contexts,Doctoral Consortium,['Model-Based Reasoning'],https://www.ijcai.org/proceedings/2021/696,"We propose Dr.Aid, a logic-based AI framework for automated compliance checking of data governance rules over data-flow graphs. The rules are modelled using a formal language based on situation calculus and are suitable for decentralized contexts with multi-input-multi-output (MIMO) processes. Dr.Aid models data rules and flow rules and checks compliance by reasoning about the propagation, combination, modification and application of data rules over the data flow graphs. Our approach is driven and evaluated by real-world datasets using provenance graphs from data-intensive research."
42,Intelligent and Learning Agents: Four Investigations,Early Career,"['Markov Decisions Processes', 'Applications of Planning']",https://www.ijcai.org/proceedings/2021/700,"My research is driven by my curiosity about the nature of intelligence. Of the several aspects that characterise the behaviour of intelligent agents, I primarily study sequential decision making, learning, and exploration. My interests also extend to broader questions on the effects of AI on life and society. In this paper, I present four distinct investigations drawn from my recent work, which range from theoretical to applied, and which involve both analysis and design. I also share my outlook as an early-career researcher."
43,"Width-Based Algorithms for Common Problems in Control, Planning and Reinforcement Learning",Early Career,"['General', 'Planning Algorithms', 'Theoretical Foundations of Planning', 'Applications of Planning']",https://www.ijcai.org/proceedings/2021/702,"Width-based algorithms search for solutions through a general definition of state novelty. These algorithms have been shown to result in state-of-the-art performance in classical planning, and have been successfully applied to model-based and model-free settings where the dynamics of the problem are given through simulation engines. Width-based algorithms performance is understood theoretically through the notion of planning width, providing polynomial guarantees on their runtime and memory consumption. To facilitate synergies across research communities, this paper summarizes the area of width-based planning, and surveys current and future research directions."
44,Connect Multi-Agent Path Finding: Generation and Visualization,Demo,['General'],https://www.ijcai.org/proceedings/2021/714,We present a generic tool to visualize missions of the Connected Multi-Agent Path Finding (CMAPF) problem.  This problem is a variant of MAPF which requires a group of agents to navigate from an initial configuration to a goal configuration while maintaining connection. The user can create an instance of CMAPF and can play the generated plan. Any algorithm for CMAPF can be plugged into the tool.
