,title,track,categories,url,desc
0,Online Selection of Diverse Committees,Main,"['Markov Decisions Processes', 'Applications of Planning']",https://www.ijcai.org/proceedings/2021/22,"Citizens' assemblies need to represent subpopulations according to their proportions in the general population. These large committees are often constructed in an online fashion by contacting people, asking for the demographic features of the volunteers, and deciding to include them or not. This raises a trade-off between the number of people contacted (and the incurring cost) and the representativeness of the committee. We study three methods, theoretically and experimentally: a greedy algorithm that includes volunteers as long as proportionality is not violated; a non-adaptive method that includes a volunteer with a probability depending only on their features, assuming that the joint feature distribution in the volunteer pool is known; and a reinforcement learning based approach when this distribution is not known a priori but learnt online."
1,State-Aware Value Function Approximation with Attention Mechanism for Restless Multi-armed Bandits,Main,"['Planning and Scheduling', 'Markov Decisions Processes']",https://www.ijcai.org/proceedings/2021/64,"The restless multi-armed bandit (RMAB) problem is a generalization of the multi-armed bandit with non-stationary rewards. Its optimal solution is intractable due to exponentially large state and action spaces with respect to the number of arms. Existing approximation approaches, e.g., Whittle's index policy, have difficulty in capturing either temporal or spatial factors such as impacts from other arms. We propose considering both factors using the attention mechanism, which has achieved great success in deep learning. Our state-aware value function approximation solution comprises an attention-based value function approximator and a Bellman equation solver. The attention-based coordination module capture both spatial and temporal factors for arm coordination. The Bellman equation solver utilizes the decoupling structure of RMABs to acquire solutions with significantly reduced computation overheads. In particular, the time complexity of our approximation is linear in the number of arms. Finally, we illustrate the effectiveness and investigate the properties of our proposed method with numerical experiments."
2,Bounded-cost Search Using Estimates of Uncertainty,Main,['Search in Planning and Scheduling'],https://www.ijcai.org/proceedings/2021/231,"Many planning problems are too hard to solve optimally.  In bounded-cost search, one attempts to find, as quickly as possible, a plan that costs no more than a user-provided absolute cost bound.  Several algorithms have been previously proposed for this setting, including Potential Search (PTS) and Bounded-cost Explicit Estimation Search (BEES).  BEES attempts to improve on PTS by predicting whether nodes will lead to plans within the cost bound or not.  This paper introduces a relatively simple algorithm, Expected Effort Search (XES), which uses not just point estimates but belief distributions in order to estimate the probability that a node will lead to a plan within the bound.  XES's expansion order minimizes expected search time in a simplified formal model.  Experimental results on standard planning and search benchmarks show that it consistently exhibits strong performance, outperforming both PTS and BEES.  We also derive improved variants of BEES that can exploit belief distributions.  These new methods advance the recent trend of taking advantage of uncertainty estimates in deterministic single-agent search."
3,Best-Effort Synthesis: Doing Your Best Is Not Harder Than Giving Up,Main,['Theoretical Foundations of Planning'],https://www.ijcai.org/proceedings/2021/243,"We study best-effort synthesis under environment assumptions specified in LTL, and show that this problem has exactly the same computational complexity of standard LTL synthesis: 2EXPTIME-complete. We provide optimal algorithms for computing best-effort strategies, both in the case of LTL over infinite traces and LTL over finite traces (i.e., LTLf). The latter are particularly well suited for implementation."
4,Finite-Trace and Generalized-Reactivity Specifications in Temporal Synthesis,Main,['Theoretical Foundations of Planning'],https://www.ijcai.org/proceedings/2021/255,"Linear Temporal Logic (LTL) synthesis aims at automatically synthesizing a program that complies with desired properties expressed in LTL. Unfortunately it has been proved to be too difficult computationally to perform full LTL synthesis. There have been two success stories with LTL synthesis, both having to do with the form of the specification. The first is the GR(1) approach: use safety conditions to determine the possible transitions in a game between the environment and the agent, plus one powerful notion of fairness, Generalized Reactivity(1), or GR(1). The second, inspired by AI planning, is focusing on finite-trace temporal synthesis, with LTLf (LTL on finite traces) as the specification language. In this paper we take these two lines of work and bring them together. We first study the case in which we have an LTLf agent goal and a GR(1) assumption. We then add to the framework safety conditions for both the environment and the agent, obtaining a highly expressive yet still scalable form of LTL synthesis."
5,Efficient PAC Reinforcement Learning in Regular Decision Processes,Main,['Markov Decisions Processes'],https://www.ijcai.org/proceedings/2021/279,"Recently regular decision processes have been proposed as a well-behaved form of non-Markov decision process. Regular decision processes are characterised by a transition function and a reward function that depend on the whole history, though regularly (as in regular languages). In practice both the transition and the reward functions can be seen as finite transducers. We study reinforcement learning in regular decision processes. Our main contribution is to show that a near-optimal policy can be PAC-learned in polynomial time in a set of parameters that describe the underlying decision process. We argue that the identified set of parameters is minimal and it reasonably captures the difficulty of a regular decision process."
6,Transforming Robotic Plans with Timed Automata to Solve Temporal Platform Constraints,Main,['Temporal and Hybrid Planning'],https://www.ijcai.org/proceedings/2021/287,"Task planning for mobile robots typically uses an abstract planning domain that ignores the low-level details of the specific robot platform. Therefore, executing a plan on an actual robot often requires additional steps to deal with the specifics of the robot platform. Such a platform can be modeled with timed automata and a set of temporal constraints that need to be satisfied during execution. In this paper, we describe how to transform an abstract plan into a platform-specific action sequence that satisfies all platform constraints. The transformation procedure first transforms the plan into a timed automaton, which is then combined with the platform automata while removing all transitions that violate any constraint. We then apply reachability analysis on the resulting automaton.  From any solution trace one can obtain the abstract plan extended by additional platform actions such that all platform constraints are satisfied.  We describe the transformation procedure in detail and provide an evaluation in two real-world robotics scenarios."
7,Reconciling Rewards with Predictive State Representations,Main,['POMDPs'],https://www.ijcai.org/proceedings/2021/299,"Predictive state representations (PSRs) are models of controlled non-Markov   observation sequences which exhibit the same generative process governing   POMDP observations without relying on an underlying latent state.  In that   respect, a PSR is indistinguishable from the corresponding POMDP.  However,   PSRs notoriously ignore the notion of rewards, which undermines the general   utility of PSR models for control, planning, or reinforcement learning.   Therefore, we describe a sufficient and necessary accuracy condition   which determines whether a PSR is able to accurately model POMDP rewards, we   show that rewards can be approximated even when the accuracy condition is not   satisfied, and we find that a non-trivial number of POMDPs taken from a   well-known third-party repository do not satisfy the accuracy condition.     We propose reward-predictive state representations (R-PSRs), a   generalization of PSRs which accurately models both observations and rewards,   and develop value iteration for R-PSRs.  We show that there is a mismatch   between optimal POMDP policies and the optimal PSR policies derived from   approximate rewards.  On the other hand, optimal R-PSR policies perfectly   match optimal POMDP policies, reconfirming R-PSRs as accurate state-less   generative models of observations and rewards."
8,Model-Based Reinforcement Learning for Infinite-Horizon Discounted Constrained Markov Decision Processes,Main,['Markov Decisions Processes'],https://www.ijcai.org/proceedings/2021/347,"In many real-world reinforcement learning (RL) problems, in addition to maximizing the  objective, the learning agent has to  maintain some necessary safety constraints.  We formulate the problem of learning a safe policy as  an  infinite-horizon discounted Constrained Markov Decision Process (CMDP)  with an unknown transition probability matrix, where the safety requirements are modeled as   constraints on expected cumulative costs.  We propose two model-based constrained reinforcement learning (CRL) algorithms for learning a safe policy, namely, (i) GM-CRL algorithm,  where the algorithm has access to a generative model, and (ii) UC-CRL  algorithm,  where the algorithm learns the model using an upper confidence style online exploration method.   We characterize the sample complexity of these algorithms, i.e., the the number of samples needed to ensure a desired level of accuracy with high probability, both with respect to objective maximization and constraint satisfaction."
9,State-Based Recurrent SPMNs for Decision-Theoretic Planning under Partial Observability,Main,"['Model-Based Reasoning', 'Planning under Uncertainty']",https://www.ijcai.org/proceedings/2021/348,"The sum-product network (SPN) has been extended to model sequence data with the recurrent SPN (RSPN), and to decision-making problems with sum-product-max networks (SPMN). In this paper, we build on the concepts introduced by these extensions and present state-based recurrent SPMNs (S-RSPMNs) as a generalization of SPMNs to sequential decision-making problems where the state may not be perfectly observed. As with recurrent SPNs, S-RSPMNs utilize a repeatable template network to model sequences of arbitrary lengths. We present an algorithm for learning compact template structures by identifying unique belief states and the transitions between them through a state matching process that utilizes augmented data.  In our knowledge, this is the first data-driven approach that learns graphical models for planning under partial observability, which can be solved efficiently. S-RSPMNs retain the linear solution complexity of SPMNs, and we demonstrate significant improvements in compactness of representation and the run time of structure learning and inference in sequential domains."
10,Reinforcement Learning for Route Optimization with Robustness Guarantees,Main,['Planning under Uncertainty'],https://www.ijcai.org/proceedings/2021/357,"Application of deep learning to NP-hard combinatorial optimization problems is an emerging research trend, and a number of interesting approaches have been published over the last few years. In this work we address robust optimization, which is a more complex variant where a max-min problem is to be solved. We obtain robust solutions by solving the inner minimization problem exactly and apply Reinforcement Learning to learn a heuristic for the outer problem. The minimization term in the inner objective represents an obstacle to existing RL-based approaches, as its value depends on the full solution in a non-linear manner and cannot be evaluated for partial solutions constructed by the agent over the course of each episode. We overcome this obstacle by defining the reward in terms of the one-step advantage over a baseline policy whose role can be played by any fast heuristic for the given problem. The agent is trained to maximize the total advantage, which, as we show, is equivalent to the original objective. We validate our approach by solving min-max versions of standard benchmarks for the Capacitated Vehicle Routing and the Traveling Salesperson Problem, where our agents obtain near-optimal solutions and improve upon the baselines."
11,Efficient Black-Box Planning Using Macro-Actions with Focused Effects,Main,"['Planning and Scheduling', 'Search in Planning and Scheduling']",https://www.ijcai.org/proceedings/2021/554,"The difficulty of deterministic planning increases exponentially with search-tree depth. Black-box planning presents an even greater challenge, since planners must operate without an explicit model of the domain. Heuristics can make search more efficient, but goal-aware heuristics for black-box planning usually rely on goal counting, which is often quite uninformative. In this work, we show how to overcome this limitation by discovering macro-actions that make the goal-count heuristic more accurate. Our approach searches for macro-actions with focused effects (i.e. macros that modify only a small number of state variables), which align well with the assumptions made by the goal-count heuristic. Focused macros dramatically improve black-box planning efficiency across a wide range of planning domains, sometimes beating even state-of-the-art planners with access to a full domain model."
12,ME-MCTS: Online Generalization by Combining Multiple Value Estimators,Main,['Markov Decisions Processes'],https://www.ijcai.org/proceedings/2021/555,"This paper addresses the challenge of online generalization in tree search. We propose Multiple Estimator Monte Carlo Tree Search (ME-MCTS), with a two-fold contribution: first, we introduce a formalization of online generalization that can represent existing techniques such as ""history heuristics"", ""RAVE"", or ""OMA"" -- contextual action value estimators or abstractors that generalize across specific contexts. Second, we incorporate recent advances in estimator averaging that enable guiding search by combining the online action value estimates of any number of such abstractors or similar types of action value estimators. Unlike previous work, which usually proposed a single abstractor for either the selection or the rollout phase of MCTS simulations, our approach focuses on the combination of multiple estimators and applies them to all move choices in MCTS simulations. As the MCTS tree itself is just another value estimator -- unbiased, but without abstraction -- this blurs the traditional distinction between action choices inside and outside of the MCTS tree. Experiments with three abstractors in four board games show significant improvements of ME-MCTS over MCTS using only a single abstractor, both for MCTS with random rollouts as well as for MCTS with static evaluation functions. While we used deterministic, fully observable games, ME-MCTS naturally extends to more challenging settings."
13,Learn to Intervene: An Adaptive Learning Policy for Restless Bandits in Application to Preventive Healthcare,Main,"['Applications of Planning', 'Planning under Uncertainty']",https://www.ijcai.org/proceedings/2021/556,"In many public health settings, it is important for patients to adhere to health programs, such as taking medications and periodic health checks. Unfortunately, beneficiaries may gradually disengage from such programs, which is detrimental to their health. A concrete example of gradual disengagement has been observed by an organization that carries out a free automated call-based program for spreading preventive care information among pregnant women. Many women stop picking up calls after being enrolled for a few months. To avoid such disengagements, it is important to provide timely interventions. Such interventions are often expensive and can be provided to only a small fraction of the beneficiaries. We model this scenario as a restless multi-armed bandit (RMAB) problem, where each beneficiary is assumed to transition from one state to another depending on the intervention.  Moreover, since the transition probabilities are unknown a priori, we propose a Whittle index based Q-Learning mechanism and show that it converges to the optimal solution. Our method improves over existing learning-based methods for RMABs on multiple benchmarks from literature and also on the maternal healthcare dataset."
14,Type-WA*: Using Exploration in Bounded Suboptimal Planning,Main,"['Planning Algorithms', 'Search in Planning and Scheduling']",https://www.ijcai.org/proceedings/2021/557,"Previous work on satisficing planning using greedy best-first search (GBFS) has shown that non-greedy, randomized exploration can help escape uninformative heuristic regions and solve hard problems faster. Despite their success when used with GBFS, such exploration techniques cannot be directly applied to bounded suboptimal algorithms like Weighted A* (WA*) without losing the solution-quality guarantees. In this work, we present Type-WA*, a novel bounded suboptimal planning algorithm that augments WA* with type-based exploration while still satisfying WA*'s theoretical solution-quality guarantee. Our empirical analysis shows that Type-WA* significantly increases the number of solved problems, when used in conjunction with each of three popular heuristics. Our analysis also provides insight into the runtime vs. solution cost trade-off."
15,Custom-Design of FDR Encodings: The Case of Red-Black Planning,Main,"['Planning Algorithms', 'Theoretical Foundations of Planning']",https://www.ijcai.org/proceedings/2021/558,"Classical planning tasks are commonly described in PDDL, while most planning systems operate on a grounded finite-domain representation (FDR). The translation of PDDL into FDR is complex and has a lot of choice points---it involves identifying so called mutex groups---but most systems rely on the translator that comes with Fast Downward. Yet the translation choice points can strongly impact performance. Prior work has considered optimizing FDR encodings in terms of the number of variables produced. Here we go one step further by proposing to custom-design FDR encodings, optimizing the encoding to suit particular planning techniques. We develop such a custom design here for red-black planning, a partial delete relaxation technique. The FDR encoding affects the causal graph and the domain transition graph structures, which govern the tractable fragment of red-black planning and hence affects the respective heuristic function. We develop integer linear programming techniques optimizing the scope of that fragment in the resulting FDR encoding. We empirically show that the performance of red-black planning can be improved through such FDR custom design."
16,Active Goal Recognition Design,Main,['Activity and Plan Recognition'],https://www.ijcai.org/proceedings/2021/559,"In Goal Recognition Design (GRD), the objective is to modify a domain to facilitate early detection of the goal of a subject agent.  Most previous work studies this problem in the offline setting, in which the observing agent performs its interventions before the subject begins acting.  In this paper, we generalize GRD to the online setting in which time passes and the observer's actions are interleaved with those of the subject. We illustrate weaknesses of existing metrics for GRD and propose an alternative better suited to online settings. We provide a formal definition of this Active GRD (AGRD) problem and study an algorithm for solving it.  AGRD occupies an interesting middle ground between passive goal recognition and strategic two-player game settings."
17,Stochastic Probing with Increasing Precision,Main,['Planning under Uncertainty'],https://www.ijcai.org/proceedings/2021/560,"We consider a selection problem with stochastic probing. There is a set of items whose values are drawn from independent distributions. The distributions are known in advance. Each item can be \emph{tested} repeatedly. Each test reduces the uncertainty about the realization of its value. We study a testing model, where the first test reveals if the realized value is smaller or larger than the median of the underlying distribution. Subsequent tests allow to further  narrow down the interval in which the realization is located. There is a limited number of possible tests, and our goal is to design near-optimal testing strategies that allow to maximize the expected value of the chosen item. We study both identical and non-identical distributions and develop polynomial-time algorithms with constant approximation factors in both scenarios."
18,Incorporating Queueing Dynamics into Schedule-Driven Traffic Control,Main,"['Applications of Planning', 'Planning and Scheduling', 'Real-time Planning']",https://www.ijcai.org/proceedings/2021/561,"Key to the effectiveness of schedule-driven approaches to real-time traffic control is an ability to accurately predict when sensed vehicles will arrive at and pass through the intersection. Prior work in schedule-driven traffic control has assumed a static vehicle arrival model. However, this static predictive model ignores the fact that the queue count and the incurred delay should vary as different partial signal timing schedules (i.e., different possible futures) are explored during the online planning process. In this paper, we propose an alternative arrival time model that incorporates queueing dynamics into this forward search process for a signal timing schedule, to more accurately capture how the intersection’s queues vary over time. As each search state is generated, an incremental queueing delay is dynamically projected for each vehicle. The resulting total queueing delay is then considered in addition to the cumulative delay caused by signal operations. We demonstrate the potential of this approach through microscopic traffic simulation of a real-world road network, showing a 10-15% reduction in average wait times over the schedule-driven traffic signal control system in heavy traffic scenarios."
19,Symbolic Dynamic Programming for Continuous State MDPs with Linear Program Transitions,Main,"['Markov Decisions Processes', 'Planning under Uncertainty']",https://www.ijcai.org/proceedings/2021/562,"Recent advances in symbolic dynamic programming (SDP) have significantly broadened the class of MDPs for which exact closed-form value functions can be derived. However, no existing solution methods can solve complex discrete and continuous state MDPs where a linear program determines state transitions --- transitions that are often required in problems with underlying constrained flow dynamics arising in problems ranging from traffic signal control to telecommunications bandwidth planning. In this paper, we present a novel SDP solution method for MDPs with LP transitions and continuous piecewise linear dynamics by introducing a novel, fully symbolic argmax operator. On three diverse domains, we show the first automated exact closed-form SDP solution to these challenging problems and the significant advantages of our SDP approach over discretized approximations."
20,Interference-free Walks in Time: Temporally Disjoint Paths,Main,"['Planning and Scheduling', 'Scheduling']",https://www.ijcai.org/proceedings/2021/563,"We investigate the computational complexity of finding temporally disjoint paths or walks in temporal graphs. There, the edge set changes over discrete time steps and a temporal path (resp. walk) uses edges that appear at monotonically increasing time steps. Two paths (or walks) are temporally disjoint if they never use the same vertex at the same time; otherwise, they interfere. This reflects applications in robotics, traffic routing, or finding safe pathways in dynamically changing networks. On the one extreme, we show that on general graphs the problem is computationally hard. The ""walk version"" is W[1]-hard when parameterized by the number of routes. However, it is polynomial-time solvable for any constant number of walks. The ""path version"" remains NP-hard even if we want to find only two temporally disjoint paths. On the other extreme, restricting the input temporal graph to have a path as underlying graph, quite counterintuitively, we find NP-hardness in general but also identify natural tractable cases."
