,title,track,categories,url,desc
0,Time-Constrained Participatory Budgeting Under Uncertain Project Costs,Main,['Planning with Incomplete Information'],https://www.ijcai.org/proceedings/2022/11,"In participatory budgeting the stakeholders collectively decide which projects from a set of proposed projects should be implemented. This decision underlies both time and monetary constraints. In reality it is often impossible to figure out the exact cost of each project in advance, it is only known after a project is finished. To reduce risk, one can implement projects one after the other to be able to react to higher costs of a previous project. However, this will increase execution time drastically. We generalize existing frameworks to capture this setting, study desirable properties of algorithms for this problem, and show that some desirable properties are incompatible. Then we present and analyze algorithms that trade-off desirable properties."
1,Propositional Gossip Protocols under Fair Schedulers,Main,"['Distributed; Multi-agent Planning', 'Theoretical Foundations of Planning']",https://www.ijcai.org/proceedings/2022/56,"Gossip protocols are programs that can be used by a group of agents to synchronize what information they have. Namely, assuming each agent holds a secret, the goal of a protocol is to reach a situation in which all agents know all secrets. Distributed epistemic gossip protocols use epistemic formulas in the component programs for the agents. In this paper, we study the simplest classes of such gossip protocols: propositional gossip protocols, in which whether an agent wants to initiate a call depends only on the set of secrets that the agent currently knows. It was recently shown that such a protocol can be correct, i.e., always terminates in a state where all agents know all secrets, only when its communication graph is complete. We show here that this characterization dramatically changes when the usual fairness constraints are imposed on the call scheduler used. Finally, we establish that checking the correctness of a given propositional protocol under a fair scheduler is a coNP-complete problem."
2,Real-Time BDI Agents: A Model and Its Implementation,Main,"['Scheduling', 'Real-time Planning']",https://www.ijcai.org/proceedings/2022/73,"The BDI model proved to be effective for the developing of applications requiring high-levels of autonomy and to deal with the complexity and unpredictability of real-world scenarios. The model, however, has significant limitations in reacting and handling contingencies within the given real-time constraints. Without an explicit representation of time, existing real-time BDI implementations overlook the temporal implications during the agent’s decision process that may result in delays or unresponsiveness of the system when it gets overloaded. In this paper, we redefine the BDI agent control loop inspired by traditional and well establish algorithms for real-time systems to ensure a proper reaction of agents and their effective application in typical real-time domains. Our model proposes an effective real-time management of goals, plans, and actions with respect to time constraints and resources availability. We propose an implementation of the model for a resource-collection video-game and we validate the approach against a set of significant scenarios."
3,Max-Sum with Quadtrees for Decentralized Coordination in Continuous Domains,Main,['Distributed; Multi-agent Planning'],https://www.ijcai.org/proceedings/2022/74,"In this paper we put forward a novel extension of the classic Max-Sum algorithm to the framework of Continuous Distributed Constrained Optimization Problems (Continuous DCOPs), by utilizing a popular geometric algorithm, namely Quadtrees. In its standard form, Max-Sum can only solve Continuous DCOPs with an a priori discretization procedure. Existing Max-Sum extensions to continuous multiagent coordination domains require additional assumptions regarding the form of the factors, such as access to the gradient, or the ability to model them as continuous piecewise linear functions. Our proposed approach has no such requirements: we model the exchanged messages with Quadtrees, and, as such, the discretization procedure is dynamic and embedded in the internal Max-Sum operations (addition and marginal maximization). We apply Max-Sum with Quadtrees to lane-free autonomous driving. Our experimental evaluation showcases the effectiveness of our approach in this challenging coordination domain."
4,Fast and Fine-grained Autoscaler for Streaming Jobs with Reinforcement Learning,Main,['Scheduling'],https://www.ijcai.org/proceedings/2022/80,"On computing clusters, the autoscaler is responsible for allocating resources for jobs or fine-grained tasks to ensure their Quality of Service. Due to a more precise resource management, fine-grained autoscaling can generally achieve better performance. However, the fine-grained autoscaling for streaming jobs needs intensive computation to model the complicated running states of tasks, and has not been adequately studied previously. In this paper, we propose a novel fine-grained autoscaler for streaming jobs based on reinforcement learning. We first organize the running states of streaming jobs as spatio-temporal graphs. To efficiently make autoscaling decisions, we propose a Neural Variational Subgraph Sampler to sample spatio-temporal subgraphs. Furthermore, we propose a mutual-information-based objective function to explicitly guide the sampler to extract more representative subgraphs. After that, the autoscaler makes decisions based on the learned subgraph representations. Experiments conducted on real-world datasets demonstrate the superiority of our method over six competitive baselines."
5,Environment Design for Biased Decision Makers,Main,['Markov Decisions Processes'],https://www.ijcai.org/proceedings/2022/84,"We study the environment design problem for biased decision makers. In an environment design problem, an informed principal aims to update the decision making environment to influence the decisions made by the agent. This problem is ubiquitous in various domains, e.g., a social networking platform might want to update its website to encourage more user engagement. In this work, we focus on the scenario in which the agent might exhibit biases in decision making. We relax the common assumption that the agent is rational and aim to incorporate models of biased agents in environment design. We formulate the environment design problem under the Markov decision process (MDP) and incorporate common models of biased agents through introducing general time-discounting functions. We then formalize the environment design problem as constrained optimization problems and propose corresponding algorithms. We conduct both simulations and real human-subject experiments with workers recruited from Amazon Mechanical Turk to evaluate our proposed algorithms."
6,Beyond Strong-Cyclic: Doing Your Best in Stochastic Environments,Main,['Theoretical Foundations of Planning'],https://www.ijcai.org/proceedings/2022/350,"``Strong-cyclic policies"" were introduced to formalize trial-and-error strategies and are known to work in Markovian stochastic domains, i.e., they guarantee that the goal is reached with probability 1. We introduce ``best-effort"" policies for (not necessarily Markovian) stochastic domains. These generalize strong-cyclic policies by taking advantage of stochasticity even if the goal cannot be reached with probability 1. We compare such policies with optimal policies, i.e., policies that maximize the probability that the goal is achieved, and show that optimal policies are best-effort, but that the converse is false in general. With this framework at hand, we revisit the foundational problem of what it means to plan in nondeterministic domains when the nondeterminism has a stochastic nature. We show that one can view a nondeterministic planning domain as a representation of infinitely many stochastic domains with the same support but different probabilities, and that for temporally extended goals expressed in LTL/LTLf a finite-state best-effort policy in one of these domains is best-effort in each of the domains. In particular, this gives an approach for finding such policies that reduces to solving finite-state MDPs with LTL/LTLf goals. All this shows that ``best-effort"" policies are robust to changes in the probabilities, as long as the support is unchanged."
7,LTLf Synthesis as AND-OR Graph Search: Knowledge Compilation at Work,Main,['Theoretical Foundations of Planning'],https://www.ijcai.org/proceedings/2022/359,"Synthesis techniques for temporal logic specifications are typically based on exploiting symbolic techniques, as done in model checking. These symbolic techniques typically use backward fixpoint computation. Planning, which can be seen as a specific form of synthesis, is a witness of the success of forward search approaches. In this paper, we develop a forward-search approach to full-fledged Linear Temporal Logic on finite traces (LTLf) synthesis. We show how to compute the Deterministic Finite Automaton (DFA) of an LTLf formula on-the-fly, while performing an adversarial forward search towards the final states, by considering the DFA as a sort of AND-OR graph. Our approach is characterized by branching on suitable propositional formulas, instead of individual evaluations, hence radically reducing the branching factor of the search space. Specifically, we take advantage of techniques developed for knowledge compilation, such as Sentential Decision Diagrams (SDDs), to implement the approach efficiently."
8,Reinforcement Learning with Option Machines,Main,['Planning with Incomplete Information'],https://www.ijcai.org/proceedings/2022/403,"Reinforcement learning (RL) is a powerful framework for learning complex behaviors, but lacks adoption in many settings due to sample size requirements. We introduce a framework for increasing sample efficiency of RL algorithms. Our approach focuses on optimizing environment rewards with high-level instructions. These are modeled as a high-level controller over temporally extended actions known as options. These options can be looped, interleaved and partially ordered with a rich language for high-level instructions. Crucially, the instructions may be underspecified in the sense that following them does not guarantee high reward in the environment. We present an algorithm for control with these so-called option machines (OMs), discuss option selection for the partially ordered case and describe an algorithm for learning with OMs. We compare our approach in zero-shot, single- and multi-task settings in an environment with fully specified and underspecified instructions. We find that OMs perform significantly better than or comparable to the state-of-art in all environments and learning settings."
9,Option Transfer and SMDP Abstraction with Successor Features,Main,['Hierarchical Planning'],https://www.ijcai.org/proceedings/2022/421,"Abstraction plays an important role in the generalisation of knowledge and skills and is key to sample efficient learning. In this work, we study joint temporal and state abstraction in reinforcement learning, where temporally-extended actions in the form of options induce temporal abstractions, while aggregation of similar states with respect to abstract options induces state abstractions. Many existing abstraction schemes ignore the interplay of state and temporal abstraction. Consequently, the considered option policies often cannot be directly transferred to new environments due to changes in the state space and transition dynamics. To address this issue, we propose a novel abstraction scheme building on successor features. This includes an algorithm for transferring abstract options across different environments and a state abstraction mechanism that allows us to perform efficient planning with the transferred options."
10,Relational Abstractions for Generalized Reinforcement Learning on Symbolic Problems,Main,['Learning in Planning and Scheduling'],https://www.ijcai.org/proceedings/2022/435,"Reinforcement learning in problems with symbolic state spaces is challenging due to the need for reasoning over long horizons. This paper presents a new approach that utilizes relational abstractions in conjunction with deep learning to learn a generalizable Q-function for such problems. The learned Q-function can be efficiently transferred to related problems that have different object names and object quantities, and thus, entirely different state spaces. We show that the learned, generalized Q-function can be utilized for zero-shot transfer to related problems without an explicit, hand-coded curriculum. Empirical evaluations on a range of problems show that our method facilitates efficient zero-shot transfer of learned knowledge to much larger problem instances containing many objects."
11,Data Augmentation for Learning to Play in Text-Based Games,Main,['POMDPs'],https://www.ijcai.org/proceedings/2022/436,"Improving generalization in text-based games serves as a useful stepping-stone towards reinforcement learning (RL) agents with generic linguistic ability. Data augmentation for generalization in RL has shown to be very successful in classic control and visual tasks, but there is no prior work for text-based games. We propose Transition-Matching Permutation, a novel data augmentation technique for text-based games, where we identify phrase permutations that match as many transitions in the trajectory data. We show that applying this technique results in state-of-the-art performance in the Cooking Game benchmark suite for text-based games."
12,Markov Abstractions for PAC Reinforcement Learning in Non-Markov Decision Processes,Main,['Markov Decisions Processes'],https://www.ijcai.org/proceedings/2022/473,"Our work aims at developing reinforcement learning algorithms that do not rely on the Markov assumption. We consider the class of Non-Markov Decision Processes where histories can be abstracted into a finite set of states while preserving the dynamics. We call it a Markov abstraction since it induces a Markov Decision Process over a set of states that encode the non-Markov dynamics. This phenomenon underlies the recently introduced Regular Decision Processes (as well as POMDPs where only a finite number of belief states is reachable). In all such kinds of decision process, an agent that uses a Markov abstraction can rely on the Markov property to achieve optimal behaviour. We show that Markov abstractions can be learned during reinforcement learning. Our approach combines automata learning and classic reinforcement learning. For these two tasks, standard algorithms can be employed. We show that our approach has PAC guarantees when the employed algorithms have PAC guarantees, and we also provide an experimental evaluation."
13,Value Refinement Network (VRN),Main,['Learning in Planning and Scheduling'],https://www.ijcai.org/proceedings/2022/494,"In robotic tasks, we encounter the unique strengths of (1) reinforcement learning (RL) that can handle high-dimensional observations as well as unknown, complex dynamics and (2) planning that can handle sparse and delayed rewards given a dynamics model. Combining these strengths of RL and planning, we propose the Value Refinement Network (VRN), in this work. Our VRN is an RL-trained neural network architecture that learns to locally refine an initial (value-based) plan in a simplified (2D) problem abstraction based on detailed local sensory observations. We evaluate the VRN on simulated robotic (navigation) tasks and demonstrate that it can successfully refine sub-optimal plans to match the performance of more costly planning in the non-simplified problem. Furthermore, in a dynamic environment, the VRN still enables high task completion without global re-planning."
14,Model-Based Offline Planning with Trajectory Pruning,Main,"['Markov Decisions Processes', 'Planning Algorithms']",https://www.ijcai.org/proceedings/2022/516,"The recent offline reinforcement learning (RL) studies have achieved much progress to make RL usable in real-world systems by learning policies from pre-collected datasets without environment interaction. Unfortunately, existing offline RL methods still face many practical challenges in real-world system control tasks, such as computational restriction during agent training and the requirement of extra control flexibility. The model-based planning framework provides an attractive alternative. However, most model-based planning algorithms are not designed for offline settings. Simply combining the ingredients of offline RL with existing methods either provides over-restrictive planning or leads to inferior performance. We propose a new light-weighted model-based offline planning framework, namely MOPP, which tackles the dilemma between the restrictions of offline learning and high-performance planning. MOPP encourages more aggressive trajectory rollout guided by the behavior policy learned from data, and prunes out problematic trajectories to avoid potential out-of-distribution samples. Experimental results show that MOPP provides competitive performance compared with existing model-based offline planning and RL approaches."
15,Offline Vehicle Routing Problem with Online Bookings: A Novel Problem Formulation with Applications to Paratransit,Main,['Learning in Planning and Scheduling'],https://www.ijcai.org/proceedings/2022/546,"Vehicle routing problems (VRPs) can be divided into two major categories: offline VRPs, which consider a given set of trip requests to be served, and online VRPs, which consider requests as they arrive in real-time. Based on discussions with public transit agencies, we identify a real-world problem that is not addressed by existing formulations: booking trips with flexible pickup windows (e.g., 3 hours) in advance (e.g., the day before) and confirming tight pickup windows (e.g., 30 minutes) at the time of booking. Such a service model is often required in paratransit service settings, where passengers typically book trips for the next day over the phone. To address this gap between offline and online problems, we introduce a novel formulation, the offline vehicle routing problem with online bookings. This problem is very challenging computationally since it faces the complexity of considering large sets of requests—similar to offline VRPs—but must abide by strict constraints on running time—similar to online VRPs. To solve this problem, we propose a novel computational approach, which combines an anytime algorithm with a learning-based policy for real-time decisions. Based on a paratransit dataset obtained from the public transit agency of Chattanooga, TN, we demonstrate that our novel formulation and computational approach lead to significantly better outcomes in this setting than existing algorithms."
16,Explaining the Behaviour of Hybrid Systems with PDDL+ Planning,Main,"['Mixed Discrete/Continuous Planning', 'Activity and Plan Recognition']",https://www.ijcai.org/proceedings/2022/634,"The aim of this work is to explain the observed behaviour of a hybrid system (HS). The explanation problem is cast as finding a trajectory of the HS that matches some observations. By using the formalism of hybrid automata (HA), we characterize the explanations as the language of a network of HA that comprises one automaton for the HS and another one for the observations, thus restricting the behaviour of the HS exclusively to trajectories that explain the observations. We observe that this problem corresponds to a reachability problem in model-checking, but that state-of-the-art model checkers struggle to find concrete trajectories. To overcome this issue we provide a formal mapping from HA to PDDL+ and show how to use an off-the-shelf automated planner. An experimental analysis over domains with piece-wise constant, linear and nonlinear dynamics reveals that the proposed PDDL+ approach is much more efficient than solving directly the explanation problem with model-checking solvers."
17,Online Bin Packing with Predictions,Main,"['Learning in Planning and Scheduling', 'Planning under Uncertainty', 'Scheduling']",https://www.ijcai.org/proceedings/2022/635,"Bin packing is a classic optimization problem with a wide range of applications from load balancing to supply chain management. In this work, we study the online variant of the problem, in which a sequence of items of various sizes must be placed into a minimum number of bins of uniform capacity. The online algorithm is enhanced with a (potentially erroneous) prediction concerning the frequency of item sizes in the sequence. We design and analyze online algorithms with efficient tradeoffs between the consistency (i.e., the competitive ratio assuming no prediction error) and the robustness (i.e., the competitive ratio under adversarial error), and whose performance degrades near-optimally as a function of the prediction error. This is the first theoretical and experimental study of online bin packing in the realistic setting of learnable predictions. Previous work addressed only extreme cases with respect to the prediction error, and relied on overly powerful and error-free oracles."
18,Scheduling with Untrusted Predictions,Main,"['Scheduling', 'Learning in Planning and Scheduling']",https://www.ijcai.org/proceedings/2022/636,"Using machine-learned predictions to create algorithms with better approximation guarantees is a very fresh and active field. In this work, we study classic scheduling problems under the learning augmented setting. More specifically, we consider the problem of scheduling jobs with arbitrary release dates on a single machine and the problem of scheduling jobs with a common release date on multiple machines. Our objective is to minimize the sum of completion times. For both problems, we propose algorithms which use predictions for taking their decisions. Our algorithms are consistent -- i.e. when the predictions are accurate, the performances of our algorithms are close to those of an  optimal offline algorithm--, and robust -- i.e.  when the predictions are wrong, the performance of our algorithms are close to those of an online algorithm without predictions. In addition, we confirm the above theoretical bounds by conducting experimental evaluation comparing the proposed algorithms to the offline optimal ones for both the single and multiple machines settings."
19,Adaptive Information Belief Space Planning,Main,"['Planning under Uncertainty', 'Planning Algorithms', 'Planning with Incomplete Information', 'POMDPs', 'Robot Planning']",https://www.ijcai.org/proceedings/2022/637,"Reasoning about uncertainty is vital in many real-life autonomous systems. However, current state-of-the-art planning algorithms either cannot reason about uncertainty explicitly, or do so with high computational burden. Here, we focus on making informed decisions efficiently, using reward functions that explicitly deal with uncertainty. We formulate an approximation, namely an abstract observation model, that uses an aggregation scheme to alleviate computational costs. We derive bounds on the expected information-theoretic reward function and, as a consequence, on the value function. We then propose a method to refine aggregation to achieve identical action selection in a fraction of the computational time."
20,Tight Bounds for Hybrid Planning,Main,"['Hierarchical Planning', 'Theoretical Foundations of Planning']",https://www.ijcai.org/proceedings/2022/638,"Several hierarchical planning systems feature a rich level of language features making them capable of expressing real-world problems. One such feature that's used by several current planning systems is causal links, which are used to track search progress. The formalism combining Hierarchical Task Network (HTN) planning with these links known from Partial Order Causal Link (POCL) planning is often referred to as hybrid planning. In this paper we study the computational complexity of such hybrid planning problems. More specifically, we provide missing membership results to existing hardness proofs and thereby provide tight complexity bounds for all known subclasses of hierarchical planning problems. We also re-visit and correct a result from the literature for plan verification showing that it remains NP-complete even in the absence of a task hierarchy."
21,Planning with Qualitative Action-Trajectory Constraints in PDDL,Main,"['Planning Algorithms', 'Search in Planning and Scheduling']",https://www.ijcai.org/proceedings/2022/639,"In automated planning the ability of expressing constraints on the structure of the desired plans is important to deal with solution quality, as well as to express control knowledge. In PDDL3, this is supported through state-trajectory constraints corresponding to a class of LTLf formulae. In this paper,  first we introduce a formalism to express trajectory constraints over actions in the plan, rather than over traversed states; Then we investigate compilation-based methods to deal with such constraints in propositional planning, and propose a new simple effective method. Finally, we experimentally study the usefulness of our action-trajectory constraints as a tool to express control knowledge. The experimental results show that the performance of a classical planner can be significantly improved by exploiting knowledge expressed by action constraints and handled by our compilation method, while the same knowledge turns out to be less beneficial when specified as state constraints and handled by two state-of-the-art systems supporting state constraints."
