,title,track,categories,url,desc
22,Shared Autonomy Systems with Stochastic Operator Models,Main,"['Planning under Uncertainty', 'Markov Decisions Processes']",https://www.ijcai.org/proceedings/2022/640,"We consider shared autonomy systems where multiple operators (AI and human), can interact with the environment, e.g. by controlling a robot. The decision problem for the shared autonomy system is to select which operator takes control at each timestep, such that a reward specifying the intended system behaviour is maximised. The performance of the human operator is influenced by unobserved factors, such as fatigue or skill level. Therefore, the system must reason over stochastic models of operator performance. We present a framework for stochastic operators in shared autonomy systems (SO-SAS), where we represent operators using rich, partially observable models. We formalise SO-SAS as a mixed-observability Markov decision process, where environment states are fully observable and internal operator states are hidden. We test SO-SAS on a simulated domain and a computer game, empirically showing it results in better performance compared to traditional formulations of shared autonomy systems."
23,Explaining Soft-Goal Conflicts through Constraint Relaxations,Main,['Planning Algorithms'],https://www.ijcai.org/proceedings/2022/641,"Recent work suggests to explain trade-offs between soft-goals in terms of their conflicts, i.e., minimal unsolvable soft-goal subsets. But this does not explain the conflicts themselves: Why can a given set of soft-goals not be jointly achieved? Here we approach that question in terms of the underlying constraints on plans in the task at hand, namely resource availability and time windows. In this context, a natural form of explanation for a soft-goal conflict is a minimal constraint relaxation under which the conflict disappears (``if the deadline was 1 hour later, it would work''). We explore algorithms for computing such explanations. A baseline is to simply loop over all relaxed tasks and compute the conflicts for each separately. We improve over this by two algorithms that leverage information -- conflicts, reachable states -- across relaxed tasks. We show that these algorithms can exponentially outperform the baseline in theory, and we run experiments confirming that advantage in practice."
24,Online Planning in POMDPs with Self-Improving Simulators,Main,"['Planning under Uncertainty', 'Planning Algorithms', 'POMDPs', 'Real-time Planning']",https://www.ijcai.org/proceedings/2022/642,"How  can  we  plan  efficiently  in  a  large  and  complex environment when the time budget is limited? Given  the  original  simulator  of  the  environment, which may be computationally very demanding, we propose to learn online an approximate but much faster simulator that improves over time.  To plan reliably and efficiently while the approximate simulator is learning, we develop a method that adaptively decides which simulator to use for every simulation, based on a statistic that measures the accuracy of the approximate simulator. This allows us to use the approximate simulator to replace the original simulator for faster simulations when it is accurate enough under the current context, thus trading off  simulation speed  and  accuracy.   Experimental results in two large domains show that when integrated with POMCP, our approach allows to plan with improving efficiency over time."
25,An Efficient Approach to Data Transfer Scheduling for Long Range Space Exploration,Main,"['Applications', 'Scheduling', 'Search in Planning and Scheduling']",https://www.ijcai.org/proceedings/2022/643,"Long range space missions, such as Rosetta, require robust plans of data-acquisition activities and of the resulting data transfers. In this paper we revisit the problem of assigning priorities to data transfers in order to maximize safety margin of onboard memory. We propose a fast sweep algorithm to verify the feasibility of a given priority assignment and we introduce an efficient exact algorithm to assign priorities on a single downlink window. We prove that the problem is NP-hard for several windows, and we propose several randomized heuristics to tackle the general case. Our experimental results show that  the proposed approaches are able to  improve the plans computed for the real mission by the previously existing method, while the sweep algorithm yields drastic accelerations."
26,General Optimization Framework for Recurrent Reachability Objectives,Main,"['Robot Planning', 'Planning Algorithms', 'Theoretical Foundations of Planning']",https://www.ijcai.org/proceedings/2022/644,"We consider the mobile robot path planning problem for a class of recurrent reachability objectives. These objectives are parameterized by the expected time needed to visit one position from another, the expected square of this time, and also the frequency of moves between two neighboring locations. We design an efficient strategy synthesis algorithm for recurrent reachability objectives and demonstrate its functionality on non-trivial instances."
27,Offline Time-Independent Multi-Agent Path Planning,Main,"['Distributed; Multi-agent Planning', 'Planning under Uncertainty', 'Robot Planning']",https://www.ijcai.org/proceedings/2022/645,"This paper studies a novel planning problem for multiple agents that cannot share holding resources, named OTIMAPP (Offline Time-Independent Multi-Agent Path Planning). Given a graph and a set of start-goal pairs, the problem consists in assigning a path to each agent such that every agent eventually reaches their goal without blocking each other, regardless of how the agents are being scheduled at runtime. The motivation stems from the nature of distributed environments that agents take actions fully asynchronous and have no knowledge about those exact timings of other actors. We present solution conditions, computational complexity, solvers, and robotic applications."
28,On the Computational Complexity of Model Reconciliations,Main,['Theoretical Foundations of Planning'],https://www.ijcai.org/proceedings/2022/646,"Model-reconciliation explanation is a popular framework for generating explanations for planning problems. While the framework has been extended to multiple settings since its introduction for classical planning problems, there is little agreement on the computational complexity of generating minimal model reconciliation explanations in the basic setting. In this paper, we address this lacuna by introducing a decision-version of the model-reconciliation explanation generation problem and we show that it is Sigma-2-P Complete."
29,Landmark Heuristics for Lifted Classical Planning,Main,"['Search in Planning and Scheduling', 'Planning Algorithms']",https://www.ijcai.org/proceedings/2022/647,"While state-of-the-art planning systems need a grounded (propositional) task representation, the input model is provided ""lifted"", specifying predicates and action schemas with variables over a finite object universe. The size of the grounded model is exponential in predicate/action-schema arity, limiting applicability to cases where it is small enough. Recent work has taken up this challenge, devising an effective lifted forward search planner as basis for lifted heuristic search, as well as a variety of lifted heuristic functions based on the delete relaxation. Here we add a novel family of lifted heuristic functions, based on landmarks. We design two methods for landmark extraction in the lifted setting. The resulting heuristics exhibit performance advantages over previous heuristics in several benchmark domains. Especially the combination with lifted delete relaxation heuristics to a LAMA-style planner yields good results, beating the previous state of the art in lifted planning."
30,Competitive Analysis for Multi-Commodity Ski-Rental Problem,Main,"['Planning under Uncertainty', 'Applications', 'Theoretical Foundations of Planning']",https://www.ijcai.org/proceedings/2022/648,"We investigate an extended version of the classical ski-rental problem with multiple commodities. A customer uses a set of commodities altogether, and he/she needs to choose payment options to cover the usage of each commodity without the knowledge of the future. The payment options of each commodity include (1) renting: to pay for an on-demand usage and (2) buying: to pay for the lifetime usage. It is a novel extension of the classical ski-rental problem which deals with only one commodity. To address this problem, we propose a new online algorithm called the Multi-Object Break-Even (MOBE) algorithm and conduct competitive analysis. We show that the tight lower and upper bounds of MOBE algorithm's competitive ratio are e/e-1 and 2 respectively against adaptive adversary under arbitrary renting and buying prices. We further prove that MOBE algorithm is an optimal online algorithm if commodities have the same rent-to-buy ratio. Numerical results verify our theoretical conclusion and demonstrate the advantages of MOBE in a real-world scenario."
31,An Online Learning Approach towards Far-sighted Emergency Relief Planning under Intentional Attacks in Conflict Areas,Main,"['Planning under Uncertainty', 'Mixed Discrete/Continuous Planning', 'Real-time Planning']",https://www.ijcai.org/proceedings/2022/649,"A large number of emergency humanitarian rescue demands in conflict areas around the world are accompanied by intentional, persistent and unpredictable attacks on rescuers and supplies. Unfortunately, existing work on humanitarian relief planning mostly ignores this challenge in reality resulting a parlous and short-sighted relief distribution plan to a large extent. To address this, we first propose an offline multi-stage optimization problem of emergency relief planning under intentional attacks, in which all parameters in the game between the rescuer and attacker are supposed to be known or predictable. Then, an online version of this problem is introduced to meet the need of online and irrevocable decision making when those parameters are revealed in an online fashion. To achieve a far-sighted emergency relief planning under attacks, we design an online learning approach which is proven to obtain a near-optimal solution of the offline problem when those online reveled parameters are i.i.d. sampled from an unknown distribution. Finally, extensive experiments on a real anti-Ebola relief planning case based on the data of Ebola outbreak and armed attacks in DRC Congo show the scalability and effectiveness of our approach."
32,PG3: Policy-Guided Planning for Generalized Policy Generation,Main,['Learning in Planning and Scheduling'],https://www.ijcai.org/proceedings/2022/650,"A longstanding objective in classical planning is to synthesize policies that generalize across multiple problems from the same domain. In this work, we study generalized policy search-based methods with a focus on the score function used to guide the search over policies. We demonstrate limitations of two score functions --- policy evaluation and plan comparison --- and propose a new approach that overcomes these limitations. The main idea behind our approach, Policy-Guided Planning for Generalized Policy Generalization (PG3), is that a candidate policy should be used to guide planning on training problems as a mechanism for evaluating that candidate. Theoretical results in a simplified setting give conditions under which PG3 is optimal or admissible. We then study a specific instantiation of policy search where planning problems are PDDL-based and policies are lifted decision lists. Empirical results in six domains confirm that PG3 learns generalized policies more efficiently and effectively than several baselines."
33,A Native Qualitative Numeric Planning Solver Based on AND/OR Graph Search,Main,"['Planning Algorithms', 'Planning under Uncertainty']",https://www.ijcai.org/proceedings/2022/651,"Qualitative numeric planning (QNP) is classical planning extended with non-negative real variables that can be increased or decreased by some arbitrary amount. Existing approaches for solving QNP problems are exclusively based on compilation to fully observable nondeterministic planning (FOND) problems or FOND+ problems, i.e., FOND problems with explicit fairness assumptions. However, the FOND-compilation approaches suffer from some limitations, such as difficulties to generate all strong cyclic solutions for FOND problems or introducing a great many extra variables and actions. In this paper, we propose a simpler characterization of QNP solutions and a new approach to solve QNP problems based on directly searching for a solution, which is a closed and terminating subgraph that contains a goal node, in the AND/OR graphs induced by QNP problems. Moreover, we introduce a pruning strategy based on termination tests on subgraphs. We implemented a native solver DSET based on the proposed approach and compared the performance of it with that of the two compilation-based approaches. Experimental results show that DSET is faster than the FOND-compilation approach by one order of magnitude, and comparable with the FOND+-compilation approach."
34,Dynamic Car Dispatching and Pricing: Revenue and Fairness for Ridesharing Platforms,Main,"['Planning Algorithms', 'Planning under Uncertainty', 'Planning with Incomplete Information']",https://www.ijcai.org/proceedings/2022/652,"A major challenge for ridesharing platforms is to guarantee profit and fairness simultaneously, especially in the presence of misaligned incentives of drivers and riders. We focus on the  dispatching-pricing problem to maximize the total revenue while keeping both drivers and riders satisfied. We study the computational complexity of the problem, provide a novel two-phased pricing solution with revenue and fairness guarantees, extend it to stochastic settings and develop a dynamic (a.k.a., learning-while-doing) algorithm that actively collects data to learn the demand distribution during the scheduling process. We also conduct extensive experiments to demonstrate the effectiveness of our algorithms."
35,Learning and Exploiting Progress States in Greedy Best-First Search,Main,"['Learning in Planning and Scheduling', 'Search in Planning and Scheduling']",https://www.ijcai.org/proceedings/2022/657,"Previous work introduced the concept of progress states. After expanding a progress state, a greedy best-first search (GBFS) will only expand states with lower heuristic values. Current methods can identify progress states only for a single task and only after a solution for the task has been found. We introduce a novel approach that learns a description logic formula characterizing all progress states in a classical planning domain. Using the learned formulas in a GBFS to break ties in favor of progress states often significantly reduces the search effort."
36,Completeness and Diversity in Depth-First Proof-Number Search with Applications to Retrosynthesis,Main,['Planning Algorithms'],https://www.ijcai.org/proceedings/2022/658,"We revisit Depth-First Proof-Number Search (DFPN), a well-known algorithm for solving two-player games. First, we consider the completeness property of the algorithm and its variants, i.e., whether they always find a winning strategy when there exists one. While it is known that the standard version is not complete, we show that the combination with the simple Threshold Controlling Algorithm is complete, solving an open problem from the area. Second, we modify DFPN to compute a diverse set of solutions rather than just a single one. Finally, we apply this new variant in Chemistry to the synthesis planning of new target molecules (Retrosynthesis). In this domain a diverse set of many solutions is desirable. We apply additional modifications from the literature to the algorithm and show that it outperforms Monte-Carlo Tree-Search, another well-known algorithm for the same problem, according to a natural diversity measure."
37,A Reliability-aware Distributed Framework to Schedule Residential Charging of Electric Vehicles,AI for Good,"['Distributed; Multi-agent Planning', 'Scheduling']",https://www.ijcai.org/proceedings/2022/710,"Residential consumers have become active participants in the power distribution network after being equipped with residential EV charging provisions. This creates a challenge for the network operator tasked with dispatching electric power to the residential consumers through the existing distribution network infrastructure in a reliable manner. In this paper, we address the problem of scheduling residential EV charging for multiple consumers while maintaining network reliability. An additional challenge is the restricted exchange of information: where the consumers do not have access to network information and the network operator does not have access  to consumer load parameters. We propose a distributed framework which generates an optimal EV charging schedule for individual residential consumers based on their preferences and iteratively updates it until the network reliability constraints set by the operator are satisfied. We validate the proposed approach for different EV adoption levels in a synthetically created digital twin of an actual power distribution network. The results demonstrate that the new approach can achieve a higher level of network reliability compared to the case where residential consumers charge EVs based solely on their individual preferences, thus providing a solution for the existing grid to keep up with increased adoption rates without significant investments in increasing grid capacity."
38,Ranked Prioritization of Groups in Combinatorial Bandit Allocation,AI for Good,['Planning under Uncertainty'],https://www.ijcai.org/proceedings/2022/723,"Preventing poaching through ranger patrols protects endangered wildlife, directly contributing to the UN Sustainable Development Goal 15 of life on land. Combinatorial bandits have been used to allocate limited patrol resources, but existing approaches overlook the fact that each location is home to multiple species in varying proportions, so a patrol benefits each species to differing degrees. When some species are more vulnerable, we ought to offer more protection to these animals; unfortunately, existing combinatorial bandit approaches do not offer a way to prioritize important species. To bridge this gap, (1) We propose a novel combinatorial bandit objective that trades off between reward maximization and also accounts for prioritization over species, which we call ranked prioritization. We show this objective can be expressed as a weighted linear sum of Lipschitz-continuous reward functions. (2) We provide RankedCUCB, an algorithm to select combinatorial actions that optimize our prioritization-based objective, and prove that it achieves asymptotic no-regret. (3) We demonstrate empirically that RankedCUCB leads to up to 38% improvement in outcomes for endangered species using real-world wildlife conservation data. Along with adapting to other challenges such as preventing illegal logging and overfishing, our no-regret algorithm addresses the general combinatorial bandit problem with a weighted linear objective."
39,VMAgent: A Practical Virtual Machine Scheduling Platform,Demo,"['Learning in Planning and Scheduling', 'Scheduling']",https://www.ijcai.org/proceedings/2022/860,"Virtual machine (VM) scheduling is one of the critical tasks in cloud computing. Many works have attempted to incorporate machine learning, especially reinforcement learning, to empower VM scheduling procedures. Although improved results are shown in several demo simulators, the performances in real-world scenarios are still underexploited. In this paper, we design a practical VM scheduling platform, i.e., VMAgent, to assist researchers in developing their methods on the VM scheduling problem. VMAgent consists of three components: simulator, scheduler, and visualizer. The simulator abstracts three general realistic scheduling scenarios (fading, recovering, and expansion) based on Huawei Cloud’s scheduling data, which is the core of our platform. Flexible configurations are further provided to make the simulator compatible with practical cloud computing architecture (i.e., Multi Non-Uniform Memory Access) and scenarios. Researchers then need to instantiate the scheduler to interact with the simulator, which is also pre-built in various types (e.g., heuristic, machine learning, and operations research) of scheduling algorithms to speed up the algorithm design. The visualizer, as an auxiliary component of the simulator and scheduler, facilitates researchers to conduct an in-depth analysis of the scheduling procedure and comprehensively compare different scheduling algorithms. We believe that VMAgent would shed light on the AI for the VM scheduling community, and the demo video is presented in https://bit.ly/vmagent-demo-video."
