,title,track,categories,url,desc
23,Conditional Generative Adversarial Networks for Commonsense Machine Comprehension,Main,"['Information Extraction', 'Question Answering']",https://www.ijcai.org/proceedings/2017/576,"Recently proposed Story Cloze Test [Mostafazadeh et al., 2016] is a commonsense machine comprehension application to deal with natural language understanding problem. This dataset contains a lot of story tests which require commonsense inference ability. Unfortunately, the training data is almost unsupervised where each context document followed with only one positive sentence that can be inferred from the context. However, in the testing period, we must make inference from two candidate sentences. To tackle this problem, we employ the generative adversarial networks (GANs) to generate fake sentence. We proposed a Conditional GANs in which the generator is conditioned by the context. Our experiments show the advantage of the CGANs in discriminating sentence and achieve state-of-the-art results in commonsense story reading comprehension task compared with previous feature engineering and deep learning methods."
24,Joint Learning on Relevant User Attributes in Micro-blog,Main,"['Natural Language Processing', 'NLP Applications and Tools']",https://www.ijcai.org/proceedings/2017/577,"User attribute classification aims to identify users’ attributes (e.g., gender, age and profession) by leveraging user generated content. However, conventional approaches to user attribute classification focus on single attribute classification involving only one user attribute, which completely ignores the relationship among various user attributes. In this paper, we confront a novel scenario in user attribute classification where relevant user attributes are jointly learned, attempting to make the relevant attribute classification tasks help each other. Specifically, we propose a joint learning approach, namely Aux-LSTM, which first learns a proper auxiliary representation between the related tasks and then leverages the auxiliary representation to integrate the learning process in both tasks. Empirical studies demonstrate the effectiveness of our proposed approach to joint learning on relevant user attributes."
25,Learning Sentence Representation with Guidance of Human Attention,Main,"['Natural Language Semantics', 'Natural Language Processing']",https://www.ijcai.org/proceedings/2017/578,"Recently, much progress has been made in learning general-purpose sentence representations that can be used across domains. However, most of the existing models typically treat each word in a sentence equally. In contrast, extensive studies have proven that human read sentences efficiently by making a sequence of fixation and saccades. This motivates us to improve sentence representations by assigning different weights to the vectors of the component words, which can be treated as an attention mechanism on single sentences. To that end, we propose two novel attention models, in which the attention weights are derived using significant predictors of human reading time, i.e., Surprisal, POS tags and CCG supertags. The extensive experiments demonstrate that the proposed methods significantly improve upon the state-of-the-art sentence representation models."
26,Bilateral Multi-Perspective Matching for Natural Language Sentences,Main,"['Information Retrieval', 'Natural Language Semantics', 'Natural Language Processing', 'Question Answering']",https://www.ijcai.org/proceedings/2017/579,"Natural language sentence matching is a fundamental technology for a variety of tasks. Previous approaches either match sentences from a single direction or only apply single granular (word-by-word or sentence-by-sentence) matching. In this work, we propose a bilateral multi-perspective matching (BiMPM) model. Given two sentences P and Q, our model first encodes them with a BiLSTM encoder. Next, we match the two encoded sentences in two directions P against Q and P against Q. In each matching direction, each time step of one sentence is matched against all time-steps of the other sentence from multiple perspectives. Then, another BiLSTM layer is utilized to aggregate the matching results into a fix-length matching vector. Finally, based on the matching vector, a decision is made through a fully connected layer. We evaluate our model on three tasks: paraphrase identification, natural language inference and answer sentence selection. Experimental results on standard benchmark datasets show that our model achieves the state-of-the-art performance on all tasks."
27,DDoS Event Forecasting using Twitter Data,Main,"['Natural Language Processing', 'NLP Applications and Tools']",https://www.ijcai.org/proceedings/2017/580,"Distributed Denial of Service (DDoS) attacks have been significant threats to the Internet. Traditional research in cyber security focuses on detecting emerging DDoS attacks by tracing network package flow. A characteristic of DDoS defense is that rescue time is limited since the launch of attack. More resilient detection and defence models are typically more costly. We aim at predicting the likelihood of DDoS attacks by monitoring relevant text streams in social media, so that the level of defense can be adjusted dynamically for maximizing cost-effect. To our knowledge, this is a novel and challenge research question for DDoS rescue. Because the input of this task is a text stream rather than a document, information should be collected both on the textual content of individual posts. We propose a fine-grained hierarchical stream model to capture semantic information over infinitely long history, and reveal burstiness and trends. Empirical evaluation shows that social text streams are indeed informative for DDoS forecasting, and our proposed hierarchical model is more effective compared to strong baseline text stream models and discrete bag-of-words models."
28,A Neural Model for Joint Event Detection and Summarization,Main,"['Natural Language Processing', 'NLP Applications and Tools']",https://www.ijcai.org/proceedings/2017/581,"Twitter new event detection aims to identify first stories in a tweet stream. Typical approaches consider two sub tasks. First, it is necessary to filter out mundane or irrelevant tweets. Second, tweets are grouped automatically into event clusters. Traditionally, these two sub tasks are processed separately, and integrated under a pipeline setting, despite that there is inter-dependence between the two tasks. In addition, one further related task is summarization, which is to extract a succinct summary for representing a large group of tweets. Summarization is related to detection, under the new event setting in that salient information is universal between event representing tweets and informative event summaries. In this paper, we build a joint model to filter, cluster, and summarize the tweets for new events. In particular, deep representation learning is used to vectorize tweets, which serves as basis that connects tasks. A neural stacking model is used for integrating a pipeline of different sub tasks, and for better sharing between the predecessor and successors. Experiments show that our proposed neural joint model is more effective compared to its pipeline baseline."
29,A Variational Autoencoding Approach for Inducing Cross-lingual Word Embeddings,Main,"['Natural Language Semantics', 'Text Classification']",https://www.ijcai.org/proceedings/2017/582,"Cross-language learning allows one to use training data from one language to build models for another language. Many traditional approaches require word-level alignment sentences from parallel corpora, in this paper we define a general bilingual training objective function requiring sentence level parallel corpus only. We propose a variational autoencoding approach for training bilingual word embeddings. The variational model introduces a continuous latent variable to explicitly model the underlying semantics of the parallel sentence pairs and to guide the generation of the sentence pairs. Our model restricts the bilingual word embeddings to represent words in exactly the same continuous vector space. Empirical results on the task of cross lingual document classification has shown that our method is effective."
30,Learning to Identify Ambiguous and Misleading News Headlines,Main,"['Natural Language Processing', 'NLP Applications and Tools', 'Text Classification']",https://www.ijcai.org/proceedings/2017/583,"Accuracy is one of the basic principles of journalism. However, it is increasingly hard to manage due to the diversity of news media. Some editors of online news tend to use catchy headlines which trick readers into clicking. These headlines are either ambiguous or misleading, degrading the reading experience of the audience. Thus, identifying inaccurate news headlines is a task worth studying. Previous work names these headlines ``clickbaits'' and mainly focus on the features extracted from the headlines, which limits the performance since the consistency between headlines and news bodies is underappreciated. In this paper, we clearly redefine the problem and identify ambiguous and misleading headlines separately. We utilize class sequential rules to exploit structure information when detecting ambiguous headlines. For the identification of misleading headlines, we extract features based on the congruence between headlines and bodies. To make use of the large unlabeled data set, we apply a co-training method and gain an increase in performance. The experiment results show the effectiveness of our methods. Then we use our classifiers to detect inaccurate headlines crawled from different sources and conduct a data analysis."
31,Improved Neural Machine Translation with Source Syntax,Main,"['Machine Translation', 'Natural Language Processing']",https://www.ijcai.org/proceedings/2017/584,"Neural Machine Translation (NMT) based on the encoder-decoder architecture has recently achieved the state-of-the-art performance. Researchers have proven that extending word level attention to phrase level attention by incorporating source-side phrase structure can enhance the attention model and achieve promising improvement. However, word dependencies that can be crucial to correctly understand a source sentence are not always in a consecutive fashion (i.e. phrase structure), sometimes they can be in long distance. Phrase structures are not the best way to explicitly model long distance dependencies. In this paper we propose a simple but effective method to incorporate source-side long distance dependencies into NMT. Our method based on dependency trees enriches each source state with global dependency structures, which can better capture the inherent syntactic structure of source sentences. Experiments on Chinese-English and English-Japanese translation tasks show that our proposed method outperforms state-of-the-art SMT and NMT baselines."
32,Symbolic Priors for RNN-based Semantic Parsing,Main,['Question Answering'],https://www.ijcai.org/proceedings/2017/585,"Seq2seq models based on Recurrent Neural Networks (RNNs) have recently received a lot of attention in the domain of Semantic Parsing. While in principle they can be trained directly on pairs (natural language utterances, logical forms), their performance is limited by the amount of available data. To alleviate this problem, we propose to exploit various sources of prior knowledge: the well-formedness of the logical forms is modeled by a weighted context-free grammar; the likelihood that certain entities present in the input utterance are also present in the logical form is modeled by weighted finite-state automata. The grammar and automata are combined together through an efficient intersection algorithm to form a soft guide (“background”) to the RNN.We test our method on an extension of the Overnight dataset and show that it not only strongly improves over an RNN baseline, but also outperforms non-RNN models based on rich sets of hand-crafted features."
33,Fast Parallel Training of Neural Language Models,Main,"['Natural Language Processing', 'NLP Applications and Tools']",https://www.ijcai.org/proceedings/2017/586,"Training neural language models (NLMs) is very time consuming and we need parallelization for system speedup. However, standard training methods have poor scalability across multiple devices (e.g., GPUs) due to the huge time cost required to transmit data for gradient sharing in the back-propagation process. In this paper we present a sampling-based approach to reducing data transmission for better scaling of NLMs. As a ''bonus'', the resulting model also improves the training speed on a single device. Our approach yields significant speed improvements on a recurrent neural network-based language model. On four NVIDIA GTX1080 GPUs, it achieves a speedup of 2.1+ times over the standard asynchronous stochastic gradient descent baseline, yet with no increase in perplexity. This is even 4.2 times faster than the naive single GPU counterpart."
34,Lexical Sememe Prediction via Word Embeddings and Matrix Factorization,Main,"['Natural Language Semantics', 'Natural Language Processing']",https://www.ijcai.org/proceedings/2017/587,"Sememes are defined as the minimum semantic units of human languages. People have manually annotated lexical sememes for words and form linguistic knowledge bases. However, manual construction is time-consuming and labor-intensive, with significant annotation inconsistency and noise. In this paper, we for the first time explore to automatically predict lexical sememes based on semantic meanings of words encoded by word embeddings. Moreover, we apply matrix factorization to learn semantic relations between sememes and words. In experiments, we take a real-world sememe knowledge base HowNet for training and evaluation, and the results reveal the effectiveness of our method for lexical sememe prediction. Our method will be of great use for annotation verification of existing noisy sememe knowledge bases and annotation suggestion of new words and phrases."
35,A Correlated Topic Model Using Word Embeddings,Main,"['Natural Language Generation', 'Natural Language Semantics']",https://www.ijcai.org/proceedings/2017/588,"Conventional correlated topic models are able to capture correlation structure among latent topics by replacing the Dirichlet prior with the logistic normal distribution. Word embeddings have been proven to be able to capture semantic regularities in language. Therefore, the semantic relatedness and correlations between words can be directly calculated in the word embedding space, for example, via cosine values. In this paper, we propose a novel correlated topic model using word embeddings. The proposed model enables us to exploit the additional word-level correlation information in word embeddings and directly model topic correlation in the continuous word embedding space. In the model, words in documents are replaced with meaningful word embeddings, topics are modeled as multivariate Gaussian distributions over the word embeddings and topic correlations are learned among the continuous Gaussian topics. A Gibbs sampling solution with data augmentation is given to perform inference. We evaluate our model on the 20 Newsgroups dataset and the Reuters-21578 dataset qualitatively and quantitatively. The experimental results show the effectiveness of our proposed model."
36,Learning Conversational Systems that Interleave Task and Non-Task Content,Main,"['Dialogue', 'NLP Applications and Tools']",https://www.ijcai.org/proceedings/2017/589,"Task-oriented dialog systems have been applied in various tasks, such as automated personal assistants, customer service providers and tutors. These systems work well when users have clear and explicit intentions that are well-aligned to the systems' capabilities. However, they fail if users intentions are not explicit.To address this shortcoming, we propose a framework to interleave non-task content (i.e.everyday social conversation) into task conversations. When the task content fails, the system can still keep the user engaged with the non-task content. We trained a policy using reinforcement learning algorithms to promote  long-turn conversation coherence and consistency, so that the system can have smooth transitions between task and non-task content.To test the effectiveness of the proposed framework, we developed a movie promotion dialog system. Experiments with human users indicate that a system that interleaves social and task content achieves a better task success rate and is also rated as more engaging compared to a pure task-oriented system."
37,AGRA: An Analysis-Generation-Ranking Framework for Automatic Abbreviation from Paper Titles,Main,['NLP Applications and Tools'],https://www.ijcai.org/proceedings/2017/590,"People sometimes choose word-like abbreviations to refer to items with a long description. These abbreviations usually come from the descriptive text of the item and are easy to remember and pronounce, while preserving the key idea of the item. Coming up with a nice abbreviation is not an easy job, even for human. Previous assistant naming systems compose names by applying hand-written rules, which may not perform well. In this paper, we propose to view the naming task as an artificial intelligence problem and create a data set in the domain of academic naming. To generate more delicate names, we propose a three-step framework, including description analysis, candidate generation and abbreviation ranking, each of which is parameterized and optimizable. We conduct experiments to compare different settings of our framework with several analysis approaches from different perspectives. Compared to online or baseline systems, our framework could achieve the best results."
38,Segmenting Chinese Microtext: Joint Informal-Word Detection and Segmentation with Neural Networks,Main,"['Phonology, Morphology, and word segmentation', 'Natural Language Processing']",https://www.ijcai.org/proceedings/2017/591,"State-of-the-art Chinese word segmentation systems typically exploit supervised modelstrained on a standard manually-annotated corpus,achieving performances over 95% on a similar standard testing corpus.However, the performances may drop significantly when the same models are applied onto Chinese microtext.One major challenge is the issue of informal words in the microtext.Previous studies show that informal word detection can be helpful for microtext processing.In this work, we investigate it under the neural setting, by proposing a joint segmentation model that integrates the detection of informal words simultaneously.In addition, we generate training corpus for the joint model by using existing corpus automatically.Experimental results show that the proposed model is highly effective for segmentation of Chinese microtext."
39,Automatic Generation of Grounded Visual Questions,Main,['Question Answering'],https://www.ijcai.org/proceedings/2017/592,"In this paper, we propose the first model to be able to generate visually grounded questions with diverse types for a single image. Visual question generation is an emerging topic which aims to ask questions in natural language based on visual input. To the best of our knowledge, it lacks automatic methods to generate meaningful questions with various types for the same visual input. To circumvent the problem, we propose a model that automatically generates visually grounded questions with varying types. Our model takes as input both images and the captions generated by a dense caption model, samples the most probable question types, and generates the questions in sequel. The experimental results on two real world datasets show that our model outperforms the strongest baseline in terms of both correctness and diversity with a wide margin."
40,Entity Suggestion with Conceptual Expanation,Main,"['Natural Language Semantics', 'Information Retrieval']",https://www.ijcai.org/proceedings/2017/593,"Entity Suggestion with Conceptual Explanation (ESC) refers to a type of entity acquisition query in which a user provides a set of example entities as the query and obtains in return not only some related entities but also concepts which can best explain the query and the result. ESC is useful in many applications such as related-entity recommendation and query expansion. Many example based entity suggestion solutions are available in existing literatures. However, they are generally not aware of the concepts of query entities thus cannot be used for conceptual explanation. In this paper, we propose two probabilistic entity suggestion models and their computation solutions. Our models and solutions fully take advantage of the large scale taxonomies which consist of isA relations between entities and concepts. With our models and solutions, we can not only find the best entities to suggest but also derive the best concepts to explain the suggestion. Extensive evaluations on real data sets justify the accuracy of our models and the efficiency of our solutions."
41,Maximum Expected Likelihood Estimation for Zero-resource Neural Machine Translation,Main,"['Machine Translation', 'Natural Language Processing']",https://www.ijcai.org/proceedings/2017/594,"While neural machine translation (NMT) has made remarkable progress in translating a handful of high-resource language pairs recently, parallel corpora are not always available for many zero-resource language pairs. To deal with this problem, we propose an approach to zero-resource NMT via maximum expected likelihood estimation. The basic idea is to maximize the expectation with respect to a pivot-to-source translation model for the intended source-to-target model on a pivot-target parallel corpus. To approximate the expectation, we propose two methods to connect the pivot-to-source and source-to-target models. Experiments on two zero-resource language pairs show that the proposed approach yields substantial gains over baseline methods. We also observe  that when trained jointly with the source-to-target model, the pivot-to-source translation model also obtains improvements over independent training."
42,Iterative Entity Alignment via Joint Knowledge Embeddings,Main,"['Information Extraction', 'Natural Language Semantics', 'Natural Language Processing']",https://www.ijcai.org/proceedings/2017/595,"Entity alignment aims to link entities and their counterparts among multiple knowledge graphs (KGs). Most existing methods typically rely on external information of entities such as Wikipedia links and require costly manual feature construction to complete alignment. In this paper, we present a novel approach for entity alignment via joint knowledge embeddings. Our method jointly encodes both entities and relations of various KGs into a unified low-dimensional semantic space according to a small seed set of aligned entities. During this process, we can align entities according to their semantic distance in this joint semantic space. More specifically, we present an iterative and parameter sharing method to improve alignment performance. Experiment results on real-world datasets show that, as compared to baselines, our method achieves significant improvements on entity alignment, and can further improve knowledge graph completion performance on various KGs with the favor of joint knowledge embeddings."
