,title,track,categories,url,desc
59,ERNIE-GEN: An Enhanced Multi-Flow Pre-training and Fine-tuning Framework for Natural Language Generation,Main,"['Natural Language Generation', 'Natural Language Processing', 'Natural Language Summarization']",https://www.ijcai.org/proceedings/2020/553,"Current pre-training works in natural language generation pay little attention to the problem of exposure bias on downstream tasks. To address this issue, we propose an enhanced multi-flow sequence to sequence pre-training and fine-tuning framework named ERNIE-GEN, which bridges the discrepancy between training and inference with an infilling generation mechanism and a noise-aware generation method. To make generation closer to human writing patterns, this framework introduces a span-by-span generation flow that trains the model to predict semantically-complete spans consecutively rather than predicting word by word. Unlike existing pre-training methods, ERNIE-GEN incorporates multi-granularity target sampling to construct pre-training data, which enhances the correlation between encoder and decoder. Experimental results demonstrate that ERNIE-GEN achieves state-of-the-art results with a much smaller amount of pre-training data and parameters on a range of language generation tasks, including abstractive summarization (Gigaword and CNN/DailyMail), question generation (SQuAD), dialogue generation (Persona-Chat) and generative question answering (CoQA). The source codes and pre-trained models have been released at https://github.com/PaddlePaddle/ERNIE/ernie-gen."
60,TransOMCS: From Linguistic Graphs to Commonsense Knowledge,Main,"['Knowledge Extraction', 'Resources and Evaluation']",https://www.ijcai.org/proceedings/2020/554,"Commonsense knowledge acquisition is a key problem for artificial intelligence. Conventional methods of acquiring commonsense knowledge generally require laborious and costly human annotations, which are not feasible on a large scale. In this paper, we explore a practical way of mining commonsense knowledge from linguistic graphs, with the goal of transferring cheap knowledge obtained with linguistic patterns into expensive commonsense knowledge. The result is a conversion of ASER [Zhang et al., 2020], a large-scale selectional preference knowledge resource, into TransOMCS, of the same representation as ConceptNet [Liu and Singh, 2004] but two orders of magnitude larger. Experimental results demonstrate the transferability of linguistic knowledge to commonsense knowledge and the effectiveness of the proposed approach in terms of quantity, novelty, and quality. TransOMCS is publicly available at: https://github.com/HKUST-KnowComp/TransOMCS."
61,Teacher-Student Networks with Multiple Decoders for Solving Math Word Problem,Main,"['Natural Language Generation', 'Question Answering']",https://www.ijcai.org/proceedings/2020/555,"Math word problem (MWP) is challenging due to the limitation in training data where only one “standard” solution is available. MWP models often simply fit this solution rather than truly understand or solve the problem. The generalization of models (to diverse word scenarios) is thus limited. To address this problem, this paper proposes a novel approach, TSN-MD, by leveraging the teacher network to integrate the knowledge of equivalent solution expressions and then to regularize the learning behavior of the student network. In addition, we introduce the multiple-decoder student network to generate multiple candidate solution expressions by which the final answer is voted. In experiments, we conduct extensive comparisons and ablative studies on two large-scale MWP benchmarks, and show that using TSN-MD can surpass the state-of-the-art works by a large margin. More intriguingly, the visualization results demonstrate that TSN-MD not only produces correct final answers but also generates diverse equivalent expressions of the solution."
62,Generalized Zero-Shot Text Classification for ICD Coding,Main,"['Text Classification', 'NLP Applications and Tools']",https://www.ijcai.org/proceedings/2020/556,"The International Classification of Diseases (ICD) is a list of classification codes for the diagnoses. Automatic ICD coding is a multi-label text classification problem with noisy clinical document inputs and long-tailed label distribution, making it difficult for fine-grained classification on both frequent and zero-shot codes at the same time, i.e. generalized zero-shot ICD coding. In this paper, we propose a latent feature generation framework to improve the prediction on unseen codes without compromising the performance on seen codes. Our framework generates semantically meaningful features for zero-shot codes by exploiting ICD code hierarchical structure and reconstructing the code-relevant keywords with a novel cycle architecture. To the best of our knowledge, this is the first adversarial generative model for generalized zero-shot learning on multi-label text classification. Extensive experiments demonstrate the effectiveness of our approach. On the public MIMIC-III dataset, our methods improve the F1 score from nearly 0 to 20.91% for the zero-shot codes, and increase the AUC score by 3% (absolute improvement) from previous state of the art. Code is available at https://github.com/csong27/gzsl_text."
63,Gated POS-Level Language Model for Authorship Verification,Main,"['Natural Language Processing', 'NLP Applications and Tools', 'Other']",https://www.ijcai.org/proceedings/2020/557,"Authorship verification is an important problem that has many applications. The state-of-the-art deep authorship verification methods typically leverage character-level language models to encode author-specific writing styles. However, they often fail to capture syntactic level patterns, leading to sub-optimal accuracy in cross-topic scenarios. Also, due to imperfect cross-author parameter sharing, it's difficult for them to distinguish author-specific writing style from common patterns, leading to data-inefficient learning.  This paper introduces a novel POS-level (Part of Speech) gated RNN based language model to effectively learn the author-specific syntactic styles. The author-agnostic syntactic information obtained from the POS tagger pre-trained on large external datasets greatly reduces the number of effective parameters of our model, enabling the model to learn accurate author-specific syntactic styles with limited training data. We also utilize a gated architecture to learn the common syntactic writing styles with a small set of shared parameters and let the author-specific parameters focus on each author's special syntactic styles. Extensive experimental results show that our method achieves significantly better accuracy than state-of-the-art competing methods, especially in cross-topic scenarios (over 5\% in terms of AUC-ROC)."
64,Modeling Dense Cross-Modal Interactions for Joint Entity-Relation Extraction,Main,"['Information Extraction', 'Named Entities']",https://www.ijcai.org/proceedings/2020/558,"Joint extraction of entities and their relations benefits from the close interaction between named entities and their relation information. Therefore, how to effectively model such cross-modal interactions is critical for the final performance. Previous works have used simple methods such as label-feature concatenation to perform coarse-grained semantic fusion among cross-modal instances, but fail to capture fine-grained correlations over token and label spaces, resulting in insufficient interactions. In this paper, we propose a deep Cross-Modal Attention Network (CMAN) for joint entity and relation extraction. The network is carefully constructed by stacking multiple attention units in depth to fully model dense interactions over token-label spaces, in which two basic attention units are proposed to explicitly capture fine-grained correlations across different modalities (e.g., token-to-token and labelto-token). Experiment results on CoNLL04 dataset show that our model obtains state-of-the-art results by achieving 90.62% F1 on entity recognition and 72.97% F1 on relation classification. In ADE dataset, our model surpasses existing approaches by more than 1.9% F1 on relation classification. Extensive analyses further confirm the effectiveness of our approach."
65,Knowledge Graphs Enhanced Neural Machine Translation,Main,"['Machine Translation', 'Natural Language Generation']",https://www.ijcai.org/proceedings/2020/559,"Knowledge graphs (KGs) store much structured information on various entities, many of which are not covered by the parallel sentence pairs of neural machine translation (NMT). To improve the translation quality of these entities, in this paper we propose a novel KGs enhanced NMT method. Specifically, we first induce the new translation results of these entities by transforming the source and target KGs into a unified semantic space. We then generate adequate pseudo parallel sentence pairs that contain these induced entity pairs. Finally, NMT model is jointly trained by the original and pseudo sentence pairs. The extensive experiments on Chinese-to-English and Englishto-Japanese translation tasks demonstrate that our method significantly outperforms the strong baseline models in translation quality, especially in handling the induced entities."
66,Fast and Accurate Neural CRF Constituency Parsing,Main,"['Tagging, chunking, and parsing']",https://www.ijcai.org/proceedings/2020/560,"Estimating probability distribution is one of the core issues in the NLP field.  However, in both deep learning (DL) and pre-DL eras, unlike the vast applications of linear-chain CRF in sequence labeling tasks, very few works have applied tree-structure CRF to constituency parsing, mainly due to the complexity and inefficiency of the inside-outside algorithm. This work presents a fast and accurate neural CRF constituency parser.  The key idea is to batchify the inside algorithm for loss computation by direct large tensor operations on GPU, and meanwhile avoid the outside algorithm for gradient computation via efficient back-propagation. We also propose a simple two-stage bracketing-then-labeling parsing approach to improve efficiency further. To improve the parsing performance, inspired by recent progress in dependency parsing, we introduce a new scoring architecture based on boundary representation and biaffine attention, and a beneficial dropout strategy. Experiments on PTB, CTB5.1, and CTB7 show that our two-stage CRF parser achieves new state-of-the-art performance on both settings of w/o and w/ BERT, and can parse over 1,000 sentences per second. We release our code at https://github.com/yzhangcs/crfpar."
67,A Relation-Specific Attention Network for Joint Entity and Relation Extraction,Main,"['Information Extraction', 'Knowledge Extraction']",https://www.ijcai.org/proceedings/2020/561,"Joint extraction of entities and relations is an important task in natural language processing (NLP), which aims to capture all relational triplets from plain texts. This is a big challenge due to some of the triplets extracted from one sentence may have overlapping entities. Most existing methods perform entity recognition followed by relation detection between every possible entity pairs, which usually suffers from numerous redundant operations. In this paper, we propose a relation-specific attention network (RSAN) to handle the issue. Our RSAN utilizes relation-aware attention mechanism to construct specific sentence representations for each relation, and then performs sequence labeling to extract its corresponding head and tail entities. Experiments on two public datasets show that our model can effectively extract overlapping triplets and achieve state-of-the-art performance."
