,title,track,categories,url,desc
20,Neural Abstractive Summarization with Structural Attention,Main,"['Natural Language Summarization', 'Other']",https://www.ijcai.org/proceedings/2020/514,"Attentional, RNN-based encoder-decoder architectures have obtained impressive performance on abstractive summarization of news articles. However, these methods fail to account for long term dependencies within the sentences of a document. This problem is exacerbated in multi-document summarization tasks such as summarizing the popular opinion in threads present in community question answering (CQA) websites such as Yahoo! Answers and Quora. These threads contain answers which often overlap or contradict each other. In this work, we present  a hierarchical encoder based on structural attention to model such inter-sentence and inter-document dependencies. We set the popular pointer-generator architecture and some of the architectures derived from it as our baselines and show that they fail to generate good summaries in a multi-document setting. We further illustrate that our proposed model achieves significant improvement  over the baseline in both single and multi-document summarization settings -- in the former setting, it beats the  baseline by 1.31 and 7.8 ROUGE-1 points on CNN and CQA datasets, respectively; in the latter setting, the performance is further improved by   1.6 ROUGE-1 points on the CQA dataset."
21,Domain Adaptation for Semantic Parsing,Main,"['Natural Language Processing', 'Natural Language Semantics']",https://www.ijcai.org/proceedings/2020/515,"Recently, semantic parsing has attracted much attention in the community. Although many neural modeling efforts have greatly improved the performance, it still suffers from the data scarcity issue. In this paper, we propose a novel semantic parser for domain adaptation, where we have much fewer annotated data in the target domain compared to the source domain. Our semantic parser benefits from a two-stage coarse-to-fine framework, thus can provide different and accurate treatments for the two stages, i.e., focusing on domain invariant and domain specific information, respectively. In the coarse stage, our novel domain discrimination component and domain relevance attention encourage the model to learn transferable domain general structures. In the fine stage, the model is guided to concentrate on domain related details. Experiments on a benchmark dataset show that our method consistently outperforms several popular domain adaptation strategies.  Additionally, we show that our model can well exploit limited target data to capture the difference between the source and target domain, even when the target domain has far fewer training instances."
22,Evaluating Natural Language Generation via Unbalanced Optimal Transport,Main,"['Natural Language Generation', 'Machine Translation', 'Dialogue']",https://www.ijcai.org/proceedings/2020/516,"Embedding-based evaluation measures have shown promising improvements on the correlation with human judgments in natural language generation. In these measures, various intrinsic metrics are used in the computation, including generalized precision, recall, F-score and the earth mover's distance. However, the relations between these metrics are unclear, making it difficult to determine which measure to use in real applications. In this paper, we provide an in-depth study on the relations between these metrics. Inspired by the optimal transportation theory, we prove that these metrics correspond to the optimal transport problem with different hard marginal constraints. However, these hard marginal constraints may cause the problem of incomplete and noisy matching in the evaluation process. Therefore we propose a family of new evaluation metrics, namely Lazy Earth Mover's Distances, based on the more general unbalanced optimal transport problem. Experimental results on WMT18 and WMT19 show that our proposed metrics have the ability to produce more consistent evaluation results with human judgements, as compared with existing intrinsic metrics."
23,Modeling Topical Relevance for Multi-Turn Dialogue Generation,Main,"['Dialogue', 'Natural Language Generation']",https://www.ijcai.org/proceedings/2020/517,"Topic drift is a common phenomenon in multi-turn dialogue. Therefore, an ideal dialogue generation models should be able to capture the topic information of each context, detect the relevant context, and produce appropriate responses accordingly. However, existing models usually use word or sentence level similarities to detect the relevant contexts, which fail to well capture the topical level relevance. In this paper, we propose a new model, named STAR-BTM, to tackle this problem. Firstly, the Biterm Topic Model is pre-trained on the whole training dataset. Then, the topic level attention weights are computed based on the topic representation of each context. Finally, the attention weights and the topic distribution are utilized in the decoding process to generate the corresponding responses. Experimental results on both Chinese customer services data and English Ubuntu dialogue data show that STAR-BTM significantly outperforms several state-of-the-art methods, in terms of both metric-based and human evaluations."
24,Robust Front-End for Multi-Channel ASR using Flow-Based Density Estimation,Main,['Speech'],https://www.ijcai.org/proceedings/2020/518,"For multi-channel speech recognition, speech enhancement techniques such as denoising or dereverberation are conventionally applied as a front-end processor. Deep learning-based front-ends using such techniques require aligned clean and noisy speech pairs which are generally obtained via data simulation. Recently, several joint optimization techniques have been proposed to train the front-end without parallel data within an end-to-end automatic speech recognition (ASR) scheme. However, the ASR objective is sub-optimal and insufficient for fully training the front-end, which still leaves room for improvement. In this paper, we propose a novel approach which incorporates flow-based density estimation for the robust front-end using non-parallel clean and noisy speech. Experimental results on the CHiME-4 dataset show that the proposed method outperforms the conventional techniques where the front-end is trained only with ASR objective."
25,Formal Query Building with Query Structure Prediction for Complex Question Answering over Knowledge Base,Main,"['Natural Language Processing', 'Question Answering']",https://www.ijcai.org/proceedings/2020/519,"Formal query building is an important part of complex question answering over knowledge bases. It aims to build correct executable queries for questions. Recent methods try to rank candidate queries generated by a state-transition strategy. However, this candidate generation strategy ignores the structure of queries, resulting in a considerable number of noisy queries. In this paper, we propose a new formal query building approach that consists of two stages. In the first stage, we predict the query structure of the question and leverage the structure to constrain the generation of the candidate queries. We propose a novel graph generation framework to handle the structure prediction task and design an encoder-decoder model to predict the argument of the predetermined operation in each generative step. In the second stage, we follow the previous methods to rank the candidate queries. The experimental results show that our formal query building approach outperforms existing methods on complex questions while staying competitive on simple questions."
26,Towards Fully 8-bit Integer Inference for the Transformer Model,Main,"['Natural Language Processing', 'Machine Translation']",https://www.ijcai.org/proceedings/2020/520,"8-bit integer inference, as a promising direction in reducing both the latency and storage of deep neural networks, has made great progress recently. On the other hand, previous systems still rely on 32-bit floating point for certain functions in complex models (e.g., Softmax in Transformer), and make heavy use of quantization and de-quantization. In this work, we show that after a principled modification on the Transformer architecture, dubbed Integer Transformer, an (almost) fully 8-bit integer inference algorithm Scale Propagation could be derived. De-quantization is adopted when necessary, which makes the network more efficient. Our experiments on WMT16 En<->Ro, WMT14 En<->De and En->Fr translation tasks as well as the WikiText-103 language modelling task show that the fully 8-bit Transformer system achieves comparable performance with the floating point baseline but requires nearly 4x less memory footprint."
27,TopicKA: Generating Commonsense Knowledge-Aware Dialogue Responses Towards the Recommended Topic Fact,Main,"['Dialogue', 'Natural Language Generation']",https://www.ijcai.org/proceedings/2020/521,"Insufficient semantic understanding of dialogue always leads to the appearance of generic responses, in generative dialogue systems. Recently, high-quality knowledge bases have been introduced to enhance dialogue understanding, as well as to reduce the prevalence of boring responses. Although such knowledge-aware approaches have shown tremendous potential, they always utilize the knowledge in a black-box fashion. As a result, the generation process is somewhat uncontrollable, and it is also not interpretable. In this paper, we introduce a topic fact-based commonsense knowledge-aware approach, TopicKA. Different from previous works, TopicKA generates responses conditioned not only on the query message but also on a topic fact with an explicit semantic meaning, which also controls the direction of generation. Topic facts are recommended by a recommendation network trained under the Teacher-Student framework. To integrate the recommendation network and the generation network, this paper designs four schemes, which include two non-sampling schemes and two sampling methods. We collected and constructed a large-scale Chinese commonsense knowledge graph. Experimental results on an open Chinese benchmark dataset indicate that our model outperforms baselines in terms of both the objective and the subjective metrics."
28,Infobox-to-text Generation with Tree-like Planning based Attention Network,Main,"['Natural Language Generation', 'Natural Language Processing']",https://www.ijcai.org/proceedings/2020/522,"We study the problem of infobox-to-text generation that aims to generate a textual description from a key-value table. Representing the input infobox as a sequence, previous neural methods using end-to-end models without order-planning suffer from the problems of incoherence and inadaptability to disordered input. Recent planning-based models only implement static order-planning to guide the generation, which may cause error propagation between planning and generation. To address these issues, we propose a Tree-like PLanning based Attention Network (Tree-PLAN) which leverages both static order-planning and dynamic tuning to guide the generation. A novel tree-like tuning encoder is designed to dynamically tune the static order-plan for better planning by merging the most relevant attributes together layer by layer. Experiments conducted on two datasets show that our model outperforms previous methods on both automatic and human evaluation, and demonstrate that our model has better adaptability to disordered input."
29,Triple-to-Text Generation with an Anchor-to-Prototype Framework,Main,"['Natural Language Generation', 'Natural Language Processing', 'NLP Applications and Tools', 'Other']",https://www.ijcai.org/proceedings/2020/523,"Generating a textual description from a set of RDF triplets is a challenging task in natural language generation. Recent neural methods have become the mainstream for this task, which often generate sentences from scratch. However, due to the huge gap between the structured input and the unstructured output, the input triples alone are insufficient to decide an expressive and specific description. In this paper, we propose a novel anchor-to-prototype framework to bridge the gap between structured RDF triples and natural text. The model retrieves a set of prototype descriptions from the training data and extracts writing patterns from them to guide the generation process. Furthermore, to make a more precise use of the retrieved prototypes, we employ a triple anchor that aligns the input triples into groups so as to better match the prototypes. Experimental results on both English and Chinese datasets show that our method significantly outperforms the state-of-the-art baselines in terms of both automatic and manual evaluation, demonstrating the benefit of learning guidance from retrieved prototypes to facilitate triple-to-text generation."
30,Attention as Relation: Learning Supervised Multi-head Self-Attention for Relation Extraction,Main,"['Information Extraction', 'Natural Language Processing']",https://www.ijcai.org/proceedings/2020/524,"Joint entity and relation extraction is critical for many natural language processing (NLP) tasks, which has attracted increasing research interest. However, it is still faced with the challenges of identifying the overlapping relation triplets along with the entire entity boundary and detecting the multi-type relations. In this paper, we propose an attention-based joint model, which mainly contains an entity extraction module and a relation detection module, to address the challenges. The key of our model is devising a supervised multi-head self-attention mechanism as the relation detection module to learn the token-level correlation for each relation type separately. With the attention mechanism, our model can effectively identify overlapping relations and flexibly predict the relation type with its corresponding intensity. To verify the effectiveness of our model, we conduct comprehensive experiments on two benchmark datasets. The experimental results demonstrate that our model achieves state-of-the-art performances."
31,An Iterative Multi-Source Mutual Knowledge Transfer Framework for Machine Reading Comprehension,Main,"['Natural Language Processing', 'Question Answering']",https://www.ijcai.org/proceedings/2020/525,"The lack of sufficient training data in many domains, poses a major challenge to the construction of domain-specific machine reading comprehension (MRC) models with satisfying performance. In this paper, we propose a novel iterative multi-source mutual knowledge transfer framework for MRC. As an extension of the conventional knowledge transfer with one-to-one correspondence, our framework focuses on the many-to-many mutual transfer, which involves synchronous executions of multiple many-to-one transfers in an iterative manner.Specifically, to update a target-domain MRC model, we first consider other domain-specific MRC models as individual teachers, and employ knowledge distillation to train a multi-domain MRC model, which is differentially required to fit the training data and match the outputs of these individual models according to their domain-level similarities to the target domain. After being initialized by the multi-domain MRC model, the target-domain MRC model is fine-tuned to match both its training data and the output of its previous best model simultaneously via knowledge distillation. Compared with previous approaches, our framework can continuously enhance all domain-specific MRC models by enabling each model to iteratively and differentially absorb the domain-shared knowledge from others. Experimental results and in-depth analyses on several benchmark datasets demonstrate the effectiveness of our framework."
32,Text Style Transfer via Learning Style Instance Supported Latent Space,Main,"['Natural Language Generation', 'Natural Language Processing']",https://www.ijcai.org/proceedings/2020/526,"Text style transfer pursues altering the style of a sentence while remaining its main content unchanged. Due to the lack of parallel corpora, most recent work focuses on unsupervised methods and has achieved noticeable progress. Nonetheless, the intractability of completely disentangling content from style for text leads to a contradiction of content preservation and style transfer accuracy. To address this problem, we propose a style instance supported method, StyIns. Instead of representing styles with embeddings or latent variables learned from single sentences, our model leverages the generative flow technique to extract underlying stylistic properties from multiple instances of each style, which form a more discriminative and expressive latent style space. By combining such a space with the attention-based structure, our model can better maintain the content and simultaneously achieve high transfer accuracy. Furthermore, the proposed method can be flexibly extended to semi-supervised learning so as to utilize available limited paired data. Experiments on three transfer tasks, sentiment modification, formality rephrasing, and poeticness generation, show that StyIns obtains a better balance between content and style, outperforming several recent baselines."
33,Learning with Noise: Improving Distantly-Supervised Fine-grained Entity Typing via Automatic Relabeling,Main,"['Information Extraction', 'Named Entities', 'Natural Language Processing', 'NLP Applications and Tools']",https://www.ijcai.org/proceedings/2020/527,"Fine-grained entity typing (FET) is a fundamental task for various entity-leveraging applications. Although great success has been made, existing systems still have challenges in handling noisy samples in training data introduced by distant supervision methods. To address these noise, previous studies either focus on processing the clean samples (i,e., have only one label) and noisy samples (i,e., have multiple labels) with different strategies or filtering the noisy labels based on the assumption that the distantly-supervised label set certainly contains the correct type label. In this paper, we propose a probabilistic automatic relabeling method which treats all training samples uniformly. Our method aims to estimate the pseudo-truth label distribution of each sample, and the pseudo-truth distribution will be treated as part of trainable parameters which are jointly updated during the training process. The proposed approach does not rely on any prerequisite or extra supervision, making it effective on real applications. Experiments on several benchmarks show that our method outperforms previous approaches and alleviates the noisy labeling problem."
34,Joint Time-Frequency and Time Domain Learning for Speech Enhancement,Main,['Speech'],https://www.ijcai.org/proceedings/2020/528,"For single-channel speech enhancement, both time-domain and time-frequency-domain methods have their respective pros and cons. In this paper, we present a cross-domain framework named TFT-Net, which takes time-frequency spectrogram as input and produces time-domain waveform as output. Such a framework takes advantage of the knowledge we have about spectrogram and avoids some of the drawbacks that T-F-domain methods have been suffering from. In TFT-Net, we design an innovative dual-path attention block (DAB) to fully exploit correlations along the time and frequency axes. We further discover that a sample-independent DAB (SDAB) achieves a good tradeoff between enhanced speech quality and complexity. Ablation studies show that both the cross-domain design and the SDAB block bring large performance gain. When logarithmic MSE is used as the training criteria, TFT-Net achieves the highest SDR and SSNR among state-of-the-art methods on two major speech enhancement benchmarks."
35,Answer Generation through Unified Memories over Multiple Passages,Main,"['Natural Language Generation', 'Natural Language Processing', 'Question Answering']",https://www.ijcai.org/proceedings/2020/529,"Machine reading comprehension methods that gen- erate answers by referring to multiple passages for a question have gained much attention in AI and NLP communities. The current methods, however, do not investigate the relationships among multi- ple passages in the answer generation process, even though topics correlated among the passages may be answer candidates. Our method, called neural answer Generation through Unified Memories over Multiple Passages (GUM-MP), solves this problem as follows. First, it determines which tokens in the passages are matched to the question. In particular, it investigates matches between tokens in positive passages, which are assigned to the question, and those in negative passages, which are not related to the question. Next, it determines which tokens in the passage are matched to other passages assigned to the same question and at the same time it investi- gates the topics in which they are matched. Finally, it encodes the token sequences with the above two matching results into unified memories in the pas- sage encoders and learns the answer sequence by using an encoder-decoder with a multiple-pointer- generator mechanism. As a result, GUM-MP can generate answers by pointing to important tokens present across passages. Evaluations indicate that GUM-MP generates much more accurate results than the current models do."
36,On the Importance of Word and Sentence Representation Learning in Implicit Discourse Relation Classification,Main,['Discourse'],https://www.ijcai.org/proceedings/2020/530,"Implicit discourse relation classification is one of the most difficult parts in shallow discourse parsing as the relation prediction without explicit connectives requires the language understanding at both the text span level and the sentence level. Previous studies mainly focus on the interactions between two arguments.  We argue that a powerful contextualized representation module, a bilateral multi-perspective matching module, and a global information fusion module are all important to implicit discourse analysis. We propose a novel model to combine these modules together. Extensive experiments show that our proposed model outperforms BERT and other state-of-the-art systems on the PDTB dataset by around 8% and CoNLL 2016 datasets around 16%.  We also analyze the effectiveness of different modules in the implicit discourse relation classification task and demonstrate how different levels of representation learning can affect the results."
37,MuLaN: Multilingual Label propagatioN for Word Sense Disambiguation,Main,"['Natural Language Semantics', 'Resources and Evaluation']",https://www.ijcai.org/proceedings/2020/531,"The knowledge acquisition bottleneck strongly affects the creation of multilingual sense-annotated data, hence limiting the power of supervised systems when applied to multilingual Word Sense Disambiguation. In this paper, we propose a semi-supervised approach based upon a novel label propagation scheme, which, by jointly leveraging contextualized word embeddings and the multilingual information enclosed in a knowledge base, projects sense labels from a high-resource language, i.e., English, to lower-resourced ones. Backed by several experiments, we provide empirical evidence that our automatically created datasets are of a higher quality than those generated by other competitors and lead a supervised model to achieve state-of-the-art performances in all multilingual Word Sense Disambiguation tasks. We make our datasets available for research purposes at https://github.com/SapienzaNLP/mulan."
38,Dialogue State Induction Using Neural Latent Variable Models,Main,['Dialogue'],https://www.ijcai.org/proceedings/2020/532,"Dialogue state modules are a useful component in a task-oriented dialogue system. Traditional methods find dialogue states by manually labeling training corpora, upon which neural models are trained. However, the labeling process can be costly, slow, error-prone, and more importantly, cannot cover the vast range of domains in real-world dialogues for customer service. We propose the task of dialogue state induction, building two neural latent variable models that mine dialogue states automatically from unlabeled customer service dialogue records. Results show that the models can effectively find meaningful dialogue states. In addition, equipped with induced dialogue states, a state-of-the-art dialogue system gives better performance compared with not using a dialogue state module."
39,CoSDA-ML: Multi-Lingual Code-Switching Data Augmentation  for Zero-Shot Cross-Lingual NLP,Main,['Natural Language Processing'],https://www.ijcai.org/proceedings/2020/533,"Multi-lingual contextualized embeddings, such as multilingual-BERT (mBERT), have shown success in a variety of zero-shot cross-lingual tasks. However, these models are limited by having inconsistent contextualized representations of subwords across different languages. Existing work addresses this issue by bilingual projection and fine-tuning technique. We propose a data augmentation framework to generate multi-lingual code-switching data to fine-tune mBERT, which encourages model to align representations from source and multiple target languages once by mixing their context information. Compared with the existing work, our method does not rely on bilingual sentences for training, and requires only one training process for multiple target languages.   Experimental results on five tasks with 19 languages show that our method leads to significantly improved performances for all the tasks compared with mBERT."
