,title,track,categories,url,desc
40,Task-Level Curriculum Learning for Non-Autoregressive Neural Machine Translation,Main,['Machine Translation'],https://www.ijcai.org/proceedings/2020/534,"Non-autoregressive translation (NAT) achieves faster inference speed but at the cost of worse accuracy compared with autoregressive translation (AT). Since AT and NAT can share model structure and AT is an easier task than NAT due to the explicit dependency on previous target-side tokens, a natural idea is to gradually shift the model training from the easier AT task to the harder NAT task. To smooth the shift from AT training to NAT training, in this paper, we introduce semi-autoregressive translation (SAT) as intermediate tasks. SAT contains a hyperparameter k, and each k value defines a SAT task with different degrees of parallelism. Specially, SAT covers AT and NAT as its special cases: it reduces to AT when k=1 and to NAT when k=N (N is the length of target sentence). We design curriculum schedules to gradually shift k from 1 to N, with different pacing functions and number of tasks trained at the same time. We called our method as task-level curriculum learning for NAT (TCL-NAT). Experiments on IWSLT14 De-En, IWSLT16 En-De, WMT14 En-De and De-En datasets show that TCL-NAT achieves significant accuracy improvements over previous NAT baselines and reduces the performance gap between NAT and AT models to 1-2 BLEU points, demonstrating the effectiveness of our proposed method."
41,End-to-End Transition-Based Online Dialogue Disentanglement,Main,"['Dialogue', 'Information Extraction', 'Information Retrieval']",https://www.ijcai.org/proceedings/2020/535,"Dialogue disentanglement aims to separate intermingled messages into detached sessions. The existing research focuses on two-step architectures, in which a model first retrieves the relationships between two messages and then divides the message stream into separate clusters. Almost all existing work puts significant efforts on selecting features for message-pair classification and clustering, while ignoring the semantic coherence within each session. In this paper, we introduce the first end-to- end transition-based model for online dialogue disentanglement. Our model captures the sequential information of each session as the online algorithm proceeds on processing a dialogue. The coherence in a session is hence modeled when messages are sequentially added into their best-matching sessions. Meanwhile, the research field still lacks data for studying end-to-end dialogue disentanglement, so we construct a large-scale dataset by extracting coherent dialogues from online movie scripts. We evaluate our model on both the dataset we developed and the publicly available Ubuntu IRC dataset [Kummerfeld et al., 2019]. The results show that our model significantly outperforms the existing algorithms. Further experiments demonstrate that our model better captures the sequential semantics and obtains more coherent disentangled sessions."
42,Hierarchical Multi-task Learning for Organization Evaluation of Argumentative Student Essays,Main,"['Discourse', 'NLP Applications and Tools']",https://www.ijcai.org/proceedings/2020/536,"Organization evaluation is an important dimension of automated essay scoring.  This paper focuses on discourse element (i.e., functions of sentences and paragraphs) based organization evaluation. Existing approaches mostly separate discourse element identification and organization evaluation. In contrast,  we propose a neural hierarchical multi-task learning approach for jointly optimizing sentence and paragraph level discourse element identification and organization evaluation. We represent the organization as a grid to simulate the visual layout of an essay and integrate discourse elements at multiple linguistic levels. Experimental results show that the multi-task learning based organization evaluation can achieve significant improvements compared with existing work and pipeline baselines.  Multiple level discourse element identification also benefits from multi-task learning through mutual enhancement."
43,Transformers as Soft Reasoners over Language,Main,['Question Answering'],https://www.ijcai.org/proceedings/2020/537,"Beginning with McCarthy's Advice Taker (1959), AI has pursued the goal of providing a system with explicit, general knowledge and having the system reason over that knowledge. However, expressing the knowledge in a formal (logical or probabilistic) representation has been a major obstacle to this research. This paper investigates a modern approach to this problem where the facts and rules are provided as natural language sentences, thus bypassing a formal representation. We train transformers to reason (or emulate reasoning) over these sentences using synthetically generated data. Our models, that we call RuleTakers, provide the first empirical demonstration that this kind of soft reasoning over language is learnable, can achieve high (99%) accuracy, and generalizes to test data requiring substantially deeper chaining than seen during training (95%+ scores). We also demonstrate that the models transfer well to two hand-authored rulebases, and to rulebases paraphrased into more natural language. These findings are significant as it suggests a new role for transformers, namely as limited ""soft theorem provers"" operating over explicit theories in language. This in turn suggests new possibilities for explainability, correctability, and counterfactual reasoning in question-answering."
44,Neural Machine Translation with Error Correction,Main,"['Machine Translation', 'Natural Language Generation']",https://www.ijcai.org/proceedings/2020/538,"Neural machine translation (NMT) generates the next target token given as input the previous ground truth target tokens during training while the previous generated target tokens during inference, which causes discrepancy between training and inference as well as error propagation, and affects the translation accuracy. In this paper, we introduce an error correction mechanism into NMT, which corrects the error information in the previous generated tokens to better predict the next token. Specifically, we introduce two-stream self-attention from XLNet into NMT decoder, where the query stream is used to predict the next token, and meanwhile the content stream is used to correct the error information from the previous predicted tokens. We leverage scheduled sampling to simulate the prediction errors during training. Experiments on three IWSLT translation datasets and two WMT translation datasets demonstrate that our method achieves improvements over Transformer baseline and scheduled sampling. Further experimental analyses also verify the effectiveness of our proposed error correction mechanism to improve the translation quality."
45,Alleviate Dataset Shift Problem in Fine-grained Entity Typing with Virtual Adversarial Training,Main,"['Information Extraction', 'Named Entities', 'Natural Language Processing']",https://www.ijcai.org/proceedings/2020/539,"The recent success of Distant Supervision (DS) brings abundant labeled data for the task of fine-grained entity typing (FET) without human annotation. However, the heuristically generated labels inevitably bring a significant distribution gap, namely dataset shift, between the distantly labeled training set and the manually curated test set. Considerable efforts have been made to alleviate this problem from the label perspective by either intelligently denoising the training labels, or designing noise-aware loss functions. Despite their progress, the dataset shift can hardly be eliminated completely. In this work, complementary to the label perspective, we reconsider this problem from the model perspective: Can we learn a more robust typing model with the existence of dataset shift? To this end, we propose a novel regularization module based on virtual adversarial training (VAT). The proposed approach first uses a self-paced sample selection function to select suitable samples for VAT, then constructs virtual adversarial perturbations based on the selected samples, and finally regularizes the model to be robust to such perturbations. Experiments on two benchmarks demonstrate the effectiveness of the proposed method, with an average 3.8%, 2.5%, and 3.2% improvement in accuracy, Macro F1 and Micro F1 respectively compared to the next best method."
46,Multi-hop Reading Comprehension across Documents with Path-based Graph Convolutional Network,Main,"['Natural Language Processing', 'Question Answering']",https://www.ijcai.org/proceedings/2020/540,"Multi-hop reading comprehension across multiple documents attracts much attentions recently. In this paper, we propose a novel approach to tackle this multi-hop reading comprehension problem. Inspired by the human reasoning processing, we introduce a path-based graph with reasoning paths which extracted from supporting documents. The path-based graph can combine both the idea of the graph-based  and path-based approaches, so it is better for multi-hop reasoning. Meanwhile, we propose Gated-GCN to accumulate evidences on the path-based graph, which contains a new question-aware gating mechanism to regulate the usefulness of information propagating across documents and add question information during reasoning. We evaluate our approach on WikiHop dataset, and our approach achieves the the-state-of-art accuracy against previous published approaches. Especially, our ensemble model surpasses the human performance by 4.2%."
47,Gaussian Embedding of Linked Documents from a Pretrained Semantic Space,Main,['Embeddings'],https://www.ijcai.org/proceedings/2020/541,"Gaussian Embedding of Linked Documents (GELD) is a new method that embeds linked documents (e.g., citation networks) onto a pretrained semantic space (e.g., a set of word embeddings). We formulate the problem in such a way that we model each document as a Gaussian distribution in the word vector space. We design a generative model that combines both words and links in a consistent way. Leveraging the variance of a document allows us to model the uncertainty related to word and link generation. In most cases, our method outperforms state-of-the-art methods when using our document vectors as features for usual downstream tasks. In particular, GELD achieves better accuracy in classification and link prediction on Cora and Dblp. In addition, we demonstrate qualitatively the convenience of several properties of our method. We provide the implementation of GELD and the evaluation datasets to the community (https://github.com/AntoineGourru/DNEmbedding)."
48,Better AMR-To-Text Generation with Graph Structure Reconstruction,Main,"['Natural Language Generation', 'Natural Language Processing']",https://www.ijcai.org/proceedings/2020/542,"AMR-to-text generation is a challenging task of generating texts from graph-based semantic representations. Recent studies formalize this task a graph-to-sequence learning problem and use various graph neural networks to model graph structure. In this paper, we propose a novel approach that generates texts from AMR graphs while reconstructing the input graph structures. Our model employs graph attention mechanism to aggregate information for encoding the inputs. Moreover, better node representations are learned by optimizing two simple but effective auxiliary reconstruction objectives: link prediction objective which requires predicting the semantic relationship between nodes, and distance prediction objective which requires predicting the distance between nodes. Experimental results on two benchmark datasets show that our proposed model improves considerably over strong baselines and achieves new state-of-the-art."
49,UniTrans : Unifying Model Transfer and Data Transfer for Cross-Lingual Named Entity Recognition with Unlabeled Data,Main,"['Information Extraction', 'Named Entities', 'Natural Language Processing']",https://www.ijcai.org/proceedings/2020/543,"Prior work in cross-lingual named entity recognition (NER) with no/little labeled data falls into two primary categories: model transfer- and data transfer-based methods. In this paper, we find that both method types can complement each other, in the sense that, the former can exploit context information via language-independent features but sees no task-specific information in the target language; while the latter generally generates pseudo target-language training data via translation but its exploitation of context information is weakened by inaccurate translations. Moreover, prior work rarely leverages unlabeled data in the target language, which can be effortlessly collected and potentially contains valuable information for improved results. To handle both problems, we propose a novel approach termed UniTrans to Unify both model and data Transfer for cross-lingual NER, and furthermore, leverage the available information from unlabeled target-language data via enhanced knowledge distillation. We evaluate our proposed UniTrans over 4 target languages on benchmark datasets. Our experimental results show that it substantially outperforms the existing state-of-the-art methods."
50,Efficient Context-Aware Neural Machine Translation with Layer-Wise Weighting and Input-Aware Gating,Main,['Machine Translation'],https://www.ijcai.org/proceedings/2020/544,"Existing Neural Machine Translation (NMT) systems are generally trained on a large amount of sentence-level parallel data, and during prediction sentences are independently translated, ignoring cross-sentence contextual information. This leads to inconsistency between translated sentences. In order to address this issue, context-aware models have been proposed. However, document-level parallel data constitutes only a small part of the parallel data available, and many approaches build context-aware models based on a pre-trained frozen sentence-level translation model in a two-step training manner. The computational cost of these approaches is usually high. In this paper, we propose to make the most of layers pre-trained on sentence-level data in contextual representation learning, reusing representations from the sentence-level Transformer and significantly reducing the cost of incorporating contexts in translation. We find that representations from shallow layers of a pre-trained sentence-level encoder play a vital role in source context encoding, and propose to perform source context encoding upon weighted combinations of pre-trained encoder layers' outputs. Instead of separately performing source context and input encoding, we propose to iteratively and jointly encode the source input and its contexts and to generate input-aware context representations with a cross-attention layer and a gating mechanism, which resets irrelevant information in context encoding. Our context-aware Transformer model outperforms the recent CADec [Voita et al., 2019c] on the English-Russian subtitle data and is about twice as fast in training and decoding."
51,Enhancing Dialog Coherence with Event Graph Grounded Content Planning,Main,['Dialogue'],https://www.ijcai.org/proceedings/2020/545,"How to generate informative, coherent and sustainable open-domain conversations is a non-trivial task. Previous work on knowledge grounded conversation generation focus on improving dialog informativeness with little attention on dialog coherence. In this paper, to enhance multi-turn dialog coherence, we propose to leverage event chains to help determine a sketch of a multi-turn dialog. We first extract event chains from narrative texts and connect them as a graph. We then present a novel event graph grounded Reinforcement Learning (RL) framework. It conducts high-level response content (simply an event) planning by learning to walk over the graph, and then produces a response conditioned on the planned content. In particular, we devise a novel multi-policy decision making mechanism to foster a coherent dialog with both appropriate content ordering and high contextual relevance. Experimental results indicate the effectiveness of this framework in terms of dialog coherence and informativeness."
52,Asking Effective and Diverse Questions: A Machine Reading Comprehension based Framework for Joint Entity-Relation Extraction,Main,"['Information Extraction', 'Natural Language Processing']",https://www.ijcai.org/proceedings/2020/546,"Recent advances cast the entity-relation extraction to a multi-turn question answering (QA) task and provide an effective solution based on the machine reading comprehension (MRC) models. However, they use a single question to characterize the meaning of entities and relations, which is intuitively not enough because of the variety of context semantics. Meanwhile, existing models enumerate all relation types to generate questions, which is inefficient and easily leads to confusing questions. In this paper, we improve the existing MRC-based entity-relation extraction model through diverse question answering. First, a diversity question answering mechanism is introduced to detect entity spans and two answering selection strategies are designed to integrate different answers. Then, we propose to predict a subset of potential relations and filter out irrelevant ones to generate questions effectively. Finally, entity and relation extractions are integrated in an end-to-end way and optimized through joint learning. Experiment results show that the proposed method significantly outperforms baseline models, which improves the relation F1 to 62.1% (+1.9%) on ACE05 and 71.9% (+3.0%) on CoNLL04. Our implementation is available at https://github.com/TanyaZhao/MRC4ERE."
53,Exploring Bilingual Parallel Corpora for Syntactically Controllable Paraphrase Generation,Main,"['Natural Language Generation', 'Natural Language Processing']",https://www.ijcai.org/proceedings/2020/547,"Paraphrase generation is of great importance to many downstream tasks in natural language processing. Recent efforts have focused on generating paraphrases in specific syntactic forms, which, generally, heavily relies on manually annotated paraphrase data that is not easily available for many languages and domains. In this paper, we propose a novel end-to-end framework to leverage existing large-scale bilingual parallel corpora to generate paraphrases under the control of syntactic exemplars. In order to train one model over the two languages of parallel corpora, we embed sentences of them into the same content and style spaces with shared content and style encoders using cross-lingual word embeddings. We propose an adversarial discriminator to disentangle the content and style space, and employ a latent variable to model the syntactic style of a given exemplar in order to guide the two decoders for generation. Additionally, we introduce cycle and masking learning schemes to efficiently train the model. Experiments and analyses demonstrate that the proposed model trained only on bilingual parallel data is capable of generating diverse paraphrases with desirable syntactic styles. Fine-tuning the trained model on a small paraphrase corpus makes it substantially outperform state-of-the-art paraphrase generation models trained on a larger paraphrase dataset."
54,A Structured Latent Variable Recurrent Network With Stochastic Attention For Generating Weibo Comments,Main,"['Natural Language Generation', 'NLP Applications and Tools']",https://www.ijcai.org/proceedings/2020/548,"Building intelligent agents to generate realistic Weibo comments is challenging. For such realistic Weibo comments, the key criterion is improving diversity while maintaining coherency. Considering that the variability of linguistic comments arises from multi-level sources, including both discourse-level properties and word-level selections, we improve the comment diversity by leveraging such inherent hierarchy. In this paper, we propose a structured latent variable recurrent network, which exploits the hierarchical-structured latent variables with stochastic attention to model the variations of comments. First, we endow both discourse-level and word-level latent variables with hierarchical and temporal dependencies for constructing multi-level hierarchy. Second, we introduce a stochastic attention to infer the key-words of interest in the input post. As a result, diverse comments can be generated with both discourse-level properties and local-word selections. Experiments on open-domain Weibo data show that our model generates more diverse and realistic comments."
55,Dataless Short Text Classification Based on Biterm Topic Model and Word Embeddings,Main,['Text Classification'],https://www.ijcai.org/proceedings/2020/549,"Dataless text classification has attracted increasing attentions recently. It only needs very few seed words of each category to classify documents, which is much cheaper than supervised text classification that requires massive labeling efforts. However, most of existing models pay attention to long texts, but get unsatisfactory performance on short texts, which have become increasingly popular on the Internet. In this paper, we at first propose a novel model named Seeded Biterm Topic Model (SeedBTM) extending BTM to solve the problem of dataless short text classification with seed words. It takes advantage of both word co-occurrence information in the topic model and category-word similarity from widely used word embeddings as the prior topic-in-set knowledge. Moreover, with the same approach, we also propose Seeded Twitter Biterm Topic Model (SeedTBTM), which extends Twitter-BTM and utilizes additional user information to achieve higher classification accuracy. Experimental results on five real short-text datasets show that our models outperform the state-of-the-art methods, and especially perform well when the categories are overlapping and interrelated."
56,Leveraging Document-Level Label Consistency for Named Entity Recognition,Main,"['Named Entities', 'Tagging, chunking, and parsing']",https://www.ijcai.org/proceedings/2020/550,"Document-level label consistency is an effective indicator that different occurrences of a particular token sequence are very likely to have the same entity types. Previous work focused on better context representations and used the CRF for label decoding. However, CRF-based methods are inadequate for modeling document-level label consistency. This work introduces a novel two-stage label refinement approach to handle document-level label consistency, where a key-value memory network is first used to record draft labels predicted by the base model, and then a multi-channel Transformer makes refinements on these draft predictions based on the explicit co-occurrence relationship derived from the memory network. In addition, in order to mitigate the side effects of incorrect draft labels, Bayesian neural networks are used to indicate the labels with a high probability of being wrong, which can greatly assist in preventing the incorrect refinement of correct draft labels. The experimental results on three named entity recognition benchmarks demonstrated that the proposed method significantly outperformed the state-of-the-art methods."
57,Towards Making the Most of Context in Neural Machine Translation,Main,['Machine Translation'],https://www.ijcai.org/proceedings/2020/551,"Document-level machine translation manages to outperform sentence level models by a small margin, but have failed to be widely adopted. We argue that previous research did not make a clear use of the global context, and propose a new document-level NMT framework that deliberately models the local context of each sentence with the awareness of the global context of the document in both source and target languages. We specifically design the model to be able to deal with documents containing any number of sentences, including single sentences. This unified approach allows our model to be trained elegantly on standard datasets without needing to train on sentence and document level data separately. Experimental results demonstrate that our model outperforms Transformer baselines and previous document-level NMT models with substantial margins of up to 2.1 BLEU on state-of-the-art baselines. We also provide analyses which show the benefit of context far beyond the neighboring two or three sentences, which previous studies have typically incorporated."
58,Hype-HAN: Hyperbolic Hierarchical Attention Network for Semantic Embedding,Main,"['Embeddings', 'Text Classification']",https://www.ijcai.org/proceedings/2020/552,"Hyperbolic space is a well-defined space with constant negative curvature. Recent research demonstrates its odds of capturing complex hierarchical structures with its exceptional high capacity and continuous tree-like properties. This paper bridges hyperbolic space's superiority to the power-law structure of documents by introducing a hyperbolic neural network architecture named Hyperbolic Hierarchical Attention Network (Hype-HAN). Hype-HAN defines three levels of embeddings (word/sentence/document) and two layers of hyperbolic attention mechanism (word-to-sentence/sentence-to-document) on Riemannian geometries of the Lorentz model, Klein model and Poincaré model. Situated on the evolving embedding spaces, we utilize both conventional GRUs (Gated Recurrent Units) and hyperbolic GRUs with Möbius operations. Hype-HAN is applied to large scale datasets. The empirical experiments show the effectiveness of our method."
