,title,track,categories,url,desc
0,Hierarchical Linear Disentanglement of Data-Driven Conceptual Spaces,Main,['Natural Language Processing'],https://www.ijcai.org/proceedings/2020/494,"Conceptual spaces are geometric meaning representations in which similar entities are represented by similar vectors. They are widely used in cognitive science, but there has been relatively little work on learning such representations from data. In particular, while standard representation learning methods can be used to induce vector space embeddings from text corpora, these differ from conceptual spaces in two crucial ways.  First, the dimensions of a conceptual space correspond to salient semantic features, known as quality dimensions, whereas the dimensions of learned vector space embeddings typically lack any clear interpretation. This has been partially addressed in previous work, which has shown that it is possible to identify directions in learned vector spaces which capture semantic features. Second, conceptual spaces are normally organised into a set of domains, each of which is associated with a separate vector space. In contrast, learned embeddings represent all entities in a single vector space. Our hypothesis in this paper is that such single-space representations are sub-optimal for learning quality dimensions, due to the fact that semantic features are often only relevant to a subset of the entities. We show that this issue can be mitigated by identifying features in a hierarchical fashion. Intuitively, the top-level features split the vector space into different domains, making it possible to subsequently identify domain-specific quality dimensions."
1,How Far are We from Effective Context Modeling? An Exploratory Study on Semantic Parsing in Context,Main,"['Natural Language Semantics', 'Coreference Resolution', 'Dialogue', 'Natural Language Processing']",https://www.ijcai.org/proceedings/2020/495,"Recently semantic parsing in context has received a considerable attention, which is challenging since there are complex contextual phenomena. Previous works verified their proposed methods in limited scenarios, which motivates us to conduct an exploratory study on context modeling methods under real-world semantic parsing in context. We present a grammar-based decoding semantic parser and adapt typical context modeling methods on top of it. We evaluate 13 context modeling methods on two large complex cross-domain datasets, and our best model achieves state-of-the-art performances on both datasets with significant improvements. Furthermore, we summarize the most frequent contextual phenomena, with a fine-grained analysis on representative models, which may shed light on potential research directions. Our code is available at https://github.com/microsoft/ContextualSP."
2,Lexical-Constraint-Aware Neural Machine Translation via Data Augmentation,Main,"['Machine Translation', 'Natural Language Processing']",https://www.ijcai.org/proceedings/2020/496,"Leveraging lexical constraint is extremely significant in domain-specific machine translation and interactive machine translation. Previous studies mainly focus on extending beam search algorithm or augmenting the training corpus by replacing source phrases with the corresponding target translation. These methods either suffer from the heavy computation cost during inference or depend on the quality of the bilingual dictionary pre-specified by user or constructed with statistical machine translation. In response to these problems, we present a conceptually simple and empirically effective data augmentation approach in lexical constrained neural machine translation. Specifically, we make constraint-aware training data by first randomly sampling the phrases of the reference as constraints, and then packing them together into the source sentence with a separation symbol. Extensive experiments on several language pairs demonstrate that our approach achieves superior translation results over the existing systems, improving translation of constrained sentences without hurting the unconstrained ones."
3,Attention-based Multi-level Feature Fusion for Named Entity Recognition,Main,"['Information Extraction', 'Tagging, chunking, and parsing', 'Named Entities', 'Natural Language Processing']",https://www.ijcai.org/proceedings/2020/497,"Named entity recognition (NER) is a fundamental task in the natural language processing (NLP) area. Recently, representation learning methods (e.g., character embedding and word embedding) have achieved promising recognition results. However, existing models only consider partial features derived from words or characters while failing to integrate semantic and syntactic information (e.g., capitalization, inter-word relations, keywords, lexical phrases, etc.) from multi-level perspectives. Intuitively, multi-level features can be helpful when recognizing named entities from complex sentences. In this study, we propose a novel framework called attention-based multi-level feature fusion (AMFF), which is used to capture the multi-level features from different perspectives to improve NER. Our model consists of four components to respectively capture the local character-level, global character-level, local word-level, and global word-level features, which are then fed into a BiLSTM-CRF network for the final sequence labeling. Extensive experimental results on four benchmark datasets show that our proposed model outperforms a set of state-of-the-art baselines."
4,Exemplar Guided Neural Dialogue Generation,Main,"['Dialogue', 'Natural Language Generation', 'Natural Language Processing']",https://www.ijcai.org/proceedings/2020/498,"Humans benefit from previous experiences when taking actions. Similarly, related examples from the training data also provide exemplary information for neural dialogue models when responding to a given input message. However, effectively fusing such exemplary information into dialogue generation is non-trivial: useful exemplars are required to be not only literally-similar, but also topic-related with the given context. Noisy exemplars impair the neural dialogue models understanding the conversation topics and even corrupt the response generation. To address the issues, we propose an exemplar guided neural dialogue generation model where exemplar responses are retrieved in terms of both the text similarity and the topic proximity through a two-stage exemplar retrieval model. In the first stage, a small subset of conversations is retrieved from a training set given a dialogue context.  These candidate exemplars are then finely ranked regarding the topical proximity to choose the best-matched exemplar response.  To further induce the neural dialogue generation model consulting the exemplar response and the conversation topics more faithfully, we introduce a multi-source sampling mechanism to provide the dialogue model with both local exemplary semantics and global topical guidance during decoding. Empirical evaluations on a large-scale conversation dataset show that the proposed approach significantly outperforms the state-of-the-art in terms of both the quantitative metrics and human evaluations."
5,Knowledge Enhanced Event Causality Identification with Mention Masking Generalizations,Main,"['Information Extraction', 'Knowledge Extraction', 'Discourse']",https://www.ijcai.org/proceedings/2020/499,"Identifying causal relations of events is a crucial language understanding task. Despite many efforts for this task, existing methods lack the ability to adopt background knowledge, and they typically generalize poorly to new, previously unseen data. In this paper, we present a new method for event causality identification, aiming to address limitations of previous methods. On the one hand, our model can leverage external knowledge for reasoning, which can greatly enrich the representation of events; On the other hand, our model can mine event-agnostic, context-specific patterns, via a mechanism called event mention masking generalization, which can greatly enhance the ability of our model to handle new, previously unseen cases. In experiments, we evaluate our model on three benchmark datasets and show our model outperforms previous methods by a significant margin. Moreover, we perform 1) cross-topic adaptation, 2) exploiting unseen predicates, and 3) cross-task adaptation to evaluate the generalization ability of our model. Experimental results show that our model demonstrates a definite advantage over previous methods."
6,Two-Phase Hypergraph Based Reasoning with Dynamic Relations for Multi-Hop KBQA,Main,['Question Answering'],https://www.ijcai.org/proceedings/2020/500,"Multi-hop knowledge base question answering (KBQA) aims at finding the answers to a factoid question by reasoning across multiple triples. Note that when human performs multi-hop reasoning, one tends to concentrate on specific relation at different hops and pinpoint a group of entities connected by the relation. Hypergraph convolutional networks (HGCN) can simulate this behavior by leveraging hyperedges to connect more than two nodes more than pairwise connection. However, HGCN is for undirected graphs and does not consider the direction of information transmission. We introduce the directed-HGCN (DHGCN) to adapt to the knowledge graph with directionality.  Inspired by human's hop-by-hop reasoning, we propose an interpretable KBQA model based on DHGCN, namely two-phase hypergraph based reasoning with dynamic relations, which explicitly updates relation information and dynamically pays attention to different relations at different hops. Moreover, the model predicts relations hop-by-hop to generate an intermediate relation path. We conduct extensive experiments on two widely used multi-hop KBQA datasets to prove the effectiveness of our model."
7,LogiQA: A Challenge Dataset for Machine Reading Comprehension with Logical Reasoning,Main,"['Resources and Evaluation', 'Question Answering']",https://www.ijcai.org/proceedings/2020/501,"Machine reading is a fundamental task for testing the capability of natural language understand- ing, which is closely related to human cognition in many aspects. With the rising of deep learning techniques, algorithmic models rival human performances on simple QA, and thus increasingly challenging machine reading datasets have been proposed. Though various challenges such as evidence integration and commonsense knowledge have been integrated, one of the fundamental capabilities in human reading, namely logical reasoning, is not fully investigated. We build a comprehensive dataset, named LogiQA, which is sourced from expert-written questions for testing human Logical reasoning. It consists of 8,678 QA instances, covering multiple types of deductive reasoning. Results show that state-of-the-art neural models perform by far worse than human ceiling. Our dataset can also serve as a benchmark for reinvestigating logical AI under the deep learning NLP setting. The dataset is freely available at https://github.com/lgw863/LogiQA-dataset."
8,Guided Generation of Cause and Effect,Main,"['Natural Language Generation', 'Knowledge Extraction', 'Natural Language Processing']",https://www.ijcai.org/proceedings/2020/502,"We present a conditional text generation framework that posits sentential expressions of possible causes and effects. This framework depends on two novel resources we develop in the course of this work: a very large-scale collection of English sentences expressing causal patterns (CausalBank); and a refinement over previous work on constructing large lexical causal knowledge graphs (Cause Effect Graph). Further, we extend prior work in lexically-constrained decoding to support disjunctive positive constraints. Human assessment conﬁrms that our approach gives high-quality and diverse outputs. Finally, we use CausalBank to perform continued training of an encoder supporting a recent state-of-the-art model for causal reasoning, leading to a 3-point improvement on the COPA challenge set, with no change in model architecture."
9,EmoElicitor: An Open Domain Response Generation Model with User Emotional Reaction Awareness,Main,"['Dialogue', 'Natural Language Generation']",https://www.ijcai.org/proceedings/2020/503,"Generating emotional responses is crucial for building human-like dialogue systems. However, existing studies  have focused only on generating responses by controlling the agents' emotions, while the feelings of the users, which are the ultimate concern of a dialogue system, have been neglected. In this paper, we propose a novel variational model named EmoElicitor to generate appropriate responses that can elicit user's specific emotion. We incorporate the next-round utterance after the response into the posterior network to enrich the context, and we decompose single latent variable into several sequential ones to guide response generation with the help of a pre-trained language model. Extensive experiments conducted on real-world dataset show that EmoElicitor not only performs better than the baselines in term of diversity and semantic similarity, but also can elicit emotion with higher accuracy."
10,RECPARSER: A Recursive Semantic Parsing Framework for Text-to-SQL Task,Main,"['Natural Language Generation', 'Natural Language Processing', 'Natural Language Semantics']",https://www.ijcai.org/proceedings/2020/504,"Neural semantic parsers usually fail to parse long and complicated utterances into nested SQL queries, due to the large search space. In this paper, we propose a novel recursive semantic parsing framework called RECPARSER to generate the nested SQL query layer-by-layer. It decomposes the complicated nested SQL query generation problem into several progressive non-nested SQL query generation problems.  Furthermore, we propose a novel Question Decomposer module to explicitly encourage RECPARSER to focus on different components of an utterance when predicting SQL queries of different layers. Experiments on the Spider dataset show that our approach is more effective compared to the previous works at predicting the nested SQL queries. In addition, we achieve an overall accuracy that is comparable with state-of-the-art approaches."
11,Learning Latent Forests for Medical Relation Extraction,Main,"['Information Extraction', 'Natural Language Processing']",https://www.ijcai.org/proceedings/2020/505,"The goal of medical relation extraction is to detect relations among entities, such as genes, mutations and drugs in medical texts. Dependency tree structures have been proven useful for this task. Existing approaches to such relation extraction leverage off-the-shelf dependency parsers to obtain a syntactic tree or forest for the text. However, for the medical domain, low parsing accuracy may lead to error propagation downstream the relation extraction pipeline. In this work, we propose a novel model which treats the dependency structure as a latent variable and induces it from the unstructured text in an end-to-end fashion. Our model can be understood as composing task-specific dependency forests that capture non-local interactions for better relation extraction. Extensive results on four datasets show that our model is able to significantly outperform state-of-the-art systems without relying on any direct tree supervision or pre-training."
12,Global Structure and Local Semantics-Preserved Embeddings for Entity Alignment,Main,"['Embeddings', 'Named Entities', 'Natural Language Processing']",https://www.ijcai.org/proceedings/2020/506,"Entity alignment (EA) aims to identify entities located in different knowledge graphs (KGs) that refer to the same real-world object. To learn the entity representations, most EA approaches rely on either translation-based methods which capture the local relation semantics of entities or graph convolutional networks (GCNs), which exploit the global KG structure. Afterward, the aligned entities are identified based on their distances. In this paper, we propose to jointly leverage the global KG structure and entity-specific relational triples for better entity alignment. Specifically, a global structure and local semantics preserving network is proposed to learn entity representations in a coarse-to-fine manner. Experiments on several real-world datasets show that our method significantly outperforms other entity alignment approaches and achieves the new state-of-the-art performance."
13,Hierarchical Matching Network for Heterogeneous Entity Resolution,Main,"['Coreference Resolution', 'Information Extraction']",https://www.ijcai.org/proceedings/2020/507,"Entity resolution (ER) aims to identify data records referring to the same real-world entity. Most existing ER approaches rely on the assumption that the entity records to be resolved are homogeneous, i.e., their attributes are aligned. Unfortunately, entities in real-world datasets are often heterogeneous, usually coming from different sources and being represented using different attributes. Furthermore, the entities’ attribute values may be redundant, noisy, missing, misplaced, or misspelled—we refer to it as the dirty data problem. To resolve the above problems, this paper proposes an end-to-end hierarchical matching network (HierMatcher) for entity resolution, which can jointly match entities in three levels—token, attribute, and entity. At the token level, a cross-attribute token alignment and comparison layer is designed to adaptively compare heterogeneous entities. At the attribute level, an attribute-aware attention mechanism is proposed to denoise dirty attribute values. Finally, the entity level matching layer effectively aggregates all matching evidence for the final ER decisions. Experimental results show that our method significantly outperforms previous ER methods on homogeneous, heterogeneous and dirty datasets."
14,Unsupervised Domain Adaptation of a Pretrained Cross-Lingual Language Model,Main,['Sentiment Analysis and Text Mining'],https://www.ijcai.org/proceedings/2020/508,"Recent research indicates that pretraining cross-lingual language models on large-scale unlabeled texts yields significant performance improvements over various cross-lingual and low-resource tasks. Through training on one hundred languages and terabytes of texts, cross-lingual language models have proven to be effective in leveraging high-resource languages to enhance low-resource language processing and outperform monolingual models. In this paper, we further investigate the cross-lingual and cross-domain (CLCD) setting when a pretrained cross-lingual language model needs to adapt to new domains. Specifically, we propose a novel unsupervised feature decomposition method that can automatically extract domain-specific features and domain-invariant features from the entangled pretrained cross-lingual representations, given unlabeled raw texts in the source language. Our proposed model leverages mutual information estimation to decompose the representations computed by a cross-lingual model into domain-invariant and domain-specific parts. Experimental results show that our proposed method achieves significant performance improvements over the state-of-the-art pretrained cross-lingual language model in the CLCD setting."
15,"Retrieve, Program, Repeat: Complex Knowledge Base Question Answering via Alternate Meta-learning",Main,"['Natural Language Processing', 'Question Answering']",https://www.ijcai.org/proceedings/2020/509,"A compelling approach to complex question answering is to convert the question to a sequence of actions, which can then be executed on the knowledge base to yield the answer, aka the programmer-interpreter approach. Use similar training questions to the test question, meta-learning enables the programmer to adapt to unseen questions to tackle potential distributional biases quickly. However, this comes at the cost of manually labeling similar questions to learn a retrieval model, which is tedious and expensive. In this paper, we present a novel method that automatically learns a retrieval model alternately with the programmer from weak supervision, i.e., the system’s performance with respect to the produced answers. To the best of our knowledge, this is the first attempt to train the retrieval model with the programmer jointly. Our system leads to state-of-the-art performance on a large-scale task for complex question answering over knowledge bases. We have released our code at https://github.com/DevinJake/MARL."
16,Generating Reasonable Legal Text through the Combination of Language Modeling and Question Answering,Main,"['Natural Language Generation', 'Question Answering', 'NLP Applications and Tools']",https://www.ijcai.org/proceedings/2020/510,"Due to the improvement of Language Modeling, the emerging NLP assistant tools aiming for text generation greatly reduce the human workload on writing documents. However, the generation of legal text faces greater challenges than ordinary texts because of its high requirement for keeping logic reasonable, which can not be guaranteed by  Language Modeling right now. To generate reasonable legal documents, we propose a novel method CoLMQA, which (1) combines Language Modeling and Question Answering, (2) generates text with slots by Language Modeling, and (3) fills the slots by our proposed Question Answering method named Transformer-based Key-Value Memory Networks. In CoLMQA, the slots represent the text part that needs to be highly constrained by logic, such as the name of the law and the number of the law article. And the Question Answering fills the slots in context with the help of Legal Knowledge Base to keep logic reasonable. The experiment verifies the quality of legal documents generated by CoLMQA, surpassing the documents generated by pure Language Modeling."
17,Modeling Voting for System Combination in Machine Translation,Main,"['Machine Translation', 'Natural Language Processing']",https://www.ijcai.org/proceedings/2020/511,"System combination is an important technique for combining the hypotheses of different machine translation systems to improve translation performance. Although early statistical approaches to system combination have been proven effective in analyzing the consensus between hypotheses, they suffer from the error propagation problem due to the use of pipelines. While this problem has been alleviated by end-to-end training of multi-source sequence-to-sequence models recently, these neural models do not explicitly analyze the relations between hypotheses and fail to capture their agreement because the attention to a word in a hypothesis is calculated independently, ignoring the fact that the word might occur in multiple hypotheses. In this work, we propose an approach to modeling voting for system combination in machine translation. The basic idea is to enable words in hypotheses from different systems to vote on words that are representative and should get involved in the generation process. This can be done by quantifying the influence of each voter and its preference for each candidate. Our approach combines the advantages of statistical and neural methods since it can not only analyze the relations between hypotheses but also allow for end-to-end training. Experiments show that our approach is capable of better taking advantage of the consensus between hypotheses and achieves significant improvements over state-of-the-art baselines on Chinese-English and English-German machine translation tasks."
18,Unsupervised Multilingual Alignment using Wasserstein Barycenter,Main,['Machine Translation'],https://www.ijcai.org/proceedings/2020/512,"We study unsupervised multilingual alignment, the problem of finding word-to-word translations between multiple languages without using any parallel data. One popular strategy is to reduce multilingual alignment to the much simplified bilingual setting, by picking one of the input languages as the pivot language that we transit through. However, it is well-known that transiting through a poorly chosen pivot language (such as English) may severely degrade the translation quality, since the assumed transitive relations among all pairs of languages may not be enforced in the training process. Instead of going through a rather arbitrarily chosen pivot language, we propose to use the Wasserstein barycenter as a more informative ``mean'' language: it encapsulates information from all languages and minimizes all pairwise transportation costs. We evaluate our method on standard benchmarks and demonstrate state-of-the-art performances."
19,A De Novo Divide-and-Merge Paradigm for Acoustic Model Optimization in Automatic Speech Recognition,Main,['Speech'],https://www.ijcai.org/proceedings/2020/513,"Due to the rising awareness of privacy protection and the voluminous scale of speech data, it is becoming infeasible for Automatic Speech Recognition (ASR) system developers to train the acoustic model with complete data as before. In this paper, we propose a novel Divide-and-Merge paradigm to solve salient problems plaguing the ASR field. In the Divide phase, multiple acoustic models are trained based upon different subsets of the complete speech data, while in the Merge phase two novel algorithms are utilized to generate a high-quality acoustic model based upon those trained on data subsets. We first propose the Genetic Merge Algorithm (GMA), which is a highly specialized algorithm for optimizing acoustic models but suffers from low efficiency. We further propose the SGD-Based Optimizational Merge Algorithm (SOMA), which effectively alleviates the efficiency bottleneck of GMA and maintains superior performance. Extensive experiments on public data show that the proposed methods can significantly outperform the state-of-the-art."
