,title,track,categories,url,desc
0,Learn to Reverse DNNs from AI Programs Automatically,Main,['Embeddings'],https://www.ijcai.org/proceedings/2022/94,"With the privatization deployment of DNNs on edge devices, the security of on-device DNNs has raised significant concern. To quantify the model leakage risk of on-device DNNs automatically, we propose NNReverse, the first learning-based method which can reverse DNNs from AI programs without domain knowledge. NNReverse trains a representation model to represent the semantics of binary code for DNN layers. By searching the most similar function in our database, NNReverse infers the layer type of a given function’s binary code. To represent assembly instructions semantics precisely, NNReverse proposes a more fine-grained embedding model to represent the textual and structural-semantic of assembly functions."
1,PPT: Backdoor Attacks on Pre-trained Models via Poisoned Prompt Tuning,Main,"['Language Models', 'Other']",https://www.ijcai.org/proceedings/2022/96,"Recently, prompt tuning has shown remarkable performance as a new learning paradigm, which freezes pre-trained language models (PLMs) and only tunes some soft prompts. A fixed PLM only needs to be loaded with different prompts to adapt different downstream tasks. However, the prompts associated with PLMs may be added with some malicious behaviors, such as backdoors. The victim model will be implanted with a backdoor by using the poisoned prompt. In this paper, we propose to obtain the poisoned prompt for PLMs and corresponding downstream tasks by prompt tuning. We name this Poisoned Prompt Tuning method ""PPT"". The poisoned prompt can lead a shortcut between the specific trigger word and the target label word to be created for the PLM. So the attacker can simply manipulate the prediction of the entire model by just a small prompt. Our experiments on various text classification tasks show that PPT can achieve a 99% attack success rate with almost no accuracy sacrificed on original task. We hope this work can raise the awareness of the possible security threats hidden in the prompt."
2,AttExplainer: Explain Transformer via Attention by Reinforcement Learning,Main,"['Interpretability and Analysis of Models for NLP', 'Text Classification']",https://www.ijcai.org/proceedings/2022/102,"Transformer and its variants, built based on attention mechanisms, have recently achieved remarkable performance in many NLP tasks. Most existing works on Transformer explanation tend to reveal and utilize the attention matrix with human subjective intuitions in a qualitative manner. However, the huge size of dimensions directly challenges these methods to quantitatively analyze the attention matrix. Therefore, in this paper, we propose a novel reinforcement learning (RL) based framework for Transformer explanation via attention matrix, namely AttExplainer. The RL agent learns to perform step-by-step masking operations by observing the change in attention matrices. We have adapted our method to two scenarios, perturbation-based model explanation and text adversarial attack. Experiments on three widely used text classification benchmarks validate the effectiveness of the proposed method compared to state-of-the-art baselines. Additional studies show that our method is highly transferable and consistent with human intuition. The code of this paper is available at https://github.com/niuzaisheng/AttExplainer ."
3,What is Right for Me is Not Yet Right for You: A Dataset for Grounding Relative Directions via Multi-Task Learning,Main,"['Language Grounding', 'Question Answering']",https://www.ijcai.org/proceedings/2022/145,"Understanding spatial relations is essential for intelligent agents to act and communicate in the physical world. Relative directions are spatial relations that describe the relative positions of target objects with regard to the intrinsic orientation of reference objects. Grounding relative directions is more difficult than grounding absolute directions because it not only requires a model to detect objects in the image and to identify spatial relation based on this information, but it also needs to recognize the orientation of objects and integrate this information into the reasoning process. We investigate the challenging problem of grounding relative directions with end-to-end neural networks. To this end, we provide GRiD-3D, a novel dataset that features relative directions and complements existing visual question answering (VQA) datasets, such as CLEVR, that involve only absolute directions. We also provide baselines for the dataset with two established end-to-end VQA models. Experimental evaluations show that answering questions on relative directions is feasible when questions in the dataset simulate the necessary subtasks for grounding relative directions. We discover that those subtasks are learned in an order that reflects the steps of an intuitive pipeline for processing relative directions."
4,ER-SAN: Enhanced-Adaptive Relation Self-Attention Network for Image Captioning,Main,['Language Generation'],https://www.ijcai.org/proceedings/2022/151,"Image captioning (IC), bringing vision to language, has drawn extensive attention. Precisely describing visual relations between image objects is a key challenge in IC. We argue that the visual relations, that is geometric positions (i.e., distance and size) and semantic interactions (i.e., actions and possessives), indicate the mutual correlations between objects. Existing Transformer-based methods typically resort to geometric positions to enhance the representation of visual relations, yet only using the shallow geometric is unable to precisely cover the complex and actional correlations. In this paper, we propose to enhance the correlations between objects from a comprehensive view that jointly considers explicit semantic and geometric relations, generating plausible captions with accurate relationship predictions. Specifically, we propose a novel Enhanced-Adaptive Relation Self-Attention Network (ER-SAN). We design the direction-sensitive semantic-enhanced attention, which considers content objects to semantic relations and semantic relations to content objects attention to learn explicit semantic-aware relations. Further, we devise an adaptive re-weight relation module that determines how much semantic and geometric attention should be activated to each relation feature. Extensive experiments on MS-COCO dataset demonstrate the effectiveness of our ER-SAN,  with improvements of CIDEr from 128.6% to 135.3%, achieving state-of-the-art performance. Codes will be released \url{https://github.com/CrossmodalGroup/ER-SAN}."
5,Multilevel Hierarchical Network with Multiscale Sampling for Video Question Answering,Main,['Question Answering'],https://www.ijcai.org/proceedings/2022/178,"Video question answering (VideoQA) is challenging given its multimodal combination of visual understanding and natural language processing. While most existing approaches ignore the visual appearance-motion information at different temporal scales, it is unknown how to incorporate the multilevel processing capacity of a deep learning model with such multiscale information. Targeting these issues, this paper proposes a novel Multilevel Hierarchical Network (MHN) with multiscale sampling for VideoQA. MHN comprises two modules, namely Recurrent Multimodal Interaction (RMI) and Parallel Visual Reasoning (PVR). With a multiscale sampling, RMI iterates the interaction of appearance-motion information at each scale and the question embeddings to build the multilevel question-guided visual representations. Thereon, with a shared transformer encoder, PVR infers the visual cues at each level in parallel to fit with answering different question types that may rely on the visual information at relevant levels. Through extensive experiments on three VideoQA datasets, we demonstrate improved performances than previous state-of-the-arts and justify the effectiveness of each part of our method."
6,Visual Emotion Representation Learning via Emotion-Aware Pre-training,Main,['Sentiment Analysis and Text Mining'],https://www.ijcai.org/proceedings/2022/234,"Despite recent progress in deep learning, visual emotion recognition remains a challenging problem due to ambiguity of emotion perception, diverse concepts related to visual emotion and lack of large-scale annotated dataset. In this paper, we present a large-scale multimodal pre-training method to learn visual emotion representation by aligning emotion, object, attribute triplet with a contrastive loss. We conduct our pre-training on a large web dataset with noisy tags and fine-tune on visual emotion classification datasets. Our method achieves state-of-the-art performance for visual emotion classification."
7,Towards Robust Dense Retrieval via Local Ranking Alignment,Main,['Information Retrieval and Text Mining'],https://www.ijcai.org/proceedings/2022/275,"Dense retrieval (DR) has extended the employment of pre-trained language models, like BERT, for text ranking. However, recent studies have raised the robustness issue of DR model against query variations, like query with typos, along with non-trivial performance losses. Herein, we argue that it would be beneficial to allow the DR model to learn to align the relative positions of query-passage pairs in the representation space, as query variations cause the query vector to drift away from its original position, affecting the subsequent DR effectiveness. To this end, we propose RoDR, a novel robust DR model that learns to calibrate the in-batch local ranking of query variation to that of original query for the DR space alignment. Extensive experiments on MS MARCO and ANTIQUE datasets show that RoDR significantly improves the retrieval results on both the original queries and different types of query variations. Meanwhile, RoDR provides a general query noise-tolerate learning framework that boosts the robustness and effectiveness of various existing DR models. Our code and models are openly available at https://github.com/cxa-unique/RoDR."
8,MEIM: Multi-partition Embedding Interaction Beyond Block Term Format for Efficient and Expressive Link Prediction,Main,['Embeddings'],https://www.ijcai.org/proceedings/2022/314,"Knowledge graph embedding aims to predict the missing relations between entities in knowledge graphs. Tensor-decomposition-based models, such as ComplEx, provide a good trade-off between efficiency and expressiveness, that is crucial because of the large size of real world knowledge graphs. The recent multi-partition embedding interaction (MEI) model subsumes these models by using the block term tensor format and provides a systematic solution for the trade-off. However, MEI has several drawbacks, some of which carried from its subsumed tensor-decomposition-based models. In this paper, we address these drawbacks and introduce the Multi-partition Embedding Interaction iMproved beyond block term format (MEIM) model, with independent core tensor for ensemble effects and soft orthogonality for max-rank mapping, in addition to multi-partition embedding. MEIM improves expressiveness while still being highly efficient, helping it to outperform strong baselines and achieve state-of-the-art results on difficult link prediction benchmarks using fairly small embedding sizes. The source code is released at https://github.com/tranhungnghiep/MEIM."
9,Augmenting Knowledge Graphs for Better Link Prediction,Main,['Embeddings'],https://www.ijcai.org/proceedings/2022/316,"Embedding methods have demonstrated robust performance on the task of link prediction in knowledge graphs, by mostly encoding entity relationships. Recent methods propose to enhance the loss function with a literal-aware term. In this paper, we propose KGA: a knowledge graph augmentation method that incorporates literals in an embedding model without modifying its loss function. KGA discretizes quantity and year values into bins, and chains these bins both horizontally, modeling neighboring values, and vertically, modeling multiple levels of granularity. KGA is scalable and can be used as a pre-processing step for any existing knowledge graph embedding model. Experiments on legacy benchmarks and a new large benchmark, DWD, show that augmenting the knowledge graph with quantities and years is beneficial for predicting both entities and numbers, as KGA outperforms the vanilla models and other relevant baselines. Our ablation studies confirm that both quantities and years contribute to KGA's performance, and that its performance depends on the discretization and binning settings. We make the code, models, and the DWD benchmark publicly available to facilitate reproducibility and future research."
10,Language Models as Knowledge Embeddings,Main,"['Language Models', 'Embeddings']",https://www.ijcai.org/proceedings/2022/318,"Knowledge embeddings (KE) represent a knowledge graph (KG) by embedding entities and relations into continuous vector spaces. Existing methods are mainly structure-based or description-based. Structure-based methods learn representations that preserve the inherent structure of KGs. They cannot well represent abundant long-tail entities in real-world KGs with limited structural information. Description-based methods leverage textual information and language models. Prior approaches in this direction barely outperform structure-based ones, and suffer from problems like expensive negative sampling and restrictive description demand. In this paper, we propose LMKE, which adopts Language Models to derive Knowledge Embeddings, aiming at both enriching representations of long-tail entities and solving problems of prior description-based methods. We formulate description-based KE learning with a contrastive learning framework to improve efficiency in  training and evaluation. Experimental results show that LMKE achieves state-of-the-art performance on KE benchmarks of link prediction and triple classification, especially for long-tail entities."
11,CTL-MTNet: A Novel CapsNet and Transfer Learning-Based Mixed Task Net for Single-Corpus and Cross-Corpus Speech Emotion Recognition,Main,['Speech'],https://www.ijcai.org/proceedings/2022/320,"Speech Emotion Recognition (SER) has become a growing focus of research in human-computer interaction. An essential challenge in SER is to extract common attributes from different speakers or languages, especially when a specific source corpus has to be trained to recognize the unknown data coming from another speech corpus. To address this challenge, a Capsule Network (CapsNet) and Transfer Learning based Mixed Task Net (CTL-MTNet) are proposed to deal with both the single-corpus and cross-corpus SER tasks simultaneously in this paper. For the single-corpus task, the combination of Convolution-Pooling and Attention CapsNet module (CPAC) is designed by embedding the self-attention mechanism to the CapsNet, guiding the module to focus on the important features that can be fed into different capsules. The extracted high-level features by CPAC provide sufficient discriminative ability. Furthermore, to handle the cross-corpus task, CTL-MTNet employs a Corpus Adaptation Adversarial Module (CAAM) by combining CPAC with Margin Disparity Discrepancy (MDD), which can learn the domain-invariant emotion representations through extracting the strong emotion commonness. Experiments including ablation studies and visualizations on both single- and cross-corpus tasks using four well-known SER datasets in different languages are conducted for performance evaluation and comparison. The results indicate that in both tasks the CTL-MTNet showed better performance in all cases compared to a number of state-of-the-art methods. The source code and the supplementary materials are available at: https://github.com/MLDMXM2017/CTLMTNet."
12,CERT: Continual Pre-training on Sketches for Library-oriented Code Generation,Main,"['Language Models', 'Resources and Evaluation']",https://www.ijcai.org/proceedings/2022/329,"Code generation is a longstanding challenge, aiming to generate a code snippet based on a natural language description. Usually, expensive text-code paired data is essential for training a code generation model. Recently, thanks to the success of pre-training techniques, large language models are trained on large unlabelled code corpora and perform well in generating code. In this paper, we investigate how to leverage an unlabelled code corpus to train a model for library-oriented code generation. Since it is a common practice for programmers to reuse third-party libraries, in which case the text-code paired data are harder to obtain due to the huge number of libraries. We observe that library-oriented code snippets are more likely to share similar code sketches. Hence, we present CERT with two steps: a sketcher generates the sketch, then a generator fills the details in the sketch. Both the sketcher and generator are continually pre-trained upon a base model using unlabelled data. Also, we carefully craft two benchmarks to evaluate library-oriented code generation named PandasEval and NumpyEval. Experimental results have shown the impressive performance of CERT. For example, it surpasses the base model by an absolute 15.67% improvement in terms of pass@1 on PandasEval. Our work is available at https://github.com/microsoft/PyCodeGPT."
13,MFAN: Multi-modal Feature-enhanced Attention Networks for Rumor Detection,Main,"['Text Classification', 'Information Retrieval and Text Mining']",https://www.ijcai.org/proceedings/2022/335,"Rumor spreaders are increasingly taking advantage of multimedia content to attract and mislead news consumers on social media. Although recent multimedia rumor detection models have exploited both textual and visual features for classification, they do not integrate the social structure features simultaneously, which have shown promising performance for rumor identification. It is challenging to combine the heterogeneous multi-modal data in consideration of their complex relationships. In this work, we propose a novel Multi-modal Feature-enhanced Attention Networks (MFAN) for rumor detection, which makes the first attempt to integrate textual, visual, and social graph features in one unified framework. Specifically, it considers both the complement and alignment relationships between different modalities to achieve better fusion. Moreover, it takes into account the incomplete links in the social network data due to data collection constraints and proposes to infer hidden links to learn better social graph features. The experimental results show that MFAN can detect rumors effectively and outperform state-of-the-art methods."
14,Human Parity on CommonsenseQA: Augmenting Self-Attention with External Attention,Main,['Question Answering'],https://www.ijcai.org/proceedings/2022/383,"Most of today's AI systems focus on using self-attention mechanisms and transformer architectures on large amounts of diverse data to achieve impressive performance gains. In this paper, we propose to augment the transformer architecture with an external attention mechanism to bring external knowledge and context to bear.  By integrating external information into the prediction process, we hope to reduce the need for ever-larger models and increase the democratization of AI systems.  We find that the proposed external attention mechanism can significantly improve the performance of existing AI systems, allowing practitioners to easily customize foundation AI models to many diverse downstream applications.   In particular, we focus on the task of Commonsense Reasoning, demonstrating that the proposed external attention mechanism can augment existing transformer models and significantly improve the model's reasoning capabilities. The proposed system, Knowledgeable External Attention for commonsense Reasoning (KEAR), reaches human parity on the open CommonsenseQA research benchmark with an accuracy of 89.4% in comparison to the human accuracy of 88.9%."
15,Function-words Adaptively Enhanced Attention Networks for Few-Shot Inverse Relation Classification,Main,['Text Classification'],https://www.ijcai.org/proceedings/2022/407,"The relation classification is to identify semantic relations between two entities in a given text. While existing models perform well for classifying inverse relations with large datasets, their performance is significantly reduced for few-shot learning. In this paper, we propose a function words adaptively enhanced attention framework (FAEA) for few-shot inverse relation classification, in which a hybrid attention model is designed to attend class-related function words based on meta-learning. As the involvement of function words brings in significant intra-class redundancy, an adaptive message passing mechanism is introduced to capture and transfer inter-class differences.We mathematically analyze the negative impact of function words from dot-product measurement, which explains why the message passing mechanism effectively reduces the impact. Our experimental results show that FAEA outperforms strong baselines, especially the inverse relation accuracy is improved by 14.33% under 1-shot setting in FewRel1.0."
16,Set Interdependence Transformer: Set-to-Sequence Neural Networks for Permutation Learning and Structure Prediction,Main,['Other'],https://www.ijcai.org/proceedings/2022/434,"The task of learning to map an input set onto a permuted sequence of its elements is challenging for neural networks. Set-to-sequence problems occur in natural language processing, computer vision and structure prediction, where interactions between elements of large sets define the optimal output. Models must exhibit relational reasoning, handle varying cardinalities and manage combinatorial complexity. Previous attention-based methods require n layers of their set transformations to explicitly represent n-th order relations. Our aim is to enhance their ability to efficiently model higher-order interactions through an additional interdependence component. We propose a novel neural set encoding method called the Set Interdependence Transformer, capable of relating the set's permutation invariant representation to its elements within sets of any cardinality. We combine it with a permutation learning module into a complete, 3-part set-to-sequence model and demonstrate its state-of-the-art performance on a number of tasks. These range from combinatorial optimization problems, through permutation learning challenges on both synthetic and established NLP datasets for sentence ordering, to a novel domain of product catalog structure prediction. Additionally, the network's ability to generalize to unseen sequence lengths is investigated and a comparative empirical analysis of the existing methods' ability to learn higher-order interactions is provided."
17,Data Augmentation for Learning to Play in Text-Based Games,Main,['Other'],https://www.ijcai.org/proceedings/2022/436,"Improving generalization in text-based games serves as a useful stepping-stone towards reinforcement learning (RL) agents with generic linguistic ability. Data augmentation for generalization in RL has shown to be very successful in classic control and visual tasks, but there is no prior work for text-based games. We propose Transition-Matching Permutation, a novel data augmentation technique for text-based games, where we identify phrase permutations that match as many transitions in the trajectory data. We show that applying this technique results in state-of-the-art performance in the Cooking Game benchmark suite for text-based games."
18,Declaration-based Prompt Tuning for Visual Question Answering,Main,['Question Answering'],https://www.ijcai.org/proceedings/2022/453,"In recent years, the pre-training-then-fine-tuning paradigm has yielded immense success on a wide spectrum of cross-modal tasks, such as visual question answering (VQA), in which a visual-language (VL) model is first optimized via self-supervised task objectives, e.g., masked language modeling (MLM) and image-text matching (ITM), and then fine-tuned to adapt to downstream task (e.g., VQA) via a brand-new objective function, e.g., answer prediction. However, the inconsistency of the objective forms not only severely limits the generalization of pre-trained VL models to downstream tasks, but also requires a large amount of labeled data for fine-tuning. To alleviate the problem, we propose an innovative VL fine-tuning paradigm (named Declaration-based Prompt Tuning, abbreviated as DPT), which fine-tunes the model for downstream VQA using the pre-training objectives, boosting the effective adaptation of pre-trained models to the downstream task. Specifically, DPT reformulates the VQA task via (1) textual adaptation, which converts the given questions into declarative sentence form for prompt-tuning, and (2) task adaptation, which optimizes the objective function of VQA problem in the manner of pre-training phase. Experimental results on GQA dataset show that DPT outperforms the fine-tuned counterpart by a large margin regarding accuracy in both fully-supervised (2.68%) and zero-shot/fewshot (over 31%) settings. All the data and codes will be available to facilitate future research."
