,title,track,categories,url,desc
74,Neural Subgraph Explorer: Reducing Noisy Information via Target-oriented Syntax Graph Pruning,Main,"['Text Classification', 'Sentiment Analysis and Text Mining']",https://www.ijcai.org/proceedings/2022/614,"Recent years have witnessed the emerging success of leveraging syntax graphs for the target sentiment classification task. However, we discover that existing syntax-based models suffer from two issues: noisy information aggregation and loss of distant correlations. In this paper, we propose a novel model termed Neural Subgraph Explorer, which  (1) reduces the noisy information via pruning target-irrelevant nodes on the syntax graph; (2) introduces beneficial first-order connections between the target and its related words into the obtained graph. Specifically, we design a multi-hop actions score estimator to evaluate the value of each word regarding the specific target. The discrete action sequence is sampled through Gumble-Softmax and then used for both of the syntax graph and the self-attention graph. To introduce the first-order connections between the target and its relevant words, the two pruned graphs are merged. Finally, graph convolution is conducted on the obtained unified graph to update the hidden states. And this process is stacked with multiple layers. To our knowledge, this is the first attempt of target-oriented syntax graph pruning in this task. Experimental results demonstrate the superiority of our model, which achieves new state-of-the-art performance."
75,TaxoPrompt: A Prompt-based Generation Method with Taxonomic Context for Self-Supervised Taxonomy Expansion,Main,"['Natural Language Semantics', 'Knowledge Extraction']",https://www.ijcai.org/proceedings/2022/615,"Taxonomies are hierarchical classifications widely exploited to facilitate downstream natural language processing tasks. The taxonomy expansion task aims to incorporate emergent concepts into the existing taxonomies. Prior works focus on modeling the local substructure of taxonomies but neglect the global structure. In this paper, we propose TaxoPrompt, a framework that learns the global structure by prompt tuning with taxonomic context. Prompt tuning leverages a template to formulate downstream tasks into masked language model form for better distributed semantic knowledge use. To further infuse global structure knowledge into language models, we enhance the prompt template by exploiting the taxonomic context constructed by a variant of the random walk algorithm. Experiments on seven public benchmarks show that our proposed TaxoPrompt is effective and efficient in automatically expanding taxonomies and achieves state-of-the-art performance."
76,Robust Interpretable Text Classification against Spurious Correlations Using AND-rules with Negation,Main,"['Text Classification', 'Applications', 'Interpretability and Analysis of Models for NLP']",https://www.ijcai.org/proceedings/2022/616,"The state-of-the-art natural language processing models have raised the bar for excellent performance on a variety of tasks in recent years. However, concerns are rising over their primitive sensitivity to distribution biases that reside in the training and testing data. This issue hugely impacts the performance of the models when exposed to out-of-distribution and counterfactual data. The root cause seems to be that many machine learning models are prone to learn the shortcuts, modelling simple correlations rather than more fundamental and general relationships. As a result, such text classifiers tend to perform poorly when a human makes minor modifications to the data, which raises questions regarding their robustness. In this paper, we employ a rule-based architecture called Tsetlin Machine (TM) that learns both simple and complex correlations by ANDing features and their negations. As such, it generates explainable AND-rules using negated and non-negated reasoning. Here, we explore how non-negated reasoning can be more prone to distribution biases than negated reasoning. We further leverage this finding by adapting the TM architecture to mainly perform negated reasoning using the specificity parameter s. As a result, the AND-rules becomes robust to spurious correlations and can also correctly predict counterfactual data. Our empirical investigation of the model's robustness uses the specificity s to control the degree of negated reasoning. Experiments on publicly available Counterfactually-Augmented Data demonstrate that the negated clauses are robust to spurious correlations and outperform Naive Bayes, SVM, and Bi-LSTM by up to 20 %, and  ELMo by almost 6 % on counterfactual test data."
77,Diversity Features Enhanced Prototypical Network for Few-shot Intent Detection,Main,"['Dialogue and Interactive Systems', 'Applications', 'Text Classification']",https://www.ijcai.org/proceedings/2022/617,"Few-shot Intent Detection (FSID) is a challenging task in dialogue systems due to the scarcity of available annotated utterances. Although existing few-shot learning approaches have made remarkable progress, they fall short in adapting to the Generalized Few-shot Intent Detection (GFSID) task where both seen and unseen classes are present. A core problem of the simultaneous existence of these two tasks is that limited training samples fail to cover the diversity of user expressions. In this paper, we propose an effective Diversity Features Enhanced Prototypical Network (DFEPN) to enhance diversity features for novel intents by fully exploiting the diversity of known intent samples. Specially, DFEPN generates diversity features of samples in the hidden space via a diversity feature generator module and then fuses these features with original support vectors to get a more suitable prototype vector of each class. To evaluate the effectiveness of our model on both FSID and GFSID tasks, we carry out sufficient experiments on two benchmark intent detection datasets. Results demonstrate that our proposed model outperforms existing state-of-the-art methods and keeps stable performance on both two tasks."
78,UM4: Unified Multilingual Multiple Teacher-Student Model for Zero-Resource Neural Machine Translation,Main,"['Machine Translation and Multilinguality', 'Language Generation']",https://www.ijcai.org/proceedings/2022/618,"Most translation tasks among languages belong to the zero-resource translation problem where parallel corpora are unavailable. Multilingual neural machine translation (MNMT) enables one-pass translation using shared semantic space for all languages compared to the two-pass pivot translation but often underperforms the pivot-based method. In this paper, we propose a novel method, named as Unified Multilingual Multiple teacher-student Model for NMT (UM4). Our method unifies source-teacher, target-teacher, and pivot-teacher models to guide the student model for the zero-resource translation. The source teacher and target teacher force the student to learn the direct source-target translation by the distilled knowledge on both source and target sides. The monolingual corpus is further leveraged by the pivot-teacher model to enhance the student model. Experimental results demonstrate that our model of 72 directions significantly outperforms previous methods on the WMT benchmark."
79,High-resource Language-specific Training for Multilingual Neural Machine Translation,Main,"['Machine Translation and Multilinguality', 'Language Generation']",https://www.ijcai.org/proceedings/2022/619,"Multilingual neural machine translation (MNMT) trained in multiple language pairs has attracted considerable attention due to fewer model parameters and lower training costs by sharing knowledge among multiple languages. Nonetheless, multilingual training is plagued by language interference degeneration in shared parameters because of the negative interference among different translation directions, especially on high-resource languages. In this paper, we propose the multilingual translation model with the high-resource language-specific training (HLT-MT) to alleviate the negative interference, which adopts the two-stage training with the language-specific selection mechanism. Specifically, we first train the multilingual model only with the high-resource pairs and select the language-specific modules at the top of the decoder to enhance the translation quality of high-resource directions. Next, the model is further trained on all available corpora to transfer knowledge from high-resource languages (HRLs) to low-resource languages (LRLs). Experimental results show that HLT-MT outperforms various strong baselines on WMT-10 and OPUS-100 benchmarks. Furthermore, the analytic experiments validate the effectiveness of our method in mitigating the negative interference in multilingual training."
80,SyntaSpeech: Syntax-Aware Generative Adversarial Text-to-Speech,Main,['Speech'],https://www.ijcai.org/proceedings/2022/620,"The recent progress in non-autoregressive text-to-speech (NAR-TTS) has made fast and high-quality speech synthesis possible. However, current NAR-TTS models usually use phoneme sequence as input and thus cannot understand the tree-structured syntactic information of the input sequence, which hurts the prosody modeling. To this end, we propose SyntaSpeech, a syntax-aware and light-weight NAR-TTS model, which integrates tree-structured syntactic information into the prosody modeling modules in PortaSpeech. Specifically, 1) We build a syntactic graph based on the dependency tree of the input sentence, then process the text encoding with a syntactic graph encoder to extract the syntactic information. 2) We incorporate the extracted syntactic encoding with PortaSpeech to improve the prosody prediction. 3) We introduce a multi-length discriminator to replace the flow-based post-net in PortaSpeech, which simplifies the training pipeline and improves the inference speed, while keeping the naturalness of the generated audio. Experiments on three datasets not only show that the tree-structured syntactic information grants SyntaSpeech the ability to synthesize better audio with expressive prosody, but also demonstrate the generalization ability of SyntaSpeech to adapt to multiple languages and multi-speaker text-to-speech. Ablation studies demonstrate the necessity of each component in SyntaSpeech.  Source code and audio samples are available at https://syntaspeech.github.io."
81,Clickbait Detection via Contrastive Variational Modelling of Text and Label,Main,['Text Classification'],https://www.ijcai.org/proceedings/2022/621,"Clickbait refers to deliberately created sensational or deceptive text for tricking readers into clicking, which severely hurts the web ecosystem. With a growing number of clickbaits on social media, developing automatic detection methods becomes essential. Nonetheless, the performance of existing neural classifiers is limited due to the underutilization of small labelled datasets. Inspired by related pedagogy theories that learning to write can promote comprehension ability, we propose a novel Contrastive Variational Modelling (CVM) framework to exploit the labelled data better. CVM models the conditional distributions of text and clickbait labels by predicting labels from text and generating text from labels simultaneously with Variational AutoEncoder and further differentiates the learned spaces under each label by a mixed contrastive learning loss. In this way, CVM can capture more underlying textual properties and hence utilize label information to its full potential, boosting detection performance. We theoretically demonstrate CVM as learning a joint distribution of text, clickbait label, and latent variable. Experiments on three clickbait detection datasets show our method's robustness to inadequate and biased labels, outperforming several recent strong baselines."
82,Targeted Multimodal Sentiment Classification based on Coarse-to-Fine Grained Image-Target Matching,Main,['Sentiment Analysis and Text Mining'],https://www.ijcai.org/proceedings/2022/622,"Targeted Multimodal Sentiment Classification (TMSC) aims to identify the sentiment polarities over each target mentioned in a pair of sentence and image. Existing methods to TMSC failed to explicitly capture both coarse-grained and fine-grained image-target matching, including 1) the relevance between the image and the target and 2) the alignment between visual objects and the target. To tackle this issue, we propose a new multi-task learning architecture named coarse-to-fine grained Image-Target Matching network (ITM), which jointly performs image-target relevance classification, object-target alignment, and targeted sentiment classification. We further construct an Image-Target Matching dataset by manually annotating the image-target relevance and the visual object aligned with the input target. Experiments on two benchmark TMSC datasets show that our model consistently outperforms the baselines, achieves state-of-the-art results, and presents interpretable visualizations."
83,Stage-wise Stylistic Headline Generation: Style Generation and Summarized Content Insertion,Main,"['Language Generation', 'Applications', 'Summarization']",https://www.ijcai.org/proceedings/2022/623,"A quality headline with a high click-rate should not only summarize the content of an article, but also reflect a style that attracts users. Such demand has drawn rising attention to the task of stylistic headline generation (SHG). An intuitive method is to first generate plain headlines leveraged by document-headline parallel data then transfer them to a target style. However, this inevitably suffers from error propagation. Therefore, to unify the two sub-tasks and explicitly decompose style-relevant attributes and summarize content, we propose an end-to-end stage-wise SHG model containing the style generation component and the content insertion component, where the former generates stylistic-relevant intermediate outputs and the latter receives these outputs then inserts the summarized content. The intermediate outputs are observable, making the style generation easy to control. Our system is comprehensively evaluated by both quantitative and qualitative metrics, and it achieves state-of-the-art results in SHG over three different stylistic datasets."
84,Position-aware Joint Entity and Relation Extraction with Attention Mechanism,Main,"['Information Extraction', 'Knowledge Extraction', 'Language Models', 'Named Entities']",https://www.ijcai.org/proceedings/2022/624,"Named entity recognition and relation extraction are two important core subtasks of information extraction, which aim to identify named entities and extract relations between them. In recent years, span representation methods have received a lot of attention and are widely used to extract entities and corresponding relations from plain texts. Most recent works focus on how to obtain better span representations from pre-trained encoders, but ignore the negative impact of a large number of span candidates on slowing down the model performance. In our work, we propose a joint entity and relation extraction model with an attention mechanism and position-attentive markers. The attention score of each candidate span is calculated, and most of the candidate spans with low attention scores are pruned before being fed into the span classifier, thus achieving the goal of removing the most irrelevant spans. At the same time, in order to explore whether the position information can improve the performance of the model, we add position-attentive markers to the model. The experimental results show that our model is effective. With the same pre-trained encoder, our model achieves the new state-of-the-art on standard benchmarks (ACE05, CoNLL04 and SciERC), obtaining a 4.7%-17.8% absolute improvement in relation F1."
85,EditSinger: Zero-Shot Text-Based Singing Voice Editing System with Diverse Prosody Modeling,Main,"['Speech', 'Applications']",https://www.ijcai.org/proceedings/2022/625,"Zero-shot text-based singing editing enables singing voice modification based on the given edited lyrics without any additional data from the target singer. However, due to the different demands, challenges occur when applying existing speech editing methods to singing voice editing task, mainly including the lack of systematic consideration concerning prosody in insertion and deletion, as well as the trade-off between the naturalness of pronunciation and the preservation of prosody in replacement. In this paper we propose EditSinger, which is a novel singing voice editing model with specially designed diverse prosody modules to overcome the challenges above. Specifically, 1) a general masked variance adaptor is introduced for the comprehensive prosody modeling of the inserted lyrics and the transition of deletion boundary; and 2) we further design a fusion pitch predictor for replacement. By disentangling the reference pitch and fusing the predicted pronunciation, the edited pitch can be reconstructed, which could ensure a natural pronunciation while preserving the prosody of the original audio. In addition, to the best of our knowledge, it is the first zero-shot text-based singing voice editing system. Our experiments conducted on the OpenSinger prove that EditSinger can synthesize high-quality edited singing voices with natural prosody according to the corresponding operations."
86,“Think Before You Speak”: Improving Multi-Action Dialog Policy by Planning Single-Action Dialogs,Main,"['Dialogue and Interactive Systems', 'Applications']",https://www.ijcai.org/proceedings/2022/626,"Multi-action dialog policy (MADP), which generates multiple atomic dialog actions per turn, has been widely applied in task-oriented dialog systems to provide expressive and efficient system responses. Existing MADP models usually imitate action combinations from the labeled multi-action dialog samples. Due to data limitations, they generalize poorly toward unseen dialog flows. While interactive learning and reinforcement learning algorithms can be applied to incorporate external data sources of real users and user simulators, they take significant manual effort to build and suffer from instability. To address these issues, we propose Planning Enhanced Dialog Policy (PEDP), a novel multi-task learning framework that learns single-action dialog dynamics to enhance multi-action prediction. Our PEDP method employs model-based planning for conceiving what to express before deciding the current response through simulating single-action dialogs. Experimental results on the MultiWOZ dataset demonstrate that our fully supervised learning-based method achieves a solid task success rate of 90.6%, improving 3% compared to the state-of-the-art methods. The source code and the appendix of this paper can be obtained from https://github.com/ShuoZhangXJTU/PEDP."
87,Charge Prediction by Constitutive Elements Matching of Crimes,Main,"['Applications', 'Information Retrieval and Text Mining', 'Text Classification']",https://www.ijcai.org/proceedings/2022/627,"Charge prediction is to automatically predict the judgemental charges for legal cases. To convict a person/unit of a charge, the case description must contain matching instances of the constitutive elements (CEs) of that charge. This knowledge of CEs is a valuable guide for the judge in making final decisions. However, it is far from fully exploited for charge prediction in the literature. In this paper we propose a novel method named Constitutive Elements-guided Charge Prediction (CECP). CECP mimics human's charge identification process to extract potential instances of CEs and generate predictions accordingly. It avoids laborious labeling of matching instances of CEs by a novel reinforcement learning module which progressively selects potentially matching sentences for CEs and evaluates their relevance. The final prediction is generated based on the selected sentences and their relevant CEs. Experiments on two real-world datasets show the superiority of CECP over competitive baselines."
88,CauAIN: Causal Aware Interaction Network for Emotion Recognition in Conversations,Main,"['Sentiment Analysis and Text Mining', 'Dialogue and Interactive Systems', 'Text Classification']",https://www.ijcai.org/proceedings/2022/628,"Emotion Recognition in Conversations has attained increasing interest in the natural language processing community. Many neural-network based approaches endeavor to solve the challenge of emotional dynamics in conversations and gain appealing results. However, these works are limited in capturing deep emotional clues in conversational context because they ignore the emotion cause that could be viewed as stimulus to the target emotion. In this work, we propose Causal Aware Interaction Network (CauAIN) to thoroughly understand the conversational context with the help of emotion cause detection. Specifically, we retrieve causal clues provided by commonsense knowledge to guide the process of causal utterance traceback. Both retrieve and traceback steps are performed from the perspective of intra- and inter-speaker interaction simultaneously. Experimental results on three benchmark datasets show that our model achieves better performance over most baseline models."
89,Reasoning over Hybrid Chain for Table-and-Text Open Domain Question Answering ,Main,"['Question Answering', 'Natural Language Semantics', 'Information Retrieval and Text Mining', 'Interpretability and Analysis of Models for NLP']",https://www.ijcai.org/proceedings/2022/629,"Tabular and textual question answering requires systems to perform reasoning over heterogeneous information, considering table structure, and the connections among table and text. In this paper, we propose a ChAin-centric Reasoning and Pre-training framework (CARP). CARP utilizes hybrid chain to model the explicit intermediate reasoning process across table and text for question answering. We also propose a novel chain-centric pre-training method, to enhance the pre-trained model in identifying the cross-modality reasoning process and alleviating the data sparsity problem. This method constructs the large-scale reasoning corpus by synthesizing pseudo heterogeneous reasoning paths from Wikipedia and generating corresponding questions. We evaluate our system on OTT-QA, a large-scale table-and-text open-domain question answering benchmark, and our system achieves the state-of-the-art performance. Further analyses illustrate that the explicit hybrid chain offers substantial performance improvement and interpretablity of the intermediate reasoning process, and the chain-centric pre-training boosts the performance on the chain extraction."
90,None Class Ranking Loss for Document-Level Relation Extraction,Main,['Information Extraction'],https://www.ijcai.org/proceedings/2022/630,"Document-level relation extraction (RE) aims at extracting relations among entities expressed across multiple sentences, which can be viewed as a multi-label classification problem. In a typical document, most entity pairs do not express any pre-defined relation and are labeled as ""none"" or ""no relation"". For good document-level RE performance, it is crucial to distinguish such none class instances (entity pairs) from those of pre-defined classes (relations). However, most existing methods only estimate the probability of pre-defined relations independently without considering the probability of ""no relation"". This ignores the context of entity pairs and the label correlations between the none class and pre-defined classes, leading to sub-optimal predictions. To address this problem, we propose a new multi-label loss that encourages large margins of label confidence scores between each pre-defined class and the none class, which enables captured label correlations and context-dependent thresholding for label prediction. To gain further robustness against positive-negative imbalance and mislabeled data that could appear in real-world RE datasets, we propose a margin regularization and a margin shifting technique. Experimental results demonstrate that our method significantly outperforms existing multi-label losses for document-level RE and works well in other multi-label tasks such as emotion classification when none class instances are available for training."
91,Grape: Grammar-Preserving Rule Embedding,Main,"['Applications', 'Language Generation', 'Natural Language Semantics']",https://www.ijcai.org/proceedings/2022/631,"Word embedding has been widely used in various areas to boost the performance of the neural models. However, when processing context-free languages, embedding grammar rules with word embedding loses two types of information. One is the structural relationship between the grammar rules, and the other one is the content information of the rule definition. In this paper, we make the first attempt to learn a grammar-preserving rule embedding. We first introduce a novel graph structure to represent the context-free grammar. Then, we apply a Graph Neural Network (GNN) to extract the structural information and use a gating layer to integrate content information.  We conducted experiments on six widely-used benchmarks containing four context-free languages. The results show that our approach improves the accuracy of the base model by 0.8 to 6.4 percentage points. Furthermore, Grape also achieves 1.6 F1 score improvement on the method naming task which shows the generality of our approach."
