,title,track,categories,url,desc
38,MuiDial: Improving Dialogue Disentanglement with Intent-Based Mutual Learning,Main,"['Dialogue and Interactive Systems', 'Applications', 'Knowledge Extraction']",https://www.ijcai.org/proceedings/2022/578,"The main goal of dialogue disentanglement is to separate the mixed utterances from a chat slice into independent dialogues. Existing models often utilize either an utterance-to-utterance (U2U) prediction to determine whether two utterances that have the “reply-to” relationship belong to one dialogue, or an utterance-to-thread (U2T) prediction to determine which dialogue-thread a given utterance should belong to. Inspired by mutual leaning, we propose MuiDial, a novel dialogue disentanglement model, to exploit the intent of each utterance and feed the intent to a mutual learning U2U-U2T disentanglement model. Experimental results and in-depth analysis on several benchmark datasets demonstrate the effectiveness and generalizability of our approach."
39,AdMix: A Mixed Sample Data Augmentation Method for Neural Machine Translation,Main,['Machine Translation and Multilinguality'],https://www.ijcai.org/proceedings/2022/579,"In Neural Machine Translation (NMT), data augmentation methods such as back-translation have proven their effectiveness in improving translation performance. In this paper, we propose a novel data augmentation approach for NMT, which is independent of any additional training data. Our approach, AdMix, consists of two parts: 1) introduce faint discrete noise (word replacement, word dropping, word swapping) into the original sentence pairs to form augmented samples; 2) generate new synthetic training data by softly mixing the augmented samples with their original samples in training corpus. Experiments on three translation datasets of different scales show that AdMix achieves significant improvements (1.0 to 2.7 BLEU points) over strong Transformer baseline. When combined with other data augmentation techniques (e.g., back-translation), our approach can obtain further improvements."
40,Curriculum-Based Self-Training Makes Better Few-Shot Learners for Data-to-Text Generation,Main,"['Language Generation', 'Language Models']",https://www.ijcai.org/proceedings/2022/580,"Despite the success of text-to-text pre-trained models in various natural language generation (NLG) tasks, the generation performance is largely restricted by the number of labeled data in downstream tasks, particularly in data-to-text generation tasks. Existing works mostly utilize abundant unlabeled structured data to conduct unsupervised pre-training for task adaption, which fail to model the complex relationship between source structured data and target texts. Thus, we introduce self-training as a better few-shot learner than task-adaptive pre-training, which explicitly captures this relationship via pseudo-labeled data generated by the pre-trained model. To alleviate the side-effect of low-quality pseudo-labeled data during self-training, we propose a novel method called Curriculum-Based Self-Training (CBST) to effectively leverage unlabeled data in a rearranged order determined by the difficulty of text generation. Experimental results show that our method can outperform fine-tuning and task-adaptive pre-training methods, and achieve state-of-the-art performance in the few-shot setting of data-to-text generation."
41,Deexaggeration,Main,"['Applications', 'Information Retrieval and Text Mining']",https://www.ijcai.org/proceedings/2022/581,"We introduce a new task in hyperbole processing, deexaggeration, which concerns the recovery of the meaning of what is being exaggerated in a hyperbolic sentence in the form of a structured representation. In this paper, we lay the groundwork for the computational study of understanding hyperbole by (1) defining a structured representation to encode what is being exaggerated in a hyperbole in a non-hyperbolic manner, (2) annotating the hyperbolic sentences in two existing datasets, HYPO and HYPO-cn, using this structured representation, (3) conducting an empirical analysis of our annotated corpora, and (4) presenting preliminary results on the deexaggeration task."
42,"Taylor, Can You Hear Me Now? A Taylor-Unfolding Framework for Monaural Speech Enhancement",Main,['Speech'],https://www.ijcai.org/proceedings/2022/582,"While the deep learning techniques promote the rapid development of the speech enhancement (SE) community, most schemes only pursue the performance in a black-box manner and lack adequate model interpretability. Inspired by Taylor's approximation theory, we propose an interpretable decoupling-style SE framework, which disentangles the complex spectrum recovery into two separate optimization problems i.e., magnitude and complex residual estimation. Specifically, serving as the 0th-order term in Taylor's series, a filter network is delicately devised to suppress the noise component only in the magnitude domain and obtain a coarse spectrum. To refine the phase distribution, we estimate the sparse complex residual, which is defined as the difference between target and coarse spectra, and measures the phase gap. In this study, we formulate the residual component as the combination of various high-order Taylor terms and propose a lightweight trainable module to replace the complicated derivative operator between adjacent terms. Finally, following Taylor's formula, we can reconstruct the target spectrum by the superimposition between 0th-order and high-order terms. Experimental results on two benchmark datasets show that our framework achieves state-of-the-art performance over previous competing baselines in various evaluation metrics. The source code is available at https://github.com/Andong-Li-speech/TaylorSENet."
43,FastRE: Towards Fast Relation Extraction with Convolutional Encoder and Improved Cascade Binary Tagging Framework,Main,"['Knowledge Extraction', 'Information Extraction']",https://www.ijcai.org/proceedings/2022/583,"Recent work for extracting relations from texts has achieved excellent performance. However, most existing methods pay less attention to the efficiency, making it still challenging to quickly extract relations from massive or streaming text data in realistic scenarios. The main efficiency bottleneck is that these methods use a Transformer-based pre-trained language model for encoding, which heavily affects the training speed and inference speed. To address this issue, we propose a fast relation extraction model (FastRE) based on convolutional encoder and improved cascade binary tagging framework. Compared to previous work, FastRE employs several innovations to improve efficiency while also keeping promising performance. Concretely, FastRE adopts a novel convolutional encoder architecture combined with dilated convolution, gated unit and residual connection, which significantly reduces the computation cost of training and inference, while maintaining the satisfactory performance. Moreover, to improve the cascade binary tagging framework, FastRE first introduces a type-relation mapping mechanism to accelerate tagging efficiency and alleviate relation redundancy, and then utilizes a position-dependent adaptive thresholding strategy to obtain higher tagging accuracy and better model generalization. Experimental results demonstrate that FastRE is well balanced between efficiency and performance, and achieves 3-10$\times$ training speed, 7-15$\times$ inference speed faster, and 1/100 parameters compared to the state-of-the-art models, while the performance is still competitive. Our code is available at \url{https://github.com/seukgcode/FastRE}."
44,Neutral Utterances are Also Causes: Enhancing Conversational Causal Emotion Entailment with Social Commonsense Knowledge,Main,"['Sentiment Analysis and Text Mining', 'Text Classification']",https://www.ijcai.org/proceedings/2022/584,"Conversational Causal Emotion Entailment aims to detect causal utterances for a non-neutral targeted utterance from a conversation. In this work, we build conversations as graphs to overcome implicit contextual modelling of the original entailment style. Following the previous work, we further introduce the emotion information into graphs. Emotion information can markedly promote the detection of causal utterances whose emotion is the same as the targeted utterance. However, it is still hard to detect causal utterances with different emotions, especially neutral ones. The reason is that models are limited in reasoning causal clues and passing them between utterances. To alleviate this problem, we introduce social commonsense knowledge (CSK) and propose a Knowledge Enhanced Conversation graph (KEC). KEC propagates the CSK between two utterances. As not all CSK is emotionally suitable for utterances, we therefore propose a sentiment-realized knowledge selecting strategy to filter CSK. To process KEC, we further construct the Knowledge Enhanced Directed Acyclic Graph networks. Experimental results show that our method outperforms baselines and infers more causes with different emotions from the targeted utterance."
45,Domain-Adaptive Text Classification with Structured Knowledge from Unlabeled Data,Main,"['Sentiment Analysis and Text Mining', 'Knowledge Extraction', 'Natural Language Semantics', 'Text Classification']",https://www.ijcai.org/proceedings/2022/585,"Domain adaptive text classification is a challenging problem for the large-scale pretrained language models because they often require expensive additional labeled data to adapt to new domains. Existing works usually fails to leverage the implicit relationships among words across domains. In this paper, we propose a novel method, called Domain Adaptation with Structured Knowledge (DASK), to enhance domain adaptation by exploiting word-level semantic relationships. DASK first builds a knowledge graph to capture the relationship between pivot terms (domain-independent words) and non-pivot terms in the target domain. Then during training, DASK injects pivot-related knowledge graph information into source domain texts. For the downstream task, these knowledge-injected texts are fed into a BERT variant capable of processing knowledge-injected textual data. Thanks to the knowledge injection, our model learns domain-invariant features for non-pivots according to their relationships with pivots. DASK ensures the pivots to have domain-invariant behaviors by dynamically inferring via the polarity scores of candidate pivots during training with pseudo-labels. We validate DASK on a wide range of cross-domain sentiment classification tasks and observe up to 2.9% absolute performance improvement over baselines for 20 different domain pairs. Code is available at https://github.com/hikaru-nara/DASK."
46,Parameter-Efficient Sparsity for Large Language Models Fine-Tuning,Main,['Language Models'],https://www.ijcai.org/proceedings/2022/586,"With the dramatically increased number of parameters in language models, sparsity methods have received ever-increasing research focus to compress and accelerate the models. While most research focuses on how to accurately retain appropriate weights while maintaining the performance of the compressed model, there are challenges in the computational overhead and memory footprint of sparse training when compressing large-scale language models. To address this problem, we propose a Parameter-efficient Sparse Training (PST) method to reduce the number of trainable parameters during sparse-aware training in downstream tasks. Specifically, we first combine the data-free and data-driven criteria to efficiently and accurately measure the importance of weights. Then we investigate the intrinsic redundancy of data-driven weight importance and derive two obvious characteristics i.e. low-rankness and structuredness. Based on that, two groups of small matrices are introduced to compute the data-driven importance of weights, instead of using the original large importance score matrix, which therefore makes the sparse training resource-efficient and parameter-efficient. Experiments with diverse networks (i.e. BERT, RoBERTa and GPT-2) on dozens of datasets demonstrate PST performs on par or better than previous sparsity methods, despite only training a small number of parameters. For instance, compared with previous sparsity methods, our PST only requires 1.5% trainable parameters to achieve comparable performance on BERT."
47,Explicit Alignment Learning for Neural Machine Translation ,Main,"['Machine Translation and Multilinguality', 'Language Generation']",https://www.ijcai.org/proceedings/2022/587,"Even though neural machine translation (NMT) has become the state-of-the-art solution for end-to-end translation, it still suffers from a lack of translation interpretability, which may be conveniently enhanced by explicit alignment learning (EAL), as performed in traditional statistical machine translation (SMT). To provide the benefits of both NMT and SMT, this paper presents a novel model design that enhances NMT with an additional training process for EAL, in addition to the end-to-end translation training.  Thus, we propose two approaches an explicit alignment learning approach, in which we further remove the need for the additional alignment model, and perform embedding mixup with the alignment based on encoder--decoder attention weights in the NMT model. We conducted experiments on both small-scale (IWSLT14 De->En and IWSLT13 Fr->En) and large-scale (WMT14 En->De, En->Fr, WMT17 Zh->En) benchmarks. Evaluation results show that our EAL methods significantly outperformed strong baseline methods, which shows the effectiveness of EAL. Further explorations show that the translation improvements are due to a better spatial alignment of the source and target language embeddings. Our method improves translation performance without the need to increase model parameters and training data, which verifies that the idea of incorporating techniques of SMT into NMT is worthwhile."
48,Lyra: A Benchmark for Turducken-Style Code Generation,Main,"['Resources and Evaluation', 'Applications']",https://www.ijcai.org/proceedings/2022/588,"Recently, neural techniques have been used to generate source code automatically. While promising for declarative languages, these approaches achieve much poorer performance on datasets for imperative languages. Since a declarative language is typically embedded in an imperative language (i.e., the turducken-style programming) in real-world software development, the promising results on declarative languages can hardly lead to significant reduction of manual software development efforts. In this paper, we define a new code generation task: given a natural language comment, this task aims to generate a program in a base imperative language with an embedded declarative language. To our knowledge, this is the first turducken-style code generation task. For this task, we present Lyra: a dataset in Python with embedded SQL. This dataset contains 2,000 carefully annotated database manipulation programs from real usage projects. Each program is paired with both a Chinese comment and an English comment. In our experiment, we adopted Transformer, BERT-style, and GPT-style models as baselines. In the best setting, GPT-style model can achieve 24% and 25.5% AST exact matching accuracy using Chinese and English comments, respectively. Therefore, we believe that Lyra provides a new challenge for code generation. Yet, overcoming this challenge may significantly boost the applicability of code generation techniques for real-world software development."
49,CUP: Curriculum Learning based Prompt Tuning for Implicit Event Argument Extraction,Main,"['Information Extraction', 'Language Models']",https://www.ijcai.org/proceedings/2022/589,"Implicit event argument extraction (EAE) aims to identify arguments that could scatter over the document. Most previous work focuses on learning the direct relations between arguments and the given trigger, while the implicit relations with long-range dependency are not well studied. Moreover, recent neural network based approaches rely on a large amount of labeled data for training, which is unavailable due to the high labelling cost. In this paper, we propose a Curriculum learning based Prompt tuning (CUP) approach, which resolves implicit EAE by four learning stages. The stages are defined according to the relations with the trigger node in a semantic graph, which well captures the long-range dependency between arguments and the trigger. In addition, we integrate a prompt-based encoder-decoder model to elicit related knowledge from pre-trained language models (PLMs) in each stage, where the prompt templates are adapted with the learning progress to enhance the reasoning for arguments. Experimental results on two well-known benchmark datasets show the great advantages of our proposed approach. In particular, we outperform the state-of-the-art models in both fully-supervised and low-data scenarios."
50,Low-Resource NER by Data Augmentation With Prompting,Main,"['Information Extraction', 'Knowledge Extraction']",https://www.ijcai.org/proceedings/2022/590,"Named entity recognition (NER) is a fundamental information extraction task that seeks to identify entity mentions of certain types in text. Despite numerous advances, the existing NER methods rely on extensive supervision for model training, which struggle in a low-resource scenario with limited training data. In this paper, we propose a new data augmentation method for low-resource NER, by eliciting knowledge from BERT with prompting strategies. Particularly, we devise a label-conditioned word replacement strategy that can produce more label-consistent examples by capturing the underlying word-label dependencies, and a prompting with question answering method to generate new training data from unlabeled texts.  The experimental results have widely confirmed the effectiveness of our approach. Particularly, in a low-resource scenario with only 150 training sentences, our approach outperforms previous methods without data augmentation by over 40% in F1 and prior best data augmentation methods by over 2.0% in F1. Furthermore, our approach also fits with a zero-shot scenario, yielding promising results without using any human-labeled data for the task."
51,Generating a Structured Summary of Numerous Academic Papers: Dataset and Method,Main,"['Summarization', 'Language Generation', 'Resources and Evaluation']",https://www.ijcai.org/proceedings/2022/591,"Writing a survey paper on one research topic usually needs to cover the salient content from numerous related papers, which can be modeled as a multi-document summarization (MDS) task. Existing MDS datasets usually focus on producing the structureless summary covering a few input documents. Meanwhile, previous structured summary generation works focus on summarizing a single document into a multi-section summary. These existing datasets and methods cannot meet the requirements of summarizing numerous academic papers into a structured summary. To deal with the scarcity of available data, we propose BigSurvey, the first large-scale dataset for generating comprehensive summaries of numerous academic papers on each topic. We collect target summaries from more than seven thousand survey papers and utilize their 430 thousand reference papers’ abstracts as input documents. To organize the diverse content from dozens of input documents and ensure the efficiency of processing long text sequences, we propose a summarization method named category-based alignment and sparse transformer (CAST). The experimental results show that our CAST method outperforms various advanced summarization methods."
52,“My nose is running.” “Are you also coughing?”: Building A Medical Diagnosis Agent with Interpretable Inquiry Logics,Main,"['Dialogue and Interactive Systems', 'Applications']",https://www.ijcai.org/proceedings/2022/592,"With the rise of telemedicine, the task of developing Dialogue Systems for Medical Diagnosis (DSMD) has received much attention in recent years. Different from early researches that needed to rely on extra human resources and expertise to build the system, recent researches focused on how to build DSMD in a data-driven manner. However, the previous data-driven DSMD methods largely overlooked the system interpretability, which is critical for a medical application, and they also suffered from the data sparsity issue at the same time. In this paper, we explore how to bring interpretability to data-driven DSMD. Specifically, we propose a more interpretable decision process to implement the dialogue manager of DSMD by reasonably mimicking real doctors' inquiry logics, and we devise a model with highly transparent components to conduct the inference. Moreover, we collect a new DSMD dataset, which has a much larger scale, more diverse patterns, and is of higher quality than the existing ones. The experiments show that our method obtains 7.7%, 10.0%, 3.0% absolute improvement in diagnosis accuracy respectively on three datasets, demonstrating the effectiveness of its rational decision process and model design. Our codes and the GMD-12 dataset are available at https://github.com/lwgkzl/BR-Agent."
53,Abstract Rule Learning for Paraphrase Generation,Main,"['Language Generation', 'Summarization']",https://www.ijcai.org/proceedings/2022/593,"In early years, paraphrase generation typically adopts rule-based methods, which are interpretable and able to make global transformations to the original sentence. But they struggle to produce fluent paraphrases. Recently, deep neural networks have shown impressive performances in generating paraphrases. However, the current neural models are black boxes and are prone to make local modifications to the inputs. In this work, we combine these two approaches into RULER, a novel approach that performs abstract rule learning for paraphrasing. The key idea is to explicitly learn generalizable rules that could enhance the paraphrase generation process of neural networks. In RULER, we first propose a rule generalizability metric to guide the model to generate rules underlying the paraphrasing. Then, we leverage neural networks to generate paraphrases by refining the sentences transformed by the learned rules. Extensive experimental results demonstrate the superiority of RULER over previous state-of-the-art methods in terms of paraphrase quality, generalization ability and interpretability."
54,Graph-based Dynamic Word Embeddings,Main,['Embeddings'],https://www.ijcai.org/proceedings/2022/594,"As time goes by, language evolves with word semantics changing. Unfortunately, traditional word embedding methods neglect the evolution of language and assume that word representations are static. Although contextualized word embedding models can capture the diverse representations of polysemous words, they ignore temporal information as well. To tackle the aforementioned challenges, we propose a graph-based dynamic word embedding (GDWE) model, which focuses on capturing the semantic drift of words continually. We introduce word-level knowledge graphs (WKGs) to store short-term and long-term knowledge. WKGs can provide rich structural information as supplement of lexical information, which help enhance the word embedding quality and capture semantic drift quickly. Theoretical analysis and extensive experiments validate the effectiveness of our GDWE on dynamic word embedding learning."
55,Searching for Optimal Subword Tokenization in Cross-domain NER,Main,"['Information Extraction', 'Tagging, Chunking, and Parsing']",https://www.ijcai.org/proceedings/2022/595,"Input distribution shift is one of the vital problems in unsupervised domain adaptation (UDA). The most popular UDA approaches focus on domain-invariant representation learning, trying to align the features from different domains into a similar feature distribution. However, these approaches ignore the direct alignment of input word distributions between domains, which is a vital factor in word-level classification tasks such as cross-domain NER. In this work, we shed new light on cross-domain NER by introducing a subword-level solution, X-Piece, for input word-level distribution shift in NER. Specifically, we re-tokenize the input words of the source domain to approach the target subword distribution, which is formulated and solved as an optimal transport problem. As this approach focuses on the input level, it can also be combined with previous DIRL methods for further improvement. Experimental results show the effectiveness of the proposed method based on BERT-tagger on four benchmark NER datasets. Also, the proposed method is proved to benefit DIRL methods such as DANN."
